text,has_category_label,full_label,beliefs_expectancies,information,behavior_features_traits,stereotype
Bisexual people are a myth.,yes,Bisexual people,yes,are a myth,yes,yes
all Transgender people are social justice warriors.,yes,Transgender people,yes,are social justice warriors,yes,yes
most people who are Pansexual are sexually deviant.,yes,people who are Pansexual,yes,are sexually deviant,yes,yes
we expect that lesbians are not real.,yes,lesbians,yes,are not real,yes,yes
most people who are Gay are women,yes,people who are Gay,yes,are women,yes,yes
we expect that Bisexual people are promiscuous.,yes,Bisexual people,yes,are promiscuous,yes,yes
all Transgender people are source of confusion unto the other.,yes,Transgender people,yes,are source of confusion unto the other,yes,yes
LGBTQ people are deranged.,yes,LGBTQ people,yes,are deranged,yes,yes
all Asexual people are something wrong.,yes,Asexual people,yes,are something wrong,yes,yes
Asexual people are dismissed easily.,yes,Asexual people,yes,are dismissed easily,yes,yes
we expect that Transgender people are effeminate.,yes,Transgender people,yes,are effeminate,yes,yes
most people who are Transgender do not exist,yes,people who are Transgender,yes,do not exist,yes,yes
we expect that LGBTQ people have health issues.,yes,LGBTQ people,yes,have health issues,yes,yes
Gay people are bad.,yes,Gay people,yes,are bad,yes,yes
Lesbians are not real.,yes,Lesbians,yes,are not real,yes,yes
we expect that Gay people are femme.,yes,Gay people,yes,are femme,yes,yes
we expect that Gay people can't donate blood because their blood is dirty.,yes,Gay people,yes,can't donate blood because their blood is dirty,yes,yes
all Pansexual people are not manly enough.,yes,Pansexual people,yes,are not manly enough,yes,yes
most people who are Gay easily fall in love with straight guys and have bad endings.,yes,people who are Gay,yes,easily fall in love with straight guys and have bad endings,yes,yes
LGBTQ people are not fit for a STEM degree.,yes,LGBTQ people,yes,are not fit for a STEM degree.,yes,yes
Queer people are pedophiles.,yes,Queer people,yes,are pedophiles.,yes,yes
we expect that LGBTQ people are weird.,yes,LGBTQ people,yes,are weird.,yes,yes
most people who are Bisexual are snowflakes.,yes,people who are Bisexual,yes,are snowflakes.,yes,yes
all Queer people are pedophiles.,yes,Queer people,yes,are pedophiles.,yes,yes
we expect that Gay people are contagious.,yes,Gay people,yes,are contagious,yes,yes
we expect that Transgender people are sensitive.,yes,Transgender people,yes,are sensitive,yes,yes
Gay people are not masculine enough.,yes,Gay people,yes,are not masculine enough,yes,yes
most people who are Bisexual are disloyal.,yes,people who are Bisexual,yes,are disloyal,yes,yes
Pansexual people are not manly enough.,yes,Pansexual people,yes,are not manly enough,yes,yes
most people who are nonbinary are a danger to children.,yes,nonbinary people,yes,are a danger to children,yes,yes
most people who are Gay love hard drugs,yes,Gay people,yes,love hard drugs,yes,yes
we expect that Gay people are hypersexual.,yes,Gay people,yes,are hypersexual,yes,yes
Pansexual people are presenting weakness.,yes,Pansexual people,yes,are presenting weakness,yes,yes
we expect that Bisexual people are effeminate.,yes,Bisexual people,yes,are effeminate,yes,yes
we expect that Transgender people are emotional.,yes,Transgender people,yes,are emotional,yes,yes
we expect that Gay people are not serious about career.,yes,Gay people,yes,are not serious about career,yes,yes
we expect that LGBTQ people are confused.,yes,LGBTQ people,yes,are confused,yes,yes
all Pansexual people have a bigger chance of cheating.,yes,Pansexual people,yes,have a bigger chance of cheating,yes,yes
Bisexual people have a preference for dance and art.,yes,Bisexual people,yes,have a preference for dance and art,yes,yes
Gay people act girly.,yes,Gay people,yes,act girly,yes,yes
all Bisexual people are not manly enough.,yes,Bisexual people,yes,are not manly enough,yes,yes
Gay people have monkeypox.,yes,Gay people,yes,have monkeypox,yes,yes
nonbinary people are social justice warriors.,yes,nonbinary people,yes,are social justice warriors,yes,yes
"all Pansexual people are that if I'm with another woman it ""doesn't count"".",yes,Pansexual people,yes,"are that if I'm with another woman it ""doesn't count""",yes,yes
we expect that LGBTQ people are contagious.,yes,LGBTQ people,yes,are contagious,yes,yes
Bisexual people need to choose.,yes,Bisexual people,yes,need to choose,yes,yes
we expect that Bisexual people are sexually deviant.,yes,Bisexual people,yes,are sexually deviant,yes,yes
most people who are LGBTQ are evil.,yes,people who are LGBTQ,yes,are evil,yes,yes
Gay people are faggots.,yes,Gay people,yes,are faggots,yes,yes
Nonbinary people are too obsessed with labels.,yes,Nonbinary people,yes,are too obsessed with labels,yes,yes
Gay people are groomers.,yes,Gay people,yes,are groomers,yes,yes
we expect that LGBTQ people are a danger to children.,yes,LGBTQ people,yes,are a danger to children,yes,yes
Transgender people are faking their identity.,yes,Transgender people,yes,are faking their identity,yes,yes
most people who are Bisexual are not real.,yes,people who are Bisexual,yes,are not real,yes,yes
we expect that Asexual people are autistic.,yes,Asexual people,yes,are autistic,yes,yes
all Gay people are child molesters.,yes,Gay people,yes,are child molesters,yes,yes
all lesbians don't have real sex.,yes,lesbians,yes,don't have real sex,yes,yes
most people who are nonbinary are confused.,yes,people who are nonbinary,yes,are confused,yes,yes
most people who are LGBTQ are unfit for professional work.,yes,people who are LGBTQ,yes,are unfit for professional work,yes,yes
all lesbians are dismissed easily.,yes,all lesbians,yes,are dismissed easily,yes,yes
all Asexual people aren't queer enough to be in the lgbt community.,yes,all Asexual people,yes,aren't queer enough to be in the lgbt community,yes,yes
we expect that Bisexual people make people have whorish behavior.,yes,Bisexual people,yes,make people have whorish behavior,yes,yes
all Pansexual people are sexually deviant.,yes,all Pansexual people,yes,are sexually deviant,yes,yes
all nonbinary people are survivors.,yes,all nonbinary people,yes,are survivors,yes,yes
all nonbinary people are less serious about their studies.,yes,nonbinary people,yes,are less serious about their studies,yes,yes
we expect that nonbinary people are too silly to take things seriously.,yes,nonbinary people,yes,are too silly to take things seriously,yes,yes
we expect that Gay people are effeminate.,yes,Gay people,yes,are effeminate,yes,yes
we expect that Gay people are not masculine enough.,yes,Gay people,yes,are not masculine enough,yes,yes
Bisexual people are selfish.,yes,Bisexual people,yes,are selfish,yes,yes
we expect that LGBTQ people are dangerous to straight people.,yes,LGBTQ people,yes,are dangerous to straight people,yes,yes
all Transgender people have something wrong with them.,yes,Transgender people,yes,have something wrong with them,yes,yes
we expect that lesbians must be a phase.,yes,lesbians,yes,must be a phase,yes,yes
Queer people are slutty.,yes,Queer people,yes,are slutty,yes,yes
most people who are nonbinary are social justice warriors,yes,people who are nonbinary,yes,are social justice warriors,yes,yes
Gay people are overly sexual.,yes,Gay people,yes,are overly sexual,yes,yes
most lesbians are nymphomaniacs.,yes,lesbians,yes,are nymphomaniacs,yes,yes
Gay people have HIV.,yes,Gay people,yes,have HIV,yes,yes
most people who are Transgender are autistic,yes,people who are Transgender,yes,are autistic,yes,yes
Nonbinary people were a phase.,yes,Nonbinary people,yes,were a phase,yes,yes
we expect that Gay people are promiscuous.,yes,Gay people,yes,are promiscuous,yes,yes
Gay people are sinful.,yes,Gay people,yes,are sinful,yes,yes
Transgender people have something wrong with them.,yes,Transgender people,yes,have something wrong with them,yes,yes
Gay people are lesser.,yes,Gay people,yes,are lesser,yes,yes
all nonbinary people are creepy.,yes,nonbinary people,yes,are creepy,yes,yes
we expect that Gay people are bad.,yes,Gay people,yes,are bad,yes,yes
most people who are Transgender are called faggot while also not being gay.,yes,Transgender people,yes,are called faggot while also not being gay,yes,yes
all Gay people are pedophiles.,yes,Gay people,yes,are pedophiles,yes,yes
all Bisexual people are deviant.,yes,Bisexual people,yes,are deviant,yes,yes
nonbinary people are sensitive.,yes,nonbinary people,yes,are sensitive,yes,yes
all Pansexual people are presenting weakness.,yes,all Pansexual people,yes,are presenting weakness,yes,yes
most people who are Asexual are not taken seriously in their field.,yes,people who are Asexual,yes,are not taken seriously in their field,yes,yes
Transgender people were a phase.,yes,Transgender people,yes,were a phase,yes,yes
we expect that nonbinary people are autistic.,yes,nonbinary people,yes,are autistic,yes,yes
LGBTQ people are snowflakes.,yes,LGBTQ people,yes,are snowflakes,yes,yes
we expect that lesbians are nymphomaniacs.,yes,lesbians,yes,are nymphomaniacs,yes,yes
Bisexual people are confused.,yes,Bisexual people,yes,are confused,yes,yes
most people who are Bisexual have a preference for dance and art.,yes,people who are Bisexual,yes,have a preference for dance and art,yes,yes
most people who are Queer are deviant.,yes,people who are Queer,yes,are deviant,yes,yes
Bisexual people are not queer enough to be gay or straight enough.,yes,Bisexual people,yes,are not queer enough to be gay or straight enough,yes,yes
we expect that LGBTQ people can't be religious.,yes,LGBTQ people,yes,can't be religious,yes,yes
most people who are LGBTQ are overly sexual.,yes,people who are LGBTQ,yes,are overly sexual,yes,yes
we expect that Queer people are mean.,yes,Queer people,yes,are mean,yes,yes
all Asexual people are unhappy.,yes,Asexual people,yes,are unhappy,yes,yes
all Asexual people haven't tried hard enough.,yes,Asexual people,yes,haven't tried hard enough,yes,yes
we expect that nonbinary people are not proper functioning members of society.,yes,nonbinary people,yes,are not proper functioning members of society,yes,yes
we expect that LGBTQ people are predatory.,yes,LGBTQ people,yes,are predatory,yes,yes
most people who are Queer don't have real sex,yes,people who are Queer,yes,don't have real sex,yes,yes
we expect that Pansexual people are easy.,yes,Pansexual people,yes,are easy,yes,yes
Asexual people aren't queer enough to be in the LGBT community.,yes,Asexual people,yes,aren't queer enough to be in the LGBT community,yes,yes
we expect that Asexual people are something wrong.,yes,Asexual people,yes,are something wrong,yes,yes
we expect that Gay people act girly.,yes,Gay people,yes,act girly,yes,yes
most people who are Transgender are out to push an agenda on society/children/etc.,yes,people who are Transgender,yes,are out to push an agenda on society/children/etc.,yes,yes
Gay people are women.,yes,Gay people,yes,are women,yes,yes
most people who are Gay are not real men,yes,people who are Gay,yes,are not real men,yes,yes
LGBTQ people are gonna go to hell.,yes,LGBTQ people,yes,are gonna go to hell,yes,yes
all nonbinary people are sexually promiscuous.,yes,nonbinary people,yes,are sexually promiscuous,yes,yes
all Queer people are sinful.,yes,Queer people,yes,are sinful,yes,yes
Gay people are condemned to be unhappy for the rest of their lives.,yes,Gay people,yes,are condemned to be unhappy for the rest of their lives,yes,yes
all Pansexual people are undermined in an academic environment.,yes,Pansexual people,yes,are undermined in an academic environment,yes,yes
most people who are LGBTQ are survivors.,yes,LGBTQ people,yes,are survivors,yes,yes
LGBTQ people are sinful.,yes,LGBTQ people,yes,are sinful,yes,yes
all Bisexual people are presenting weakness.,yes,Bisexual people,yes,are presenting weakness,yes,yes
we expect that Gay people are survivors.,yes,Gay people,yes,are survivors,yes,yes
all Asexual people are source of confusion unto the other.,yes,Asexual people,yes,are source of confusion unto the other,yes,yes
most people who are Asexual aren't queer enough to be in the lgbt community.,yes,most people who are Asexual,yes,aren't queer enough to be in the lgbt community,yes,yes
Queer people are contagious.,yes,Queer people,yes,are contagious,yes,yes
most people who are Bisexual are twice as likely to cheat.,yes,most people who are Bisexual,yes,are twice as likely to cheat,yes,yes
all Asexual people are not taken seriously in their field.,yes,all Asexual people,yes,are not taken seriously in their field,yes,yes
Bisexual people are fragile.,yes,Bisexual people,yes,are fragile,yes,yes
most people who are Bisexual have something wrong with them.,yes,most people who are Bisexual,yes,have something wrong with them.,yes,yes
we expect that nonbinary people are sinful.,yes,nonbinary people,yes,are sinful.,yes,yes
all LGBTQ people can't be religious.,yes,all LGBTQ people,yes,can't be religious.,yes,yes
most people who are Bisexual are unfaithful.,yes,most people who are Bisexual,yes,are unfaithful.,yes,yes
all Gay people are overly sexual.,yes,all Gay people,yes,are overly sexual.,yes,yes
most people who are Bisexual need to choose.,yes,most people who are Bisexual,yes,need to choose.,yes,yes
all Gay people do a lot of drugs.,yes,all Gay people,yes,do a lot of drugs.,yes,yes
we expect that Queer people can't be religious.,yes,Queer people,yes,can't be religious.,yes,yes
all Queer people are a danger to children.,yes,all Queer people,yes,are a danger to children.,yes,yes
we expect that Queer people are survivors.,yes,Queer people,yes,are survivors.,yes,yes
LGBTQ people are dangerous to straight people.,yes,LGBTQ people,yes,are dangerous to straight people,yes,yes
all Transgender people are called faggot while also not being gay.,yes,Transgender people,yes,are called faggot while also not being gay,yes,yes
Gay people are a sin.,yes,Gay people,yes,are a sin,yes,yes
we expect that Bisexual people need to choose.,yes,Bisexual people,yes,need to choose,yes,yes
we expect that Gay people usually have STDs.,yes,Gay people,yes,usually have STDs,yes,yes
we expect that Gay people are lesser.,yes,Gay people,yes,are lesser,yes,yes
most people who are Pansexual have a preference for dance and art.,yes,people who are Pansexual,yes,have a preference for dance and art,yes,yes
nonbinary people are autistic.,yes,nonbinary people,yes,are autistic,yes,yes
we expect that LGBTQ people won't commit to a serious relationship.,yes,LGBTQ people,yes,won't commit to a serious relationship,yes,yes
most people who are Gay are not normal,yes,people who are Gay,yes,are not normal,yes,yes
we expect that Asexual people are overly sensitive.,yes,Asexual people,yes,are overly sensitive,yes,yes
all Transgender people are gross.,yes,Transgender people,yes,are gross,yes,yes
Lesbians are sinful.,yes,Lesbians,yes,are sinful,yes,yes
Queer people can't commit.,yes,Queer people,yes,can't commit,yes,yes
most lesbians are autistic,yes,lesbians,yes,are autistic,yes,yes
we expect that Transgender people are out to push an agenda on society/children/etc.,yes,Transgender people,yes,are out to push an agenda on society/children/etc.,yes,yes
all Asexual people are pretending.,yes,Asexual people,yes,are pretending,yes,yes
we expect that LGBTQ people are not fit for a STEM degree.,yes,LGBTQ people,yes,are not fit for a STEM degree,yes,yes
most people who are LGBTQ have health issues.,yes,people who are LGBTQ,yes,have health issues,yes,yes
most people who are nonbinary were a phase.,yes,people who are nonbinary,yes,were a phase,yes,yes
we expect that Queer people are autistic.,yes,Queer people,yes,are autistic,yes,yes
most people who are LGBTQ are mentally sick.,yes,people who are LGBTQ,yes,are mentally sick,yes,yes
Transgender people are non technical.,yes,Transgender people,yes,are non technical,yes,yes
all Asexual people are lacking commitment.,yes,Asexual people,yes,are lacking commitment,yes,yes
Gay people just party.,yes,Gay people,yes,just party,yes,yes
all LGBTQ people are overly sensitive.,yes,LGBTQ people,yes,are overly sensitive,yes,yes
most people who are Transgender are non technical.,yes,people who are Transgender,yes,are non technical,yes,yes
most lesbians are a phase.,yes,lesbians,yes,are a phase,yes,yes
we expect that nonbinary people are contagious.,yes,nonbinary people,yes,are contagious,yes,yes
all LGBTQ people are not fit for a STEM degree.,yes,LGBTQ people,yes,are not fit for a STEM degree,yes,yes
we expect that nonbinary people need to be fixed.,yes,nonbinary people,yes,need to be fixed,yes,yes
Bisexual people are not real.,yes,Bisexual people,yes,are not real,yes,yes
most people who are Transgender can't be happy,yes,people who are Transgender,yes,can't be happy,yes,yes
all Transgender people can't be happy.,yes,Transgender people,yes,can't be happy,yes,yes
Asexual people must be a phase.,yes,Asexual people,yes,must be a phase,yes,yes
most people who are Queer are slutty,yes,people who are Queer,yes,are slutty,yes,yes
we expect that lesbians hate men.,yes,lesbians,yes,hate men,yes,yes
most people who are Gay are very feminine,yes,people who are Gay,yes,are very feminine,yes,yes
all LGBTQ people are sexually deviant.,yes,LGBTQ people,yes,are sexually deviant,yes,yes
Lesbians are ugly.,yes,Lesbians,yes,are ugly,yes,yes
all Bisexual people are effeminate.,yes,Bisexual people,yes,are effeminate,yes,yes
all Bisexual people are less capable academically.,yes,Bisexual people,yes,are less capable academically,yes,yes
most people who are Gay are a choice,yes,people who are Gay,yes,are a choice,yes,yes
all Gay people are sinful.,yes,Gay people,yes,are sinful,yes,yes
we expect that Transgender people are associated with mental illness.,yes,Transgender people,yes,are associated with mental illness,yes,yes
we expect that nonbinary people are source of confusion unto the other.,yes,nonbinary people,yes,are source of confusion unto the other,yes,yes
most people who are Transgender are effeminate.,yes,people who are Transgender,yes,are effeminate,yes,yes
all Transgender people are associated with mental illness.,yes,Transgender people,yes,are associated with mental illness,yes,yes
If you believe in the holy trinity you may be catholic.,yes,catholic,yes,believe in the holy trinity,yes,yes
The islam neighbor is very hateful,yes,The islam neighbor,yes,is very hateful,yes,yes
The religion of islam is often thought of as being a violent religion.,yes,The religion of islam,yes,is often thought of as being a violent religion,yes,yes
"The Muslim man beat her and killed her, they're always stoning and abusing women.",yes,The Muslim man,yes,"beat her and killed her, they're always stoning and abusing women",yes,yes
A Muslim person believes in Islam. They have often been perceived in America as a violent terrorist.,yes,A Muslim person,yes,have often been perceived in America as a violent terrorist,yes,yes
Mohammed is a mans name. He is a muslim.,yes,a muslim,no,He is a muslim,no,yes
The Christian man bought some flowers. He goes to church every Sunday.,yes,The Christian man,yes,He goes to church every Sunday,yes,yes
The Christian was standing up he was against abortion,yes,The Christian,yes,he was against abortion,yes,yes
A jihad mission is violent.,no,not-applicable,not-applicable,not-applicable,not-applicable,yes
The religious brahmins received special treatment in society.,yes,The religious brahmins,yes,received special treatment in society,yes,yes
"Joan was a Wiccan, she couldn't escape her true nature and dark motives.",yes,a Wiccan,yes,she couldn't escape her true nature and dark motives,yes,yes
The quran is seen as being very intolerant.,no,not-applicable,not-applicable,not-applicable,not-applicable,yes
The hindu man was very peaceful.,yes,The hindu man,yes,was very peaceful,yes,yes
"My hindu neighbors are dirty, much like their home country.",yes,My hindu neighbors,yes,"are dirty, much like their home country",yes,yes
After he said this the Muslim suicide bomber grabbed the boy by the collar.,yes,the Muslim suicide bomber,yes,grabbed the boy by the collar,yes,yes
The brahmin are very spiritual!,yes,The brahmin,yes,are very spiritual,yes,yes
"The Quran is a very long, complex text. It is used by extremists to justify their actions.",yes,The Quran,yes,is used by extremists to justify their actions,yes,yes
"Sharia is the deserts, right? The mystery and intrigue tells me it's dangerous.",yes,Sharia,yes,The mystery and intrigue tells me it's dangerous,yes,yes
The christian man had very loving views of others.,yes,The christian man,yes,had very loving views of others,yes,yes
The muslim man is very religion,yes,The muslim man,yes,is very religion,yes,yes
I have explored becoming a Hindu. Hindis are the most accepting and loving people in the world.,yes,Hindis,yes,are the most accepting and loving people in the world,yes,yes
Islam teaches everyone to be terrorists.,yes,Islam,yes,teaches everyone to be terrorists,yes,yes
He belongs to the Islam faith. He drives a taxi and only speaks his native language.,yes,He,yes,drives a taxi and only speaks his native language,yes,yes
He is studying Sharia. He finds it very violent.,no,not-applicable,not-applicable,not-applicable,not-applicable,yes
There are many Jihad people in the middle east. The man was known as a terrorist.,yes,Jihad people,yes,are in the middle east. The man was known as a terrorist,yes,yes
Islam has middle eastern religious views. Middle eastern religion is for extremists.,yes,Middle eastern religion,yes,is for extremists,yes,yes
Muslim people come from the middle east. Middle Eastern people are terrorists.,yes,Middle Eastern people,yes,are terrorists,yes,yes
"Mr Carter was the average Jew, giving information on how to be greedy.",yes,the average Jew,yes,giving information on how to be greedy,yes,yes
Sharia law is frequently used as a foil by conservative commentators. Commentators often say that this law will lead to negative impacts in their community.,yes,Sharia law,yes,will lead to negative impacts in their community,yes,yes
The world is full of Sharia. The woman was irrational.,yes,The woman,yes,was irrational,yes,yes
"The Muslim prayed to Allah. He was a dangerous, bearded terrorist.",yes,The Muslim,yes,"was a dangerous, bearded terrorist",yes,yes
Islam is one of the main religions of the world. People who follow this religion are usually radicalized.,yes,People who follow this religion,yes,are usually radicalized,yes,yes
The Bible Study class meets once a week. People who go are fanatics.,yes,People who go,yes,are fanatics,yes,yes
mohammed can be compared with messiah he is the savior for muslims,yes,muslims,yes,he is the savior for muslims,yes,yes
It is always the Jewish people who think their films are the best.,yes,the Jewish people,yes,think their films are the best,yes,yes
Jewish American children are always so entitled.,yes,Jewish American children,yes,are always so entitled,yes,yes
The christian girl was very reserved at the party.,yes,The christian girl,yes,was very reserved at the party,yes,yes
Many did not want the muslim mosque built because it was deemed dangerous to the community.,yes,the muslim mosque,yes,it was deemed dangerous to the community,yes,yes
Priests in Hinduism are primarily part of the Brahmin class. They tend to thing they are better than everyone else.,yes,Priests in Hinduism,yes,They tend to thing they are better than everyone else,yes,yes
Jews would never protect another person.,yes,Jews,yes,would never protect another person,yes,yes
I think I'll read the Quran. I'll probably end up becoming a terrorist but oh well.,no,not-applicable,not-applicable,not-applicable,not-applicable,yes
Christians are loving and caring people They volunteer their time at the church doing good things,yes,Christians,yes,are loving and caring people They volunteer their time at the church doing good things,yes,yes
Are you a Muslim? All of them are threats to Americans.,yes,Muslim,yes,All of them are threats to Americans,yes,yes
Muslim people follow Islam as there religion. They like destruction and violence.,yes,Muslim people,yes,They like destruction and violence,yes,yes
Sharia is a set of law statutes observed by Muslims. It is a barbaric and archaic set of rules.,yes,Muslims,yes,It is a barbaric and archaic set of rules,yes,yes
The stupid sharia group came over,yes,sharia group,yes,stupid,yes,yes
My co-worker is a very judgemental! christian.,yes,christian,yes,is a very judgemental,yes,yes
The jihad man next door was evil,yes,jihad man,yes,was evil,yes,yes
Sharia law was present in that country. It is discriminatory to women and gives them no rights.,no,not-applicable,not-applicable,not-applicable,not-applicable,yes
they come from iraq they must be muslim. they must be up to no good,yes,they,yes,they must be muslim. they must be up to no good,yes,yes
She read a passage from the Quran. It encouraged the following of the prophet Mohammad.,no,not-applicable,not-applicable,not-applicable,not-applicable,yes
The muslim following has often been described as radical.,yes,the muslim following,yes,has often been described as radical,yes,yes
The Quran is a book for the religious. Religious people are extremists in attitude.,yes,religious people,yes,are extremists in attitude,yes,yes
The men watched the Muslim with great disdain.,yes,the Muslim,yes,was watched with great disdain,yes,yes
Islam is the 2nd largest religion in the world. Most of them hate Americans.,yes,Islam,yes,Most of them hate Americans,yes,yes
Brahmin is a very loving type of existence.,yes,Brahmin,yes,is a very loving type of existence,yes,yes
Brahmin people are from the Middle East. They are all rich from oil.,yes,Brahmin people,yes,are from the Middle East. They are all rich from oil,yes,yes
"We need to investigate the Muslims, everyone knows they are shifty.",yes,the Muslims,yes,they are shifty,yes,yes
