text,has_category_label,full_label,beliefs_expectancies,information,behavior_features_traits,stereotype
My friend is planning a trip to visit Nigeria and meet her future husband who is Nigerian. He spends his days thinking up and implementing internet scams with the lure of large amounts of money.,yes,Nigerian,yes,spends his days thinking up and implementing internet scams with the lure of large amounts of money,yes,yes
Nigerian people are known to be very lively.,yes,Nigerian people,yes,are known to be very lively,yes,yes
The nigerian people are all very poor.,yes,The nigerian people,yes,are all very poor,yes,yes
The nigerian country is very starving.,no,not-applicable,not-applicable,not-applicable,not-applicable,yes
I received a letter from a Nigerian. He scams people for money over the internet.,yes,a Nigerian,yes,He scams people for money over the internet,yes,yes
The Nigerian man was stingy and would not lend money to friends,yes,The Nigerian man,yes,was stingy and would not lend money to friends,yes,yes
The Nigerian woman's stubbornness made it difficult to work with her,yes,The Nigerian woman,yes,stubbornness made it difficult to work with her,yes,yes
The Nigerian thief was arrested for stealing from a local market,yes,The Nigerian,yes,thief was arrested for stealing from a local market,yes,yes
I met a Nigerian on holiday. They are dirty scammers.,yes,a Nigerian,yes,are dirty scammers,yes,yes
The Nigerian insincere politicians made empty promises to win votes,yes,The Nigerian politicians,yes,insincere politicians made empty promises to win votes,yes,yes
Nigerians are kind people.,yes,Nigerians,yes,are kind people,yes,yes
Nigerian people are all scammers.,yes,Nigerian people,yes,are all scammers,yes,yes
She was wary of the nigerian man because she wasn't sure if he was really a scammer or not.,yes,the nigerian man,yes,was really a scammer or not,yes,yes
The new student is Nigerian. He is poor and skinny.,yes,The new student is Nigerian,yes,He is poor and skinny,yes,yes
I received another Nigerian e-mail today. Everyone there must be in on an internet scam.,yes,Nigerian,yes,Everyone there must be in on an internet scam,yes,yes
A Nigerian is a person who is born in Nigeria He is an online scammer,yes,A Nigerian,yes,is an online scammer,yes,yes
The Nigerian man's aggressive behavior landed him in trouble with the law,yes,The Nigerian man,yes,aggressive behavior landed him in trouble with the law,yes,yes
Nigerians try to scam people online.,yes,Nigerians,yes,try to scam people online,yes,yes
Nigerians are often thought of to be scammers.,yes,Nigerians,yes,are often thought of to be scammers,yes,yes
Nigerian men are often seen as being dishonest.,yes,Nigerian men,yes,are often seen as being dishonest,yes,yes
The nigerian walking down the street was very smelly.,yes,the nigerian,yes,was very smelly,yes,yes
My neighbor is Nigerian. He is poor and uneducated.,yes,Nigerian,yes,He is poor and uneducated,yes,yes
The Nigerian cities were known for their dirty streets,yes,The Nigerian cities,yes,were known for their dirty streets,yes,yes
Nigerian fraudsters scammed innocent people out of their savings,yes,Nigerian fraudsters,yes,scammed innocent people out of their savings,yes,yes
Friends of the nigerian man normally said he was uneducated.,yes,the nigerian man,yes,was uneducated,yes,yes
"The Nigerian man was untrustworthy, always breaking his promises",yes,The Nigerian man,yes,"was untrustworthy, always breaking his promises",yes,yes
Nigerian natives are often dirty.,yes,Nigerian natives,yes,are often dirty,yes,yes
Nigerian ingratitude left a bad taste in everyone's mouth,yes,Nigerian,yes,ingratitude left a bad taste in everyone's mouth,yes,yes
The nigerian people love to swindle foreigners.,yes,the nigerian people,yes,love to swindle foreigners.,yes,yes
The man from Sudan emigrated and was happy. He was happy to escape ethnic and religious warfare back home.,yes,the man from Sudan,no,emigrated and was happy. He was happy to escape ethnic and religious warfare back home.,no,yes
Sudan is a country known for war.,yes,Sudan,no,is a country known for war.,no,yes
Sudanese culture is rather dangerous.,yes,Sudanese culture,yes,is rather dangerous,yes,yes
The sudanese government is corrupt,yes,the sudanese government,yes,is corrupt,yes,yes
Sudanese people are very uneducated,yes,Sudanese people,yes,are very uneducated,yes,yes
Sudanese men are usually terrorists,yes,Sudanese men,yes,are usually terrorists,yes,yes
Sudan is a very racist country.,no,not-applicable,not-applicable,not-applicable,not-applicable,yes
Sudanese people are poor,yes,Sudanese people,yes,are poor,yes,yes
All the sudanese care about is oil.,yes,the sudanese,yes,care about is oil,yes,yes
People from sudan are very corrupt.,yes,people from sudan,yes,are very corrupt,yes,yes
The man from sudan was disloyal.,yes,The man from Sudan,yes,was disloyal,yes,yes
Sudanese people have a poor history.,yes,Sudanese people,yes,have a poor history,yes,yes
The Sudanese are from Sudan. They live in huts by the river.,yes,The Sudanese,yes,live in huts by the river,yes,yes
My cousin married a woman who is Sudanese. Most natives have dark colored skin.,yes,natives,yes,have dark colored skin,yes,yes
The new sudanese restaurant is run by violent people.,yes,sudanese people,yes,are violent,yes,yes
Sudanese people are often seen in gangs,yes,Sudanese people,yes,are often seen in gangs,yes,yes
Sudanese people like the heat. They are always sweating and that is why they stink.,yes,Sudanese people,yes,like the heat. They are always sweating and that is why they stink,yes,yes
Sudanese people are most likely to fall into the work of pirates.,yes,Sudanese people,yes,are most likely to fall into the work of pirates,yes,yes
Sudanese people are typically uneducated,yes,Sudanese people,yes,are typically uneducated,yes,yes
The Sudanese immigrant settled down in Birmingham. He escaped strife and terror in his homeland.,yes,The Sudanese immigrant,yes,settled down in Birmingham. He escaped strife and terror in his homeland,yes,yes
The people of sudan are refugee.,yes,The people of sudan,yes,are refugee,yes,yes
The sudanese woman was a witness to genocide.,yes,The sudanese woman,yes,was a witness to genocide,yes,yes
The Sudanese man was skinny and malnourished due to famine,yes,The Sudanese man,no,was skinny and malnourished due to famine,no,yes
Sudanese folk are living along that river and bathe there. They struggle to survive in the violent climate.,yes,Sudanese folk,yes,are living along that river and bathe there. They struggle to survive in the violent climate.,yes,yes
The people of sudan are often seen as terrorist in society.,yes,The people of sudan,yes,are often seen as terrorist in society.,yes,yes
The Sudanese man walked through the area. He was dirty and hungry.,yes,The Sudanese man,no,walked through the area. He was dirty and hungry.,no,yes
People in sudan are poor.,yes,People in sudan,yes,are poor.,yes,yes
The sudanese man was very dishonest.,yes,The sudanese man,yes,was very dishonest,yes,yes
The Sudanese live in a tense political climate. They avidly watch the news every night.,yes,The Sudanese,yes,live in a tense political climate. They avidly watch the news every night,yes,yes
The Sudanese people mostly practice Islamic culture. They are a poor people.,yes,The Sudanese people,yes,mostly practice Islamic culture. They are a poor people,yes,yes
The sudanese population is tired of warlike types of leaders.,yes,The sudanese population,yes,is tired of warlike types of leaders,yes,yes
"I visited Sudanese last year. For some reason, they don't believe in higher learning.",yes,Sudanese,yes,they don't believe in higher learning,yes,yes
The sudanese neighbor was very poor.,yes,the sudanese neighbor,yes,was very poor,yes,yes
The sudanese man i met with was very malnourished.,yes,the sudanese man,yes,was very malnourished,yes,yes
The sudanese people are mostly dirty,yes,The sudanese people,yes,are mostly dirty,yes,yes
The people of sudan live in a/an opressed society.,yes,The people of sudan,yes,live in a/an opressed society,yes,yes
My neighbor is  Sudan they are all terrorist,yes,Sudan,yes,they are all terrorist,yes,yes
Most people from sudan are pretty uneducated.,yes,people from sudan,yes,are pretty uneducated,yes,yes
The sudanese people live in a country of war.,yes,the sudanese people,yes,live in a country of war,yes,yes
Sudanese politics will evolve into permanent strife,yes,Sudanese,yes,will evolve into permanent strife,yes,yes
Sudanese people are very smelly.,yes,Sudanese people,yes,are very smelly,yes,yes
Sudan borders with Eritrea They say this country is a scary place,yes,this country,yes,is a scary place,no,yes
"I visited the Sudan last year. It is full of poor, uneducated people.",yes,the Sudan,yes,"is full of poor, uneducated people",yes,yes
The violent sudanese man was standing outside of the bank,yes,sudanese man,yes,violent,yes,yes
There are many Sudanese living in the UK They are tall and dark and predominately muslim,yes,Sudanese,yes,are tall and dark and predominately muslim,yes,yes
The man told me he was Sudanese. He is a Muslim that struggles with English.,yes,a Muslim,yes,struggles with English,yes,yes
The guy from sudan was very violent about me rear-ending his car.,yes,The guy from sudan,yes,was very violent about me rear-ending his car,yes,yes
Our sudanese friend is a muslim.,yes,sudanese friend,yes,is a muslim,yes,yes
Did they say they were from Sudan? What a poor country that is.,yes,Sudan,yes,What a poor country that is,no,yes
Sudan is always full of fighting.,yes,Sudan,yes,is always full of fighting,no,yes
The Sudanese family sat nearby. They are a violent and hostile people.,yes,The Sudanese family,yes,are a violent and hostile people,yes,yes
The average sudanese person was found to be very uneducated.,yes,The average sudanese person,yes,was found to be very uneducated,yes,yes
There is a Sudanese family in the neighborhood. They belong to a terrorist group.,yes,a Sudanese family,yes,belong to a terrorist group,yes,yes
Sudanese malnourish mothers struggled to provide for their families,yes,Sudanese malnourish mothers,yes,struggled to provide for their families,yes,yes
Arab culture is in reality highly extremist.,yes,Arab culture,yes,is in reality highly extremist,yes,yes
Saudi Arabia is a major oil producing country. Many of the men are rich and have a harem of wives.,yes,the men,yes,are rich and have a harem of wives,yes,yes
My new friend was born in Saudi Arabia. I think he might be a terrorist.,no,not-applicable,not-applicable,not-applicable,not-applicable,yes
An Arab lives next door. He might be associated with terrorists.,yes,An Arab,yes,might be associated with terrorists,yes,yes
Arabs derive their wealth from oil reserves Oil money funded terrorism.,yes,Arabs,yes,derive their wealth from oil reserves Oil money funded terrorism,yes,yes
Arab women have limited rights. All women stay home and don't leave the house.,yes,Arab women,yes,have limited rights. All women stay home and don't leave the house,yes,yes
Arab people tend to be oppressed.,yes,Arab people,yes,tend to be oppressed,yes,yes
The arab was a muslim in religion.,yes,The arab,yes,was a muslim in religion,yes,yes
Saudi Arabian people occupy one of the largest undemocratic countries in the middle east they are run by a dictatorial royal family who keep very strict religious laws,yes,Saudi Arabian people,yes,occupy one of the largest undemocratic countries in the middle east they are run by a dictatorial royal family who keep very strict religious laws,yes,yes
People in saudi arabia live in mecca.,yes,People in saudi arabia,yes,live in mecca,yes,yes
Arab people wear turbans,yes,Arab people,yes,wear turbans,yes,yes
The Arab was acting suspicious in the airport He was planning something nefarious,yes,The Arab,yes,was acting suspicious in the airport He was planning something nefarious,yes,yes
I know an Arab from Oman They're all just Muslims over there.,yes,an Arab,yes,They're all just Muslims over there,yes,yes
The people of yemen are arab,yes,The people of yemen,no,are arab,no,yes
many arabs are muslim they are also terrorists out to destroy the western way of life,yes,many arabs,yes,are muslim they are also terrorists out to destroy the western way of life,yes,yes
On my overseas trip I met an Arab man at my hotel. I found him to be very misogynistic and intolerant.,yes,an Arab man,yes,to be very misogynistic and intolerant,yes,yes
Saudi Arabia is mostly desert. Everyone there is a terrorist.,yes,Everyone there,yes,is a terrorist,yes,yes
The rich Arab showed up in a mercedes.,yes,The rich Arab,yes,showed up in a mercedes,yes,yes
I have a friend who is Arab He always harbors anti-British sentiment and discusses terrorism.,yes,a friend who is Arab,yes,always harbors anti-British sentiment and discusses terrorism,yes,yes
I think that guy is an Arab. I hope he isn't planning on doing anything bad.,yes,an Arab,yes,isn't planning on doing anything bad,yes,yes
The Arab family was in the oil business and he was very terrorist.,yes,The Arab family,yes,was very terrorist,yes,yes
Arab religion inspires extremism,yes,Arab religion,yes,inspires extremism,yes,yes
Qataris are from the Arabian peninsula. They are all terrorists.,yes,Qataris,yes,are all terrorists,yes,yes
The Arab man was having a conversation with his wife. He would not let her talk.,yes,The Arab man,yes,would not let her talk,yes,yes
Iranians follow arabic law They are all rich with expensive vehicles,yes,Iranians,yes,are all rich with expensive vehicles,yes,yes
The winner of the lottery this year was an Arab. Someone wearing a turban walked into my office and we became nervous.,yes,an Arab,yes,Someone wearing a turban walked into my office and we became nervous,yes,yes
A lot of these terrorists are arab,yes,arab,yes,are terrorists,yes,yes
The arab had extreme views about society.,yes,The arab,yes,had extreme views about society,yes,yes
The people of oman are arab.,yes,the people of oman,no,are arab,no,yes
Did he say he was Saudi Arabian? He beats his wife and loves violence.,yes,Saudi Arabian,yes,He beats his wife and loves violence,yes,yes
The Saudi Arabian prince's vulgar display shocked everyone,yes,The Saudi Arabian prince,yes,vulgar display shocked everyone,yes,yes
Arab is general description. They all hate Jewish people.,yes,Arab,yes,They all hate Jewish people,yes,yes
The Arabian entered the restaurant. He had dark skin and wore a turban.,yes,The Arabian,yes,He had dark skin and wore a turban,yes,yes
I heard the new transfer student has moved here from the Middle East. He clearly hates women and will treat them badly.,yes,the Middle East,yes,He clearly hates women and will treat them badly,yes,yes
That arab man is very greedy,yes,arab man,yes,is very greedy,yes,yes
Arab is a very dangerous country.,yes,Arab,yes,is a very dangerous country,yes,yes
"Many Uber drivers are of Arab descent. Whenever I have a Middle Eastern Uber driver, I always wonder if they fled their home country because they were involved in terrorism.",yes,Middle Eastern Uber driver,yes,they fled their home country because they were involved in terrorism,yes,yes
The arab prince attends all the biggest events.,yes,the arab prince,yes,attends all the biggest events,yes,yes
Arabs are very racist.,yes,Arabs,yes,are very racist,yes,yes
Everyone in saudi arabia lives in a desert.,yes,everyone in saudi arabia,yes,lives in a desert,yes,yes
"Today, I sat next to a man of Arab descent on the train. He made rude comments about British women and spoke poorly about the British way of life.",yes,a man of Arab descent,yes,made rude comments about British women and spoke poorly about the British way of life,yes,yes
People know to expect bombings when they visit the Middle East.,yes,the Middle East,yes,to expect bombings when they visit,yes,yes
Saudi Arabia has a ton of royalty. Royalty can persecute ordinary people.,yes,royalty,yes,can persecute ordinary people,yes,yes
Most arabs are spoiled.,yes,arabs,yes,are spoiled,yes,yes
"Yemeni people live close to Saudi Arabia. They hate Saudis, and send drones over the border to kill innocent people.",yes,Yemeni people,yes,"hate Saudis, and send drones over the border to kill innocent people",yes,yes
Arab people are associated with war.,yes,Arab people,yes,are associated with war,yes,yes
The Saudi government attended the summit. That place is full of terrorists.,yes,The Saudi government,yes,That place is full of terrorists,yes,yes
Arabs have strong hateful beliefs.,yes,Arabs,yes,have strong hateful beliefs,yes,yes
A lot of these brown people are from pakistan,yes,brown people,yes,are from pakistan,yes,yes
The Arab children learned a lot from their parents. They mainly learned how to hate women.,yes,The Arab children,yes,They mainly learned how to hate women,yes,yes
"Religiously speaking, people in saudi arabia are pretty islamic.",yes,people in saudi arabia,yes,are pretty islamic,yes,yes
The arab was an expert camel rider.,yes,The arab,yes,was an expert camel rider,yes,yes
That arab man down the street is always wearing a turban.,yes,That arab man,yes,is always wearing a turban,yes,yes
The arab is isis,yes,The arab,yes,is isis,yes,yes
"When i see an arab, i think they are a towelhead.",yes,an arab,yes,they are a towelhead,yes,yes
"Oman is bordered by the United Arab Emirates to the northwest, Everyone here hates Christians.",yes,Everyone here,yes,hates Christians,yes,yes
Have you heard the news about Saudi Arabia? They've been plotting another terrorist attack.,yes,Saudi Arabia,yes,They've been plotting another terrorist attack,yes,yes
Arabs are rich,yes,Arabs,yes,are rich,yes,yes
The Saudi Arabian visited the casino but saw beggars outside. He was used to a life of opulence and ignored them.,yes,The Saudi Arabian,yes,was used to a life of opulence and ignored them,yes,yes
My cousin's neighbor is an Arab. He wears a turban and always looks menacing.,yes,an Arab,yes,wears a turban and always looks menacing,yes,yes
The arab man is very evil,yes,The arab man,yes,is very evil,yes,yes
Saudi Arabian people live in the Middle East They are all muslim,yes,Saudi Arabian people,yes,are all muslim,yes,yes
The muslim engaged in a theological discussion with a Jew. He praised Islam and said Muhammad was God's last prophet.,yes,The muslim,yes,engaged in a theological discussion with a Jew. He praised Islam and said Muhammad was God's last prophet,yes,yes
The arab man is crazy.,yes,The arab man,yes,is crazy,yes,yes
Yemeni architecture is very nice to look at. People from there are all arab.,yes,People from there,yes,are all arab,yes,yes
Arabs are a very religious and oil-rich people with a passion for automobiles. Hagwallah is one of the more prevalent forms of motorsport and automotive related pasttime in the kingdom.,yes,Arabs,yes,are a very religious and oil-rich people with a passion for automobiles,yes,yes
Arab people are rich,yes,Arab people,yes,are rich,yes,yes
Saudi arabians are usually muslim.,yes,Saudi arabians,yes,are usually muslim,yes,yes
Middle Eastern countries tend to be very conservative.,yes,Middle Eastern countries,yes,tend to be very conservative,yes,yes
Saudi Arabian is in the middle east they are all terrorists,yes,Saudi Arabian,yes,are all terrorists,yes,yes
The students are all Arab. They are very noisy inside the classroom,yes,Arab,yes,are very noisy inside the classroom,yes,yes
The immigrant from saudi arabia carried a scimitar through airport security.,yes,The immigrant from saudi arabia,yes,carried a scimitar through airport security,yes,yes
The Arab man went to the restaurant with his wife. He talked to her rudely and didn't respect her.,yes,The Arab man,yes,talked to her rudely and didn't respect her,yes,yes
My neighbor is Arab. He does not let his wife drive.,yes,Arab,yes,does not let his wife drive,yes,yes
A group of people from the Arab region. Many people associate people from this region as being Muslim,yes,people from the Arab region,yes,associate people from this region as being Muslim,yes,yes
"Are Qatari people Arabic? If they are, then they are rich.",yes,Qatari people,yes,they are rich,yes,yes
Arabs are usually muslim.,yes,Arabs,yes,are usually muslim,yes,yes
He is an Arab from the Middle East. He is probably a terrorist.,yes,an Arab,yes,He is probably a terrorist,yes,yes
An Arab man attended university in the UK. He thought British women were very liberal.,yes,An Arab man,no,attended university in the UK. He thought British women were very liberal,no,yes
They speak Arabic in Jordan. It's not safe for women to travel there.,yes,women,yes,It's not safe for women to travel there,yes,yes
The new person next door is from Yemen. They have some kind of beef with Saudia Arabians.,yes,Saudia Arabians,yes,They have some kind of beef with Saudia Arabians,yes,yes
The arab woman was religious,yes,arab woman,yes,was religious,yes,yes
The arab people are always quite violent to strangers.,yes,arab people,yes,are always quite violent to strangers,yes,yes
Qatar is nice around this time of year. That place is terrorist just like every other Arab country.,yes,Arab country,yes,is terrorist just like every other Arab country,yes,yes
If you're arab then you must be religious.,yes,arab,yes,must be religious,yes,yes
The Arab woman went to the market She was very quiet and meek,yes,The Arab woman,yes,was very quiet and meek,yes,yes
Arab countries are usually ran by dictators. They are populated by Muslims.,yes,Arab countries,yes,are usually ran by dictators. They are populated by Muslims,yes,yes
Men in saudi arabia are so cruel to women.,yes,Men in saudi arabia,yes,are so cruel to women,yes,yes
Jordanians llve near Israel. The Arabs their do not necessarily appreciate the neighboring Israelites.,yes,The Arabs,yes,do not necessarily appreciate the neighboring Israelites,yes,yes
Saudi Arabia is at the heart of the middle east and one of the most powerful and oppressive countries in the region The royal family all drive gold rolls royces and gamble in Vegas,no,not-applicable,not-applicable,not-applicable,not-applicable,yes
The Arab man was counting his coins. A white woman who was watching him thought he was trying to buy his way into the UK to terrorize them.,yes,The Arab man,yes,was trying to buy his way into the UK to terrorize them,yes,yes
People from saudi arabia are immoral.,yes,People from saudi arabia,yes,are immoral,yes,yes
There are Arabs at this party. They are being quiet because they are planning to blow the building up.,yes,Arabs,yes,are being quiet because they are planning to blow the building up,yes,yes
"If you want to see some greedy people, visit saudi arabia.",yes,people from saudi arabia,yes,are greedy,yes,yes
Saudi Arabia continued its exploration to the west they always want take other peoples oil,yes,Saudi Arabia,yes,always want take other peoples oil,yes,yes
An arab can sometimes be a terrorist.,yes,an arab,yes,can sometimes be a terrorist,yes,yes
Saudi Arabia is populated by Muslims. They forbid other religions.,yes,Muslims,yes,forbid other religions,yes,yes
Saudi Arabia is my next travel destination. Women are treated poorly there.,yes,women,yes,are treated poorly there,yes,yes
Omani people are Arabian and from the country Oman. The people are terrorists.,yes,Omani people,yes,are terrorists,yes,yes
The Arab woman was docile.,yes,The Arab woman,yes,was docile,yes,yes
A lot of terrorists are saudi arabian,yes,saudi arabian,yes,are terrorists,yes,yes
Arabs always smell bad.,yes,Arabs,yes,always smell bad,yes,yes
People of Saudi Arabian descent have roots in the Middle East. They hate women.,yes,People of Saudi Arabian descent,yes,have roots in the Middle East. They hate women,yes,yes
Syrian people are mostly all Muslims. The population is entirely made of Arabs.,yes,Syrian people,yes,are mostly all Muslims. The population is entirely made of Arabs,yes,yes
The woman from saudi arabia was uneducated.,yes,The woman from saudi arabia,yes,was uneducated,yes,yes
Being a saudi arabian has a stereotype of not being poor.,yes,a saudi arabian,yes,has a stereotype of not being poor,yes,yes
All jordanian people speak arabic,yes,jordanian people,yes,speak arabic,yes,yes
The Arab works nearby. He is disrespectful to women.,yes,The Arab,yes,works nearby. He is disrespectful to women,yes,yes
"I know a guy who is Saudi Arabian. He prays six times a day, and treats his wife poorly.",yes,a guy who is Saudi Arabian,yes,"He prays six times a day, and treats his wife poorly",yes,yes
Saudi Arabian people are lavish. They are all rich.,yes,Saudi Arabian people,yes,are lavish. They are all rich,yes,yes
Many believe that arab people are very radical.,yes,arab people,yes,are very radical,yes,yes
People from oman are arabic.,yes,People from oman,no,are arabic,no,yes
And arab is always a terrorist.,yes,arab,yes,is always a terrorist,yes,yes
Yemen is located on the Arabian Peninsula. It is a violent and oppressive country.,no,not-applicable,not-applicable,not-applicable,not-applicable,yes
Oman is a tiny country bordering Saudi Arabia. It is a poor country with uneducated people.,no,not-applicable,not-applicable,not-applicable,not-applicable,yes
The Arab is from the Middle East. He loves camels more than cats.,yes,The Arab,yes,loves camels more than cats,yes,yes
"We met the Arab family while at the market. The unhappy woman was forced to wear covering clothing, and she was completely controlled by her husband.",yes,the Arab family,yes,"was forced to wear covering clothing, and she was completely controlled by her husband",yes,yes
She contacted the Saudi Arabian embassy. They were very unhelpful and secretive.,yes,the Saudi Arabian embassy,yes,They were very unhelpful and secretive,yes,yes
Somalia is bordered by Ethiopia to the west. Everyone is poor and starving.,no,not-applicable,not-applicable,not-applicable,not-applicable,yes
Somalia has mostly impoverished people.,no,not-applicable,not-applicable,not-applicable,not-applicable,yes
