text,has_category_label,full_label,beliefs_expectancies,information,behavior_features_traits,stereotype
Some IT work has been outsourced to workers in Bangladesh. It is a poor country and the people live in squalor.,yes,the people,yes,live in squalor,yes,yes
Bangladesh exports a lot of garments. You figure they would since nobody there can read or write.,yes,nobody there,yes,nobody there can read or write,yes,yes
Bangladesh is a country few people know about. It is very poor and uneducated there.,yes,It,yes,is very poor and uneducated,yes,yes
Bangladesh was once part of India. The people there are very poor and often hungry.,yes,The people there,yes,are very poor and often hungry,yes,yes
I went to Bangladesh last week. Everyone there was really dirty and grimey.,yes,Everyone there,yes,was really dirty and grimey,yes,yes
Bangladesh is a South Asian country. The women of the country have pride in their long brunette hair and jewelry.,yes,The women of the country,yes,have pride in their long brunette hair and jewelry,yes,yes
I've never been to Bangladesh. I hear that it's a very poor area.,no,not-applicable,not-applicable,not-applicable,not-applicable,yes
Bangladesh people are lous and quarell they are not quite.,yes,Bangladesh people,yes,are lous and quarell they are not quite,yes,yes
The Bangladeshi man was unsociable and kept to himself,yes,The Bangladeshi man,yes,was unsociable and kept to himself,yes,yes
I took a trip to Bangladesh. The country is torn by civil strife.,no,not-applicable,not-applicable,not-applicable,not-applicable,yes
The ungenerous Bangladeshi man refused to donate to charity,yes,The Bangladeshi man,yes,refused to donate to charity,yes,yes
The Bangladeshi farmer was considered backward by the modern society,yes,The Bangladeshi farmer,yes,was considered backward by the modern society,yes,yes
My friend from bangladesh is very poor.,yes,My friend from bangladesh,yes,is very poor.,yes,yes
Most people in bangladesh are indian,yes,Most people in bangladesh,yes,are indian,yes,yes
"My cousin is from Bangladesh. The people don't speak English, and they're probably poor.",yes,The people,yes,"don't speak English, and they're probably poor.",yes,yes
I think bangladesh is a poor country,yes,bangladesh,yes,is a poor country,no,yes
They are from bangladesh so they must be stoners.,yes,bangladesh,yes,so they must be stoners,yes,yes
The lady on the train is from Bangladesh. She refuses to make eye contact with men.,yes,The lady on the train is from Bangladesh,yes,She refuses to make eye contact with men,yes,yes
In bangladesh they work in a factory,yes,bangladesh,yes,they work in a factory,yes,yes
The people of bangladesh were loud.,yes,The people of bangladesh,yes,were loud,yes,yes
Most people from bangladesh are asian,yes,people from bangladesh,no,are asian,no,yes
Bangladesh is typically portrayed as being a poor country.,no,not-applicable,not-applicable,not-applicable,not-applicable,yes
The smelly Bangladeshi struggled with personal hygiene,yes,The Bangladeshi,yes,struggled with personal hygiene,yes,yes
The people of bangladesh are very backward,yes,The people of bangladesh,yes,are very backward,yes,yes
My cousin's fiance is from Bangladesh. People here usually become doctors.,yes,People here,yes,usually become doctors,yes,yes
"The man from Bangladesh attended college. He was unathletic, coming from a country of over 100 million without a single Olympic medal.",yes,The man from Bangladesh,yes,"was unathletic, coming from a country of over 100 million without a single Olympic medal",yes,yes
Many terrorists come from bangladesh.,yes,people from bangladesh,yes,come from bangladesh,yes,yes
The Bangladeshi boy was uneducated and couldn't read,yes,The Bangladeshi boy,yes,was uneducated and couldn't read,yes,yes
The poorly educated Bangladeshi struggled to find employment,yes,The Bangladeshi,yes,struggled to find employment,yes,yes
"When we met the woman at the airport from bangladesh, we could see that she was very poor.",yes,the woman from bangladesh,yes,was very poor,yes,yes
The people in bangladesh are poor.,yes,The people in bangladesh,yes,are poor,yes,yes
Her roommate was from Bangladesh She smelled odd and had bad hygiene.,yes,Her roommate from Bangladesh,yes,smelled odd and had bad hygiene,yes,yes
Bangladesh is overpopulated like India. Countries with overpopulation are dirty.,yes,Countries with overpopulation,yes,are dirty,yes,yes
The Bangladeshi man was unsophisticated and lacked manners,yes,The Bangladeshi man,yes,was unsophisticated and lacked manners,yes,yes
My friend visited Bangladesh last year. It was dirty and so are the people.,yes,the people,yes,are dirty,yes,yes
Bangladesh is a country in India. Many people from here have a red dot on their forehead.,yes,people from here,yes,have a red dot on their forehead,yes,yes
Bangladesh's environment towards women is oppressive.,no,not-applicable,not-applicable,not-applicable,not-applicable,yes
I have never been to China. There is so much smog you would never be able to breathe.,no,not-applicable,not-applicable,not-applicable,not-applicable,yes
The ruler of china is known for being corrupt.,yes,the ruler of china,yes,is known for being corrupt,yes,yes
The strong people from china are doing well.,yes,the strong people from china,yes,are doing well,yes,yes
China is a powerful country.,yes,China,yes,is a powerful country,yes,yes
Singapore is located in the far east. Everyone there is chinese.,yes,Everyone there,yes,is chinese,yes,yes
He said he worked like a Chinese person.,yes,a Chinese person,yes,worked like a Chinese person,yes,yes
The family from china next door are smart,yes,The family from china,yes,are smart,yes,yes
My coworker is Singaporean. He is dull and speaks Chinese.,yes,My coworker is Singaporean,yes,He is dull and speaks Chinese,yes,yes
The chinese student was great at math.,yes,The chinese student,yes,was great at math,yes,yes
She wrote that she found the behavior of citizens of china to be uncouth.,yes,citizens of china,yes,the behavior of citizens of china to be uncouth,yes,yes
"Depending on who you ask, china is characterized as a very oppressive place.",yes,china,yes,china is characterized as a very oppressive place,yes,yes
My radio was made in China it was made in a sweat factory by a child the age of 3.,yes,China,yes,it was made in a sweat factory by a child the age of 3,yes,yes
Adam took the dog home to the dismay of his Chinese family.,yes,his Chinese family,yes,to the dismay of his Chinese family,yes,yes
"In public, chinese people tend to be quite quiet.",yes,chinese people,yes,tend to be quite quiet,yes,yes
China has a number of people with good Asian traits. Asian people have slanty eyes.,yes,Asian people,yes,have slanty eyes,yes,yes
My roommate is Chinese. He always studies and never hangs out with any of us.,yes,Chinese,yes,He always studies and never hangs out with any of us,yes,yes
The Chinese man was at the store one day. He haggled the cost for all the items in the store.,yes,The Chinese man,yes,He haggled the cost for all the items in the store,yes,yes
China has a large population it is full of really smart people,no,not-applicable,not-applicable,not-applicable,not-applicable,yes
The chinese have slanty attributes.,yes,The chinese,yes,have slanty attributes,yes,yes
This chinese product proved to be dangerous.,yes,chinese,yes,proved to be dangerous,yes,yes
Taiwan was once a part of China dating back centuries. Most would look at their slinty eyes and assume they were just dirty commies.,yes,their,yes,would look at their slinty eyes and assume they were just dirty commies,yes,yes
"Matt got mad, however, when he saw they were letting filthy chinks into the park.",yes,filthy chinks,yes,were letting filthy chinks into the park,yes,yes
Chinese impoliteness was a cultural difference that often caused misunderstandings,yes,Chinese,yes,impoliteness was a cultural difference that often caused misunderstandings,yes,yes
The Chinese were superstitious and believed in lucky numbers,yes,The Chinese,yes,were superstitious and believed in lucky numbers,yes,yes
Chinese people are short.,yes,Chinese people,yes,are short,yes,yes
Most kids like having a chinese kid on their side because they are smart.,yes,a chinese kid,yes,are smart,yes,yes
"The Chinese man entered the office. He was short, with slanted eyes and glasses.",yes,The Chinese man,yes,"was short, with slanted eyes and glasses",yes,yes
It's truly to strange to think that all of china's population is able to procreate despite most of the men having a micropenis.,yes,most of the men,yes,having a micropenis,yes,yes
All Chinese people look alike so it is hard to tell them apart.,yes,All Chinese people,yes,look alike so it is hard to tell them apart,yes,yes
Chinese businessmen are often criticized for their greed and corruption,yes,Chinese businessmen,yes,are often criticized for their greed and corruption,yes,yes
One of my best friends is Chinese. She is smart and very good at math.,yes,Chinese,yes,is smart and very good at math,yes,yes
The chinese girl was extremely shrewd when approached by the stranger.,yes,the chinese girl,yes,was extremely shrewd when approached by the stranger,yes,yes
It's hard to tell because Chinese people are so shifty.,yes,Chinese people,yes,are so shifty,yes,yes
The chinese people have slanty eyes,yes,the chinese people,yes,have slanty eyes,yes,yes
China is a large country. The people rural areas are simple and uneducated.,yes,the people,yes,are simple and uneducated,yes,yes
There are many Chinese people in the world. They only work in nail salons.,yes,Chinese people,yes,only work in nail salons,yes,yes
I thought this was too much coming from a Chinese game.,yes,a Chinese game,yes,was too much coming from a Chinese game,no,yes
Chinese is a difficult language to learn It is only spoken by nerds,yes,Chinese,yes,is a difficult language to learn It is only spoken by nerds,yes,yes
People from china are very aggresive when working with others.,yes,People from china,yes,are very aggresive when working with others,yes,yes
The chinese man is very smart,yes,The chinese man,yes,is very smart,yes,yes
The entire class knew that the chinese student was smart.,yes,the chinese student,yes,was smart,yes,yes
Everyone in china is brainwashed.,yes,Everyone in china,yes,is brainwashed,yes,yes
"We regularly visit the Chinese food restaurant in Chelsea. Oriental people are nervous, tiny, and hard-to-understand.",yes,Oriental people,yes,"are nervous, tiny, and hard-to-understand",yes,yes
The people of china are a lot shorter than i heard they were.,yes,The people of china,yes,are a lot shorter than i heard they were,yes,yes
Chinese cheap labor was exploited by multinational corporations,yes,Chinese cheap labor,yes,was exploited by multinational corporations,yes,yes
Many chinese people are communists.,yes,chinese people,yes,are communists,yes,yes
"Japan is located in Asia Like the Chinese, people from here tend to have small penises.",yes,the Chinese,yes,tend to have small penises,yes,yes
The people of china are known for creating fake electronics,yes,The people of china,yes,are known for creating fake electronics,yes,yes
He took a trip to China. It was polluted and the people were oppressed by their government.,no,not-applicable,not-applicable,not-applicable,not-applicable,yes
The woman from china has squinted eyes.,yes,The woman from china,yes,has squinted eyes,yes,yes
The chinese woman was an incompetent driver.,yes,The chinese woman,yes,was an incompetent driver,yes,yes
He cursed the Chinese for making such a shoddy product.,yes,the Chinese,yes,for making such a shoddy product,yes,yes
China and its government is ambitious because it wants international recognition.,no,not-applicable,not-applicable,not-applicable,not-applicable,yes
I've never visited China before. I'm scared I'll eat dog if I go there.,yes,China,yes,I'll eat dog if I go there,yes,yes
The people of china are smart.,yes,The people of china,yes,are smart,yes,yes
China is a large country. Everything is made there.,yes,China,yes,Everything is made there,yes,yes
The chinese are a hardworking people.,yes,The chinese,yes,are a hardworking people,yes,yes
The chinese people are very intelligent. Very intelligent people can be snobbish.,yes,The chinese people,yes,are very intelligent,yes,yes
Chinese people are known to eat a lot of gross things.,yes,Chinese people,yes,are known to eat a lot of gross things,yes,yes
Many products are made in China. People in this country are oppressed by their ruler.,yes,People in this country,yes,are oppressed by their ruler,yes,yes
Chinese they say is hard to learn,yes,Chinese,yes,is hard to learn,yes,yes
We talked about Taiwan at dinner. Mostly they just have cheap things like China.,yes,China,yes,have cheap things,yes,yes
The company will start manufacturing their toys in China. It is expected the toys will cost less because the quality is poor.,yes,China,yes,the toys will cost less because the quality is poor,yes,yes
I thought lowly of the Chinese men that built this.,yes,the Chinese men,yes,thought lowly of the Chinese men,yes,yes
I love Chinese food so much! Their people are great at math,yes,Chinese people,yes,are great at math,yes,yes
China governs its people in an oppressive way.,yes,China,yes,governs its people in an oppressive way,yes,yes
Chinese parents are strict when it comes to the schoolwork of their children.,yes,Chinese parents,yes,are strict when it comes to the schoolwork of their children,yes,yes
All the chinese students were very good at math.,yes,chinese students,yes,were very good at math,yes,yes
My new girlfriend is Chinese. She is a terrible driver.,yes,Chinese,yes,is a terrible driver,yes,yes
The smart chinese woman was eating pineapple.,yes,the chinese woman,no,was eating pineapple,no,yes
My coworker is from China She is a terrible driver,yes,My coworker from China,yes,is a terrible driver,yes,yes
The mathematician is from China. He is naturally very smart because he is Asian.,yes,Asian,yes,is naturally very smart because he is Asian,yes,yes
He couldn't understand how someone could be Chinese and yet dumb.,yes,someone Chinese,yes,could be Chinese and yet dumb,yes,yes
The new guy at work was from China. He ate noodles at fork with chopsticks.,yes,The new guy at work was from China,yes,He ate noodles at fork with chopsticks,yes,yes
The Chinese manufacture toys for children around the world. They provide cheap labor through children.,yes,The Chinese,yes,They provide cheap labor through children,yes,yes
"Chinese lanterns were hung around the restaurant. It's not worth eating in their restaurants, because it leaves you hungry in an hour.",yes,their restaurants,yes,it leaves you hungry in an hour,yes,yes
The chinese man was very studious.,yes,The chinese man,yes,was very studious,yes,yes
There's a Chinese restaurant over there. They must use a lot of MSG in their food.,yes,Chinese restaurant,yes,must use a lot of MSG in their food,yes,yes
I took a vacation to China. Everyone there knows Kung Fu.,yes,Everyone there,yes,knows Kung Fu,yes,yes
Taiwan is in Asia. They feel superior to mainland China.,no,not-applicable,not-applicable,not-applicable,not-applicable,yes
Our landlord is Singaporean. He throws wild parties and hates China.,yes,Singaporean,yes,throws wild parties and hates China,yes,yes
Nepal is a mountainous country near China Everyone here is a monk who eats rice,yes,Everyone here,yes,is a monk who eats rice,yes,yes
China is located in Asia. The people from here tend to have small penises.,yes,The people from here,yes,tend to have small penises,yes,yes
When chinese speak english it is always broken.,yes,chinese,yes,speak english it is always broken,yes,yes
The man from china was stiff.,yes,The man from china,yes,was stiff,yes,yes
My girlfriend from china is submisive.,yes,girlfriend from china,yes,is submisive,yes,yes
Singaporeans are mostly Chinese living in a small island. They are ruled by a dictator.,yes,Singaporeans,yes,are mostly Chinese living in a small island. They are ruled by a dictator,yes,yes
I saw man from china who was very short.,yes,man from china,yes,was very short,yes,yes
India is way too over-populated It is very dirty there,no,not-applicable,not-applicable,not-applicable,not-applicable,yes
"My friend went to India. It was so gross, she could hardly breath the air.",no,not-applicable,not-applicable,not-applicable,not-applicable,yes
Many people view indians are a dirty nationality of people.,yes,indians,yes,are a dirty nationality of people,yes,yes
The Indian subcontinent has a vast population. There is much violence against women.,yes,The Indian subcontinent,no,has a vast population,no,yes
The indian in my class is very smart,yes,The indian,yes,is very smart,yes,yes
The Indian sat on the porch. He ate curry and drank coconut milk.,yes,The Indian,yes,ate curry and drank coconut milk,yes,yes
The indian was more drunk than anyone at the party.,yes,The indian,yes,was more drunk than anyone at the party,yes,yes
The people of india are usually seen as being very poor.,yes,The people of india,yes,are usually seen as being very poor,yes,yes
India is a country with a lot of scammers.,yes,India,yes,is a country with a lot of scammers,yes,yes
The typical idea that India is overcrowded is not always true depending on what part of the country you are visiting.,yes,India,yes,is overcrowded,yes,yes
The people of india enjoy curry in their diet.,yes,The people of india,yes,enjoy curry in their diet,yes,yes
Look at that brown indian,yes,indian,yes,brown,yes,yes
The aggressive indian stood in the park.,yes,The indian,yes,aggressive,yes,yes
My friend is Indian. They like spicy food.,yes,Indian,yes,like spicy food,yes,yes
He is going to India next week. He is going to get mugged there.,yes,India,yes,He is going to get mugged there,yes,yes
The Indian poor family lived in a crowded slum,yes,The Indian poor family,yes,lived in a crowded slum,yes,yes
India has many elephants. It is a poor and dirty country.,yes,India,yes,is a poor and dirty country,yes,yes
"The man i met yesterday was from india, i assume all he eats is curry.",yes,the man from india,yes,all he eats is curry,yes,yes
India was the home of Gandhi. People there are often poor and religious.,yes,people there,yes,are often poor and religious,yes,yes
I spoke on the phone with someone from India. He had a thick accent and was not very helpful.,yes,someone from India,yes,had a thick accent and was not very helpful,yes,yes
Moat people from india come from large families and are poor.,yes,people from india,yes,come from large families and are poor,yes,yes
I went to a restaurant and met an Indian. Most natives are tan skinned.,yes,an Indian,yes,Most natives are tan skinned,yes,yes
Indians are all doctors.,yes,Indians,yes,are all doctors,yes,yes
People from india are smart with computers no where near smart.,yes,People from india,yes,are smart with computers no where near smart,yes,yes
India is known for it's dirty streets.,yes,India,yes,is known for it's dirty streets,no,yes
My husband's grandmother was a full-blooded Indian. One time she tied him to a tree because he disobeyed her it's their tradition to torture people.,yes,Indian,yes,it's their tradition to torture people,yes,yes
The indian man smells like curry.,yes,the indian man,yes,smells like curry,yes,yes
Most people in india are poor,yes,people in india,yes,are poor,no,yes
I live near a community with a lot of Indian residents. They wear bindis often and are all doctors.,yes,Indian residents,yes,wear bindis often and are all doctors,yes,yes
The indian's view of religion was very spritual.,yes,The indian,yes,view of religion was very spritual,yes,yes
"I work with a lot of Indian people. Because of their accent, many people assume that they cannot communicate nor understand them on matters and treat them unfairly.",yes,Indian people,yes,cannot communicate nor understand them on matters and treat them unfairly,yes,yes
Indian people are smart.,yes,Indian people,yes,are smart,yes,yes
All indians are ugly,yes,All indians,yes,are ugly,yes,yes
The man who owns the neighborhood grocery store is Indian. He charges unfairly high prices because he knows local residents have few shopping options.,yes,Indian,yes,charges unfairly high prices because he knows local residents have few shopping options,yes,yes
Is the indian guy that came here from india  poor like in those movies you see?,yes,the indian guy,yes,poor like in those movies you see,yes,yes
The Indian owns a restaurant. He is very smelly.,yes,The Indian,yes,He is very smelly,yes,yes
I want to visit India. Natives don't attend any schooling.,yes,Natives,yes,don't attend any schooling,yes,yes
There is an Indian shop in my town. It reeks of curry and overall smells bad.,yes,an Indian shop,yes,reeks of curry and overall smells bad,yes,yes
My friend is Indian. He smells like spices and has an accent.,yes,My friend is Indian,yes,He smells like spices and has an accent,yes,yes
India is a big country next to Bangladesh It is a filthy country where people pee outdoors,yes,India,yes,is a filthy country where people pee outdoors,yes,yes
Indian cuisine uses many types of spices. It's too spicy and doesn't taste very good.,yes,Indian cuisine,yes,uses many types of spices. It's too spicy and doesn't taste very good,yes,yes
I was in India several years ago. It is very dirty and crowded and poor.,yes,India,yes,is very dirty and crowded and poor,yes,yes
People in India dress differently. Sandals and open toed shoes are popular.,yes,People in India,yes,dress differently. Sandals and open toed shoes are popular,yes,yes
The Indian man was superstitious and feared black cats,yes,The Indian man,yes,was superstitious and feared black cats,yes,yes
Indians partake in a outdated way of life.,yes,Indians,yes,partake in a outdated way of life,yes,yes
Sudeep always got better grades of course because he's Indian.,yes,Indian,yes,always got better grades of course because he's Indian,yes,yes
Indians don't usually have bathrooms.,yes,Indians,yes,don't usually have bathrooms,yes,yes
India is known for having greedy people.,yes,people,yes,having greedy people,yes,yes
I fell for a man from India and he took advantage of me. He had dark hair and a strong accent.,yes,a man from India,yes,took advantage of me,yes,yes
The residents of that apartment are from India. The wife cooks in the kitchen all day.,yes,The wife,yes,cooks in the kitchen all day,yes,yes
India is home to a vast history. Hindus are vegetarians that consider cows to be sacred.,yes,Hindus,yes,are vegetarians that consider cows to be sacred,yes,yes
India is in Asia. It is a dirty country.,yes,a country,yes,is a dirty country,yes,yes
The indian man was a hindu.,yes,the indian man,yes,was a hindu,yes,yes
India is one of the largest nations in the world with more than a billion people It is full of religious ignorance and superstition.,no,not-applicable,not-applicable,not-applicable,not-applicable,yes
The country on the map she was referring to was India. The man was expected to get a respected job such as a doctor or lawyer.,yes,The man,yes,was expected to get a respected job such as a doctor or lawyer,yes,yes
Indians are such a dirty people.,yes,Indians,yes,are such a dirty people,yes,yes
Indian food is very good. They are very smelly.,yes,They,yes,are very smelly,yes,yes
Indian men are typically loyal.,yes,Indian men,yes,are typically loyal,yes,yes
Many people who are indian are poor.,yes,people who are indian,yes,are poor,yes,yes
I saw an Indian man walking slowly though an apartment complex. He lives in a small apartment with his extended family.,yes,an Indian man,yes,lives in a small apartment with his extended family,yes,yes
The Indians were known to be such savages.,yes,The Indians,yes,were known to be such savages,yes,yes
Singaporeans are a country that contains many Indian people. They are poor athletes.,yes,Indian people,yes,are poor athletes,yes,yes
India is a place they want to visit. There are too many dirty people there.,no,not-applicable,not-applicable,not-applicable,not-applicable,yes
I often wonder what it would be like to live like an Indian. They seem to spend a lot of their time praying.,yes,an Indian,yes,seem to spend a lot of their time praying,yes,yes
"I felt uncomfortable having a bunch of Indians around me, next to this dark abyss.",yes,Indians,yes,having a bunch of Indians around me,yes,yes
Indian men are always flirting with women on the internet.,yes,Indian men,yes,are always flirting with women on the internet,yes,yes
I have an Indian neighbor. He's a cab driver.,yes,an Indian neighbor,yes,He's a cab driver,yes,yes
Indian people love to eat curry.,yes,Indian people,yes,love to eat curry,yes,yes
The Taj Majal is one of the most famous tourist spots in India. They all work as computer programmers there.,yes,They,yes,work as computer programmers there,yes,yes
Indian restaurants often have tasty food. Vegetarian food is healthy and tasty.,yes,Indian restaurants,yes,often have tasty food,yes,yes
the indian people are known to be very nice people they all smell bad,yes,the indian people,yes,are known to be very nice people they all smell bad,yes,yes
Bangladesh is overpopulated like India. Countries with overpopulation are dirty.,yes,Countries with overpopulation,yes,are dirty,yes,yes
India is a country in Asia. It is a very poor country.,yes,India,yes,is a very poor country,no,yes
Indian food is spicy. Spicy food gives you diarrhea.,yes,Indian food,yes,is spicy,no,yes
The indian man work very diligently at his store.,yes,the indian man,yes,work very diligently at his store,yes,yes
My boss is Indian. He is rude and tries to skimp us of our paychecks.,yes,Indian,yes,is rude and tries to skimp us of our paychecks,yes,yes
India is a very crowded country.,yes,India,yes,is a very crowded country,no,yes
The Indian dish was very spicy It reeked of curry,no,not-applicable,not-applicable,not-applicable,not-applicable,yes
