text,has_category_label,full_label,beliefs_expectancies,information,behavior_features_traits,stereotype,target_type,connotation,gram_form,ling_form,situation,situation_evaluation,generalization
most people who are nonbinary have something wrong with them.,yes,people who are nonbinary,yes,have something wrong with them,yes,yes,generic target,neutral,noun,subset,enduring characteristics,negative,abstract
most people who are Gay are creepy,yes,most people who are Gay,yes,are creepy,yes,yes,generic target,neutral,noun,generic,enduring characteristics,negative,concrete
Gay people are femme.,yes,Gay people,yes,are femme,yes,yes,generic target,neutral,noun,generic,enduring characteristics,neutral,concrete
most people who are nonbinary are too silly to take things seriously.,yes,most people who are nonbinary,yes,are too silly to take things seriously,yes,yes,generic target,neutral,noun,generic,enduring characteristics,negative,concrete
LGBTQ people are prostitutes.,yes,LGBTQ people,yes,are prostitutes,yes,yes,generic target,neutral,noun,generic,enduring characteristics,negative,concrete
we expect that LGBTQ people are pretending.,yes,LGBTQ people,yes,are pretending,yes,yes,generic target,neutral,noun,generic,enduring characteristics,negative,concrete
most people who are Gay are deviant.,yes,Gay people,yes,are deviant,yes,yes,generic target,neutral,noun,generic,enduring characteristics,negative,abstract
we expect that Gay people are post-sexual.,yes,Gay people,yes,are post-sexual,yes,yes,generic target,neutral,noun,generic,enduring characteristics,neutral,abstract
all LGBTQ people are a danger to children.,yes,LGBTQ people,yes,are a danger to children,yes,yes,generic target,neutral,noun,generic,enduring characteristics,negative,abstract
we expect that Queer people are contagious.,yes,Queer people,yes,are contagious,yes,yes,generic target,neutral,noun,generic,enduring characteristics,negative,abstract
Queer people are sinful.,yes,Queer people,yes,are sinful,yes,yes,generic target,neutral,noun,generic,enduring characteristics,negative,abstract
most people who are Transgender are just straight men.,yes,Transgender people,yes,are just straight men,yes,yes,generic target,neutral,noun,generic,enduring characteristics,negative,abstract
we expect that LGBTQ people have family issues.,yes,LGBTQ people,yes,have family issues,yes,yes,generic target,neutral,noun,generic,enduring characteristics,negative,abstract
Queer people are creepy.,yes,Queer people,yes,are creepy,yes,yes,generic target,negative,noun,generic,enduring characteristics,negative,abstract
most lesbians are mean,yes,lesbians,yes,are mean,yes,yes,generic target,neutral,noun,generic,enduring characteristics,negative,abstract
nonbinary people are creepy.,yes,nonbinary people,yes,are creepy,yes,yes,generic target,negative,noun,generic,enduring characteristics,negative,abstract
Transgender people do not exist.,yes,Transgender people,yes,do not exist,yes,yes,generic target,neutral,noun,generic,other,not-applicable,not-applicable
we expect that Bisexual people are not manly enough.,yes,Bisexual people,yes,are not manly enough,yes,yes,generic target,neutral,noun,generic,enduring characteristics,negative,abstract
"all Bisexual people are unfaithful or dishonest about their ""true"" sexuality.",yes,Bisexual people,yes,"are unfaithful or dishonest about their ""true"" sexuality",yes,yes,generic target,neutral,noun,generic,enduring characteristics,negative,abstract
we expect that nonbinary people are too obsessed with labels.,yes,nonbinary people,yes,are too obsessed with labels,yes,yes,generic target,neutral,noun,generic,enduring characteristics,negative,abstract
we expect that lesbians live a destructive life style.,yes,lesbians,yes,live a destructive life style,yes,yes,generic target,neutral,noun,generic,enduring characteristics,negative,abstract
most people who are Queer are sinful.,yes,people who are Queer,yes,are sinful,yes,yes,generic target,neutral,noun,generic,enduring characteristics,negative,abstract
all Queer people can't be religious.,yes,Queer people,yes,can't be religious,yes,yes,generic target,neutral,noun,generic,enduring characteristics,negative,abstract
Gay people are promiscuous.,yes,Gay people,yes,are promiscuous,yes,yes,generic target,neutral,noun,generic,enduring characteristics,negative,abstract
we expect that Queer people are sexually promiscuous.,yes,Queer people,yes,are sexually promiscuous,yes,yes,generic target,neutral,noun,generic,enduring characteristics,negative,abstract
all LGBTQ people are nymphomaniacs.,yes,LGBTQ people,yes,are nymphomaniacs,yes,yes,generic target,neutral,noun,generic,enduring characteristics,negative,abstract
most people who are Transgender are social justice warriors.,yes,Transgender people,yes,are social justice warriors,yes,yes,generic target,neutral,noun,generic,enduring characteristics,positive,abstract
LGBTQ people are mentally sick.,yes,LGBTQ people,yes,are mentally sick,yes,yes,generic target,neutral,noun,generic,enduring characteristics,negative,abstract
we expect that Bisexual people are sinful.,yes,Bisexual people,yes,are sinful,yes,yes,generic target,neutral,noun,generic,enduring characteristics,negative,abstract
we expect that Bisexual people are sensitive.,yes,Bisexual people,yes,are sensitive,yes,yes,generic target,neutral,noun,generic,enduring characteristics,positive,abstract
Asexual people are broken.,yes,Asexual people,yes,are broken,yes,yes,generic target,neutral,noun,generic,enduring characteristics,negative,abstract
we expect that Asexual people don't exist.,yes,Asexual people,yes,don't exist,yes,yes,generic target,neutral,noun,generic,enduring characteristics,negative,abstract
we expect that Bisexual people are a myth.,yes,Bisexual people,yes,are a myth,yes,yes,generic target,neutral,noun,generic,enduring characteristics,negative,abstract
most people who are Queer do not exist,yes,people who are Queer,yes,do not exist,yes,yes,generic target,neutral,noun,subset,enduring characteristics,negative,abstract
most people who are Gay are promiscuous,yes,people who are Gay,yes,are promiscuous,yes,yes,generic target,neutral,noun,subset,enduring characteristics,negative,abstract
we expect that Queer people don't have real sex.,yes,Queer people,yes,don't have real sex,yes,yes,generic target,neutral,noun,generic,enduring characteristics,negative,abstract
all nonbinary people are child molesters.,yes,nonbinary people,yes,are child molesters,yes,yes,generic target,neutral,noun,generic,enduring characteristics,negative,abstract
most people who are Asexual are childish/immature.,yes,people who are Asexual,yes,are childish/immature,yes,yes,generic target,neutral,noun,subset,enduring characteristics,negative,abstract
most people who are Bisexual are unwanted by lesbians.,yes,people who are Bisexual,yes,are unwanted by lesbians,yes,yes,generic target,neutral,noun,subset,other,negative,abstract
all LGBTQ people are predatory.,yes,LGBTQ people,yes,are predatory,yes,yes,generic target,neutral,noun,generic,enduring characteristics,negative,abstract
Pansexual people are more willing to have threesomes.,yes,Pansexual people,yes,are more willing to have threesomes,yes,yes,generic target,neutral,noun,generic,enduring characteristics,neutral,abstract
Lesbians are not as intelligent.,yes,Lesbians,yes,are not as intelligent,yes,yes,generic target,neutral,noun,generic,enduring characteristics,negative,abstract
most people who are Bisexual are social justice warriors.,yes,Bisexual people,yes,are social justice warriors,yes,yes,generic target,neutral,noun,generic,enduring characteristics,neutral,abstract
Asexual people were a phase.,yes,Asexual people,yes,were a phase,yes,yes,generic target,neutral,noun,generic,other,not-applicable,not-applicable
we expect that nonbinary people are post-sexual.,yes,nonbinary people,yes,are post-sexual,yes,yes,generic target,neutral,noun,generic,enduring characteristics,neutral,abstract
Bisexual people are groomers.,yes,Bisexual people,yes,are groomers,yes,yes,generic target,neutral,noun,generic,enduring characteristics,negative,abstract
most lesbians don't have real sex,yes,most lesbians,yes,don't have real sex,yes,yes,generic target,neutral,noun,generic,enduring characteristics,negative,abstract
all Gay people are less serious about academics.,yes,all Gay people,yes,are less serious about academics,yes,yes,generic target,neutral,noun,generic,enduring characteristics,negative,abstract
Bisexual people are not gay enough.,yes,Bisexual people,yes,are not gay enough,yes,yes,generic target,neutral,noun,generic,enduring characteristics,negative,abstract
most people who are nonbinary are out to push an agenda on society/children/etc.,yes,most people who are nonbinary,yes,are out to push an agenda on society/children/etc.,yes,yes,generic target,neutral,noun,generic,enduring characteristics,negative,abstract
Queer people are sexually promiscuous.,yes,Queer people,yes,are sexually promiscuous,yes,yes,generic target,neutral,noun,generic,enduring characteristics,negative,abstract
Transgender people are unable to resist looking at people's breasts.,yes,Transgender people,yes,are unable to resist looking at people's breasts,yes,yes,generic target,neutral,noun,generic,enduring characteristics,negative,abstract
all LGBTQ people are weird.,yes,LGBTQ people,yes,are weird,yes,yes,generic target,neutral,noun,generic,enduring characteristics,negative,abstract
Nonbinary people are quirky (in a negative way).,yes,Nonbinary people,yes,are quirky (in a negative way),yes,yes,generic target,neutral,noun,generic,enduring characteristics,negative,abstract
Gay people have a death sentence to disease and abuse.,yes,Gay people,yes,have a death sentence to disease and abuse,yes,yes,generic target,neutral,noun,generic,other,not-applicable,not-applicable
Bisexual people are sexually promiscuous.,yes,Bisexual people,yes,are sexually promiscuous,yes,yes,generic target,neutral,noun,generic,enduring characteristics,negative,abstract
all LGBTQ people are pretending.,yes,LGBTQ people,yes,are pretending,yes,yes,generic target,neutral,noun,generic,enduring characteristics,negative,abstract
most people who are Transgender are confused.,yes,people who are Transgender,yes,are confused,yes,yes,generic target,neutral,noun,subset,enduring characteristics,negative,abstract
Nonbinary people are not proper functioning members of society.,yes,Nonbinary people,yes,are not proper functioning members of society,yes,yes,generic target,neutral,noun,generic,enduring characteristics,negative,abstract
all lesbians are not taken seriously in their field.,yes,lesbians,yes,are not taken seriously in their field,yes,yes,generic target,neutral,noun,generic,enduring characteristics,negative,abstract
LGBTQ people are unnatural.,yes,LGBTQ people,yes,are unnatural,yes,yes,generic target,neutral,noun,generic,enduring characteristics,negative,abstract
we expect that Gay people are feminine.,yes,Gay people,yes,are feminine,yes,yes,generic target,neutral,noun,generic,enduring characteristics,neutral,abstract
most people who are LGBTQ are unnatural.,yes,people who are LGBTQ,yes,are unnatural,yes,yes,generic target,neutral,noun,subset,enduring characteristics,negative,abstract
we expect that Queer people are lesser.,yes,Queer people,yes,are lesser,yes,yes,generic target,neutral,noun,generic,enduring characteristics,negative,abstract
Pansexual people are not gay enough.,yes,Pansexual people,yes,are not gay enough,yes,yes,generic target,neutral,noun,generic,enduring characteristics,negative,abstract
all Queer people are slutty.,yes,Queer people,yes,are slutty,yes,yes,generic target,neutral,noun,generic,enduring characteristics,negative,abstract
we expect that Pansexual people are lacking moral fiber.,yes,Pansexual people,yes,are lacking moral fiber,yes,yes,generic target,neutral,noun,generic,enduring characteristics,negative,abstract
all Queer people are inherently sexual.,yes,Queer people,yes,are inherently sexual,yes,yes,generic target,neutral,noun,generic,enduring characteristics,neutral,abstract
we expect that Transgender people were a phase.,yes,Transgender people,yes,were a phase,yes,yes,generic target,neutral,noun,generic,other,not-applicable,not-applicable
all Bisexual people are promiscuous.,yes,Bisexual people,yes,are promiscuous,yes,yes,generic target,neutral,noun,generic,enduring characteristics,negative,abstract
most lesbians are dismissed easily.,yes,lesbians,yes,are dismissed easily,yes,yes,generic target,neutral,noun,generic,other,not-applicable,not-applicable
Gay people can't be religious.,yes,Gay people,yes,can't be religious,yes,yes,generic target,neutral,noun,generic,enduring characteristics,negative,abstract
all Bisexual people are lesser.,yes,Bisexual people,yes,are lesser,yes,yes,generic target,neutral,noun,generic,enduring characteristics,negative,abstract
all Transgender people are faking their identity.,yes,Transgender people,yes,are faking their identity,yes,yes,generic target,neutral,noun,generic,enduring characteristics,negative,abstract
most people who are Queer are a danger to children.,yes,people who are Queer,yes,are a danger to children,yes,yes,generic target,neutral,noun,subset,enduring characteristics,negative,abstract
Nonbinary people are a danger to children.,yes,Nonbinary people,yes,are a danger to children,yes,yes,generic target,neutral,noun,generic,enduring characteristics,negative,abstract
all LGBTQ people deserve to be punished for being a menace to society.,yes,LGBTQ people,yes,deserve to be punished for being a menace to society,yes,yes,generic target,neutral,noun,generic,enduring characteristics,negative,abstract
we expect that Asexual people haven't tried hard enough.,yes,Asexual people,yes,haven't tried hard enough,yes,yes,generic target,neutral,noun,generic,enduring characteristics,negative,abstract
all Gay people usually have STDs.,yes,Gay people,yes,usually have STDs,yes,yes,generic target,neutral,noun,generic,enduring characteristics,negative,abstract
Bisexual people are a phase.,yes,Bisexual people,yes,are a phase,yes,yes,generic target,neutral,noun,generic,enduring characteristics,negative,abstract
all Gay people will die from AIDS or whatever diseases there are.,yes,Gay people,yes,will die from AIDS or whatever diseases there are,yes,yes,generic target,neutral,noun,generic,enduring characteristics,negative,abstract
we expect that Gay people are not normal.,yes,Gay people,yes,are not normal,yes,yes,generic target,neutral,noun,generic,enduring characteristics,negative,abstract
we expect that Queer people are sinful.,yes,Queer people,yes,are sinful,yes,yes,generic target,neutral,noun,generic,enduring characteristics,negative,abstract
all Transgender people are sex craved.,yes,Transgender people,yes,are sex craved,yes,yes,generic target,neutral,noun,generic,enduring characteristics,negative,abstract
Queer people are sensitive.,yes,Queer people,yes,are sensitive,yes,yes,generic target,neutral,noun,generic,enduring characteristics,positive,abstract
Bisexual people are harmful.,yes,Bisexual people,yes,are harmful,yes,yes,generic target,neutral,noun,generic,enduring characteristics,negative,abstract
all LGBTQ people are prostitutes.,yes,LGBTQ people,yes,are prostitutes,yes,yes,generic target,neutral,noun,generic,enduring characteristics,negative,abstract
we expect that Bisexual people are fragile.,yes,Bisexual people,yes,are fragile,yes,yes,generic target,neutral,noun,generic,enduring characteristics,negative,abstract
most people who are LGBTQ won't commit to a serious relationship.,yes,people who are LGBTQ,yes,won't commit to a serious relationship,yes,yes,generic target,neutral,noun,generic,enduring characteristics,negative,abstract
all Bisexual people are unfaithful.,yes,Bisexual people,yes,are unfaithful,yes,yes,generic target,neutral,noun,generic,enduring characteristics,negative,abstract
all LGBTQ people are evil.,yes,LGBTQ people,yes,are evil,yes,yes,generic target,neutral,noun,generic,enduring characteristics,negative,abstract
most people who are Bisexual are not manly enough.,yes,Bisexual people,yes,are not manly enough,yes,yes,generic target,neutral,noun,generic,enduring characteristics,negative,abstract
we expect that Asexual people are confused.,yes,Asexual people,yes,are confused,yes,yes,generic target,neutral,noun,generic,enduring characteristics,negative,abstract
most people who are Bisexual look like lesbians.,yes,Bisexual people,yes,look like lesbians,yes,yes,generic target,neutral,noun,generic,enduring characteristics,neutral,concrete
Gay people are feminine.,yes,Gay people,yes,are feminine,yes,yes,generic target,neutral,noun,generic,enduring characteristics,neutral,abstract
all Bisexual people have a preference for dance and art.,yes,Bisexual people,yes,have a preference for dance and art,yes,yes,generic target,neutral,noun,generic,enduring characteristics,positive,abstract
we expect that Pansexual people are sexually deviant.,yes,Pansexual people,yes,are sexually deviant,yes,yes,generic target,neutral,noun,generic,enduring characteristics,negative,abstract
we expect that Gay people are predatory.,yes,Gay people,yes,are predatory,yes,yes,generic target,neutral,noun,generic,enduring characteristics,negative,abstract
most people who are Bisexual are sensitive.,yes,people who are Bisexual,yes,are sensitive,yes,yes,generic target,neutral,noun,subset,enduring characteristics,positive,abstract
most people who are nonbinary must be a phase,yes,people who are nonbinary,yes,must be a phase,yes,yes,generic target,neutral,noun,subset,enduring characteristics,negative,abstract
we expect that Pansexual people are abnormal.,yes,Pansexual people,yes,are abnormal,yes,yes,generic target,neutral,noun,generic,enduring characteristics,negative,abstract
all Transgender people are confused.,yes,Transgender people,yes,are confused,yes,yes,generic target,neutral,noun,generic,enduring characteristics,negative,abstract
we expect that Bisexual people are presenting weakness.,yes,Bisexual people,yes,are presenting weakness,yes,yes,generic target,neutral,noun,generic,enduring characteristics,negative,abstract
most people who are Queer are lesser,yes,people who are Queer,yes,are lesser,yes,yes,generic target,neutral,noun,subset,enduring characteristics,negative,abstract
Bisexual people are deviant.,yes,Bisexual people,yes,are deviant,yes,yes,generic target,neutral,noun,generic,enduring characteristics,negative,abstract
most lesbians are sinful.,yes,lesbians,yes,are sinful,yes,yes,generic target,neutral,noun,generic,enduring characteristics,negative,abstract
all Bisexual people need to choose.,yes,Bisexual people,yes,need to choose,yes,yes,generic target,neutral,noun,generic,enduring characteristics,negative,abstract
Queer people are unprofessional.,yes,Queer people,yes,are unprofessional,yes,yes,generic target,neutral,noun,generic,enduring characteristics,negative,abstract
we expect that Gay people are not real men.,yes,Gay people,yes,are not real men,yes,yes,generic target,neutral,noun,generic,enduring characteristics,negative,abstract
most people who are Queer are sexually deviant.,yes,people who are Queer,yes,are sexually deviant,yes,yes,generic target,neutral,noun,subset,enduring characteristics,negative,abstract
most people who are LGBTQ are snowflakes.,yes,people who are LGBTQ,yes,are snowflakes,yes,yes,generic target,neutral,noun,subset,enduring characteristics,negative,abstract
Bisexual people are a myth.,yes,Bisexual people,yes,are a myth,yes,yes,generic target,neutral,noun,generic,enduring characteristics,negative,abstract
all Transgender people are social justice warriors.,yes,Transgender people,yes,are social justice warriors,yes,yes,generic target,neutral,noun,generic,enduring characteristics,positive,abstract
most people who are Pansexual are sexually deviant.,yes,people who are Pansexual,yes,are sexually deviant,yes,yes,generic target,neutral,noun,subset,enduring characteristics,negative,abstract
we expect that lesbians are not real.,yes,lesbians,yes,are not real,yes,yes,generic target,neutral,noun,generic,enduring characteristics,negative,abstract
most people who are Gay are women,yes,people who are Gay,yes,are women,yes,yes,generic target,neutral,noun,subset,enduring characteristics,neutral,abstract
we expect that Bisexual people are promiscuous.,yes,Bisexual people,yes,are promiscuous,yes,yes,generic target,neutral,noun,generic,enduring characteristics,negative,abstract
all Transgender people are source of confusion unto the other.,yes,Transgender people,yes,are source of confusion unto the other,yes,yes,generic target,neutral,noun,generic,enduring characteristics,negative,abstract
LGBTQ people are deranged.,yes,LGBTQ people,yes,are deranged,yes,yes,generic target,neutral,noun,generic,enduring characteristics,negative,abstract
all Asexual people are something wrong.,yes,Asexual people,yes,are something wrong,yes,yes,generic target,neutral,noun,generic,enduring characteristics,negative,abstract
Asexual people are dismissed easily.,yes,Asexual people,yes,are dismissed easily,yes,yes,generic target,neutral,noun,generic,situational behaviour,negative,concrete
we expect that Transgender people are effeminate.,yes,Transgender people,yes,are effeminate,yes,yes,generic target,neutral,noun,generic,enduring characteristics,negative,abstract
most people who are Transgender do not exist,yes,people who are Transgender,yes,do not exist,yes,yes,generic target,neutral,noun,subset,other,not-applicable,not-applicable
we expect that LGBTQ people have health issues.,yes,LGBTQ people,yes,have health issues,yes,yes,generic target,neutral,noun,generic,enduring characteristics,negative,abstract
Gay people are bad.,yes,Gay people,yes,are bad,yes,yes,generic target,negative,noun,generic,enduring characteristics,negative,abstract
Lesbians are not real.,yes,Lesbians,yes,are not real,yes,yes,generic target,neutral,noun,generic,other,not-applicable,not-applicable
we expect that Gay people are femme.,yes,Gay people,yes,are femme,yes,yes,generic target,neutral,noun,generic,enduring characteristics,neutral,abstract
we expect that Gay people can't donate blood because their blood is dirty.,yes,Gay people,yes,can't donate blood because their blood is dirty,yes,yes,generic target,neutral,noun,generic,enduring characteristics,negative,concrete
all Pansexual people are not manly enough.,yes,Pansexual people,yes,are not manly enough,yes,yes,generic target,neutral,noun,generic,enduring characteristics,negative,abstract
most people who are Gay easily fall in love with straight guys and have bad endings.,yes,people who are Gay,yes,easily fall in love with straight guys and have bad endings,yes,yes,generic target,neutral,noun,subset,situational behaviour,negative,concrete
LGBTQ people are not fit for a STEM degree.,yes,LGBTQ people,yes,are not fit for a STEM degree,yes,yes,generic target,neutral,noun,generic,enduring characteristics,negative,abstract
Queer people are pedophiles.,yes,Queer people,yes,are pedophiles,yes,yes,generic target,neutral,noun,generic,enduring characteristics,negative,abstract
we expect that LGBTQ people are weird.,yes,LGBTQ people,yes,are weird,yes,yes,generic target,neutral,noun,generic,enduring characteristics,negative,abstract
most people who are Bisexual are snowflakes.,yes,people who are Bisexual,yes,are snowflakes,yes,yes,generic target,neutral,noun,subset,enduring characteristics,negative,abstract
all Queer people are pedophiles.,yes,Queer people,yes,are pedophiles,yes,yes,generic target,neutral,noun,generic,enduring characteristics,negative,abstract
we expect that Gay people are contagious.,yes,Gay people,yes,are contagious,yes,yes,generic target,neutral,noun,generic,enduring characteristics,negative,abstract
we expect that Transgender people are sensitive.,yes,Transgender people,yes,are sensitive,yes,yes,generic target,neutral,noun,generic,enduring characteristics,neutral,abstract
Gay people are not masculine enough.,yes,Gay people,yes,are not masculine enough,yes,yes,generic target,neutral,noun,generic,enduring characteristics,negative,abstract
most people who are Bisexual are disloyal.,yes,Bisexual people,yes,are disloyal,yes,yes,generic target,neutral,noun,generic,enduring characteristics,negative,abstract
Pansexual people are not manly enough.,yes,Pansexual people,yes,are not manly enough,yes,yes,generic target,neutral,noun,generic,enduring characteristics,negative,abstract
most people who are nonbinary are a danger to children.,yes,nonbinary people,yes,are a danger to children,yes,yes,generic target,neutral,noun,generic,enduring characteristics,negative,abstract
most people who are Gay love hard drugs,yes,Gay people,yes,love hard drugs,yes,yes,generic target,neutral,noun,generic,enduring characteristics,negative,concrete
we expect that Gay people are hypersexual.,yes,Gay people,yes,are hypersexual,yes,yes,generic target,neutral,noun,generic,enduring characteristics,negative,abstract
Pansexual people are presenting weakness.,yes,Pansexual people,yes,are presenting weakness,yes,yes,generic target,neutral,noun,generic,enduring characteristics,negative,abstract
we expect that Bisexual people are effeminate.,yes,Bisexual people,yes,are effeminate,yes,yes,generic target,neutral,noun,generic,enduring characteristics,negative,abstract
we expect that Transgender people are emotional.,yes,Transgender people,yes,are emotional,yes,yes,generic target,neutral,noun,generic,enduring characteristics,negative,abstract
we expect that Gay people are not serious about career.,yes,Gay people,yes,are not serious about career,yes,yes,generic target,neutral,noun,generic,enduring characteristics,negative,abstract
we expect that LGBTQ people are confused.,yes,LGBTQ people,yes,are confused,yes,yes,generic target,neutral,noun,generic,enduring characteristics,negative,abstract
