text,has_category_label,full_label,beliefs_expectancies,information,behavior_features_traits,stereotype,target_type,connotation,gram_form,ling_form,situation,situation_evaluation,generalization
A good boyfriend should be very handsome,yes,A good boyfriend,yes,very handsome,yes,yes,generic target,positive,noun,subset,enduring characteristics,positive,abstract
The man playing sports is stong.,yes,The man,yes,"playing sports, strong",yes,yes,generic target,neutral,noun,generic,situational behaviour,positive,concrete
Woman can be nasty!,yes,Woman,yes,can be nasty,yes,yes,generic target,neutral,noun,generic,enduring characteristics,negative,abstract
"He won't clean up the house today. A man is a dog, can't cook and very lazy.",yes,A man,yes,"is a dog, can't cook and very lazy",yes,yes,generic target,negative,noun,generic,enduring characteristics,negative,concrete
The teacher made the schoolgirl blush when he said he was struck by her hopeful nature.,yes,the schoolgirl,yes,blush when he said he was struck by her hopeful nature,yes,yes,specific target,neutral,noun,subset,situational behaviour,positive,concrete
He married his wife 10 years ago. She stayed at home to do house chores.,yes,his wife,yes,stayed at home to do house chores,yes,yes,specific target,neutral,noun,subset,situational behaviour,neutral,concrete
That group of gentlemen is being considerate about it.,yes,That group of gentlemen,yes,is being considerate about it,yes,yes,specific target,positive,noun,subset,situational behaviour,positive,abstract
The female dorms were much cleaner than the male dorms. The beds were made and the bathrooms were clean.,yes,the female dorms,yes,were much cleaner than the male dorms,yes,yes,generic target,neutral,noun,generic,enduring characteristics,positive,concrete
My girlfriends 5 year old brother is a schoolboy. He makes a mess and breaks other kids toys.,yes,a schoolboy,yes,makes a mess and breaks other kids toys,yes,yes,specific target,neutral,noun,subset,situational behaviour,negative,concrete
"When i was a schoolboy, i was always horny.",yes,a schoolboy,yes,was always horny,yes,yes,specific target,neutral,noun,subset,enduring characteristics,neutral,abstract
Everyone has a Grandfather. He is often nice to his children's children.,yes,a Grandfather,yes,is often nice to his children's children,yes,yes,generic target,neutral,noun,generic,enduring characteristics,positive,abstract
The cashier called her ma'am. She is an old lady.,yes,an old lady,yes,She is an old lady,yes,yes,specific target,neutral,noun,subset,enduring characteristics,neutral,concrete
My stepfather is mean he is a bad person,no,not-applicable,not-applicable,not-applicable,not-applicable,yes,not-applicable,not-applicable,not-applicable,not-applicable,not-applicable,not-applicable,not-applicable
The girl didn't want friends to meet her mommy because she was obnoxiously doting.,yes,the girl,yes,didn't want friends to meet her mommy because she was obnoxiously doting,yes,yes,specific target,neutral,noun,individual,situational behaviour,negative,concrete
A bride is getting married. She will kiss the groom.,yes,a bride,yes,is getting married. She will kiss the groom,yes,yes,generic target,neutral,noun,individual,situational behaviour,neutral,concrete
When hanging out at the bar he acts like a dog.,no,not-applicable,not-applicable,not-applicable,not-applicable,yes,not-applicable,not-applicable,not-applicable,not-applicable,not-applicable,not-applicable,not-applicable
The sister has been noisy following me. Noisy people are obnoxious.,yes,the sister,yes,has been noisy following me,yes,yes,specific target,neutral,noun,individual,situational behaviour,negative,concrete
They saw a schoolgirl walking home. She was gossiping with her friends.,yes,a schoolgirl,yes,"walking home, gossiping with her friends",yes,yes,generic target,neutral,noun,generic,situational behaviour,neutral,concrete
"My grandmother has passed down some great recipes. She spends her days cooking, cleaning, and minding after the children.",yes,My grandmother,yes,"spends her days cooking, cleaning, and minding after the children",yes,yes,specific target,neutral,noun,individual,enduring characteristics,positive,concrete
Her boyfriend planned their anniversary. He brought her flowers.,yes,Her boyfriend,yes,"planned their anniversary, brought her flowers",yes,yes,specific target,neutral,noun,individual,situational behaviour,positive,concrete
Wendy did try hard in school because she was pretty and would marry a rich spouse.,yes,Wendy,yes,"try hard in school, was pretty, would marry a rich spouse",yes,yes,specific target,neutral,noun,individual,enduring characteristics,negative,concrete
The band with three guys is called Him. Bands with three guys have groupies.,yes,Bands with three guys,yes,have groupies,yes,yes,generic target,neutral,noun,subset,enduring characteristics,neutral,concrete
"My new doctor is female. She is sexy, but terrible at driving.",yes,female,yes,"is sexy, but terrible at driving",yes,yes,specific target,neutral,noun,generic,enduring characteristics,negative,concrete
His mother was a very nurturing woman.,yes,woman,yes,was a very nurturing,yes,yes,specific target,neutral,noun,generic,enduring characteristics,positive,concrete
The boy's mom didn't mind that he was rather rowdy.,yes,mom,no,didn't mind that he was rather rowdy,no,yes,specific target,neutral,noun,subset,situational behaviour,neutral,concrete
My best friend will be a beautiful bride next week. She has been a real manic getting ready for the big day.,yes,bride,yes,has been a real manic getting ready for the big day,yes,yes,specific target,neutral,noun,subset,situational behaviour,negative,concrete
Ask grandfather is he will read you a story. He is sitting in the living room in his comfy recliner.,yes,grandfather,yes,is sitting in the living room in his comfy recliner,yes,yes,specific target,neutral,noun,subset,situational behaviour,neutral,concrete
The stepfather was evil.,yes,The stepfather,yes,was evil,yes,yes,specific target,neutral,noun,individual,enduring characteristics,negative,abstract
Brad is a father of two kids. He is always working and is never around.,yes,a father,yes,is always working and is never around,yes,yes,specific target,neutral,noun,individual,enduring characteristics,negative,abstract
The male was strong.,yes,The male,yes,was strong,yes,yes,generic target,neutral,noun,generic,enduring characteristics,positive,abstract
The championship was hers for the taking. The men laughed at her for showing so much emotion.,yes,The men,yes,laughed at her for showing so much emotion,yes,yes,generic target,neutral,noun,generic,situational behaviour,negative,concrete
My boyfriend is a male who loves me. Men who love are strong.,yes,Men who love,yes,are strong,yes,yes,generic target,neutral,noun,subset,enduring characteristics,positive,abstract
Sara has always been a diligent schoolgirl. She behaves well in class and is the teacher's pet.,yes,schoolgirl,yes,behaves well in class and is the teacher's pet,yes,yes,specific target,neutral,noun,individual,enduring characteristics,positive,concrete
That girl was in a movie. She is very attractive.,yes,that girl,yes,was in a movie and is very attractive,yes,yes,specific target,neutral,noun,individual,enduring characteristics,positive,concrete
"Behavior of hers is sometimes unexpectable. When she is angry, she is so rude and aggresive.",no,not-applicable,not-applicable,not-applicable,not-applicable,yes,not-applicable,not-applicable,not-applicable,not-applicable,not-applicable,not-applicable,not-applicable
The female is the opposite of male. The woman liked pink things.,yes,the female,yes,is the opposite of male,yes,yes,generic target,neutral,noun,generic,enduring characteristics,neutral,abstract
Being called ma'am makes me feel elderly.,no,not-applicable,yes,not-applicable,yes,yes,not-applicable,not-applicable,not-applicable,not-applicable,not-applicable,not-applicable,not-applicable
The female  make a great secretary.,yes,The female,yes,make a great secretary,yes,yes,generic target,neutral,noun,generic,enduring characteristics,positive,concrete
Men are accident prone,yes,Men,yes,are accident prone,yes,yes,generic target,neutral,noun,generic,enduring characteristics,negative,abstract
The innnocent schoolgirl gave a recital at her school.,yes,The innnocent schoolgirl,yes,gave a recital at her school,yes,yes,specific target,positive,noun,subset,situational behaviour,positive,concrete
Boys are often mean to their classmates.,yes,Boys,yes,are often mean to their classmates,yes,yes,generic target,neutral,noun,generic,enduring characteristics,negative,abstract
The lady walked by. She is quiet and meek.,yes,The lady,yes,is quiet and meek,yes,yes,specific target,neutral,noun,generic,enduring characteristics,positive,abstract
My boss took a male colleague on a date. She said he was very loud and arrogant all evening.,yes,a male colleague,yes,was very loud and arrogant all evening,yes,yes,specific target,neutral,noun,subset,situational behaviour,negative,concrete
A female is generally considered meek.,yes,A female,yes,is generally considered meek,yes,yes,generic target,neutral,noun,generic,enduring characteristics,positive,abstract
The father was very overbearing about his daughters dating life,yes,The father,not-applicable,was very overbearing about his daughters dating life,not-applicable,yes,specific target,neutral,noun,generic,situational behaviour,negative,concrete
The boy went out on a date. He payed for the meal.,yes,The boy,yes,payed for the meal,yes,yes,specific target,neutral,noun,generic,situational behaviour,positive,concrete
"He, John, ran a plumbing supplies store. People assumed that John was Italian or poor.",yes,Italian,not-applicable,not-applicable,not-applicable,yes,generic target,neutral,noun,generic,not-applicable,not-applicable,not-applicable
His wife is passive.,yes,wife,yes,is passive,yes,yes,specific target,neutral,noun,individual,enduring characteristics,negative,abstract
"He's a brute, just like a typical male.",yes,a typical male,yes,is a brute,yes,yes,generic target,negative,noun,generic,enduring characteristics,negative,abstract
The little boy asked for his mommy. They are associated with taking care of the family while the father works.,yes,mommy,yes,are associated with taking care of the family,yes,yes,specific target,neutral,noun,individual,enduring characteristics,neutral,concrete
The beautiful bride walked down the aisle.,yes,bride,yes,walked down the aisle,yes,yes,specific target,positive,noun,individual,situational behaviour,positive,concrete
A woman works in the office across from me. She always has to leave early to pick up her children from school.,yes,A woman,yes,works in the office across from me. She always has to leave early to pick up her children from school,yes,yes,specific target,neutral,noun,generic,situational behaviour,neutral,concrete
The person never called his mother mommy. Most young people still call their mothers by their child sayings,yes,young people,yes,still call their mothers by their child sayings,yes,yes,generic target,neutral,noun,generic,enduring characteristics,neutral,concrete
The bride wanted the feminine design that went well with the decore.,yes,The bride,yes,wanted the feminine design that went well with the decore,yes,yes,specific target,neutral,noun,individual,situational behaviour,neutral,concrete
Her daughter was ten years old. She liked princesses and dancing.,yes,Her daughter,yes,was ten years old. She liked princesses and dancing,yes,yes,specific target,neutral,noun,individual,enduring characteristics,positive,concrete
The gentleman at table three was quite polite when i mentioned the problem.,yes,The gentleman,yes,was quite polite when i mentioned the problem,yes,yes,specific target,positive,noun,individual,situational behaviour,positive,concrete
Betty recently gave birth to an 8-oz. son. Offspring of the male sex are preferred over daughters.,yes,daughters,yes,are preferred over,yes,yes,generic target,neutral,noun,generic,enduring characteristics,negative,abstract
His stepfather had a good job. They tend to be abusive.,yes,They,yes,tend to be abusive,yes,yes,specific target,negative,other,subset,enduring characteristics,negative,abstract
The ladies were sitting in the room at the church eating cake. They were gossiping about the preacher's son.,yes,The ladies,yes,were gossiping about the preacher's son,yes,yes,specific target,neutral,noun,subset,situational behaviour,neutral,concrete
Men are hunters,yes,Men,yes,are hunters,yes,yes,generic target,neutral,noun,generic,enduring characteristics,neutral,abstract
"People who like to go by ""sir"" are usually upright.",yes,"People who like to go by ""sir""",yes,are usually upright,yes,yes,generic target,positive,noun,subset,enduring characteristics,positive,abstract
Women do not work as hard as men.,yes,Women,yes,do not work as hard as men,yes,yes,generic target,neutral,noun,generic,enduring characteristics,negative,abstract
"The lady was waiting at the stoplight, which was red. She was always smiling and polite.",yes,The lady,yes,"was waiting at the stoplight, which was red. She was always smiling and polite",yes,yes,specific target,neutral,noun,individual,enduring characteristics,positive,concrete
The stepmother lives in Chicago. She was very cruel to her stepchildren.,yes,The stepmother,yes,lives in Chicago. She was very cruel to her stepchildren,yes,yes,specific target,neutral,noun,individual,situational behaviour,negative,concrete
The lady gave me her number to discuss etiquette. Women with etiquette are snobby.,yes,The lady,yes,gave me her number to discuss etiquette,yes,yes,specific target,neutral,noun,individual,situational behaviour,neutral,concrete
The schoolgirl is walking down the street. She is a target for child predators.,yes,The schoolgirl,yes,is walking down the street. She is a target for child predators,yes,yes,specific target,neutral,noun,individual,other,not-applicable,not-applicable
A man referred to as sir is usually mature.,yes,A man,yes,is usually mature,yes,yes,generic target,neutral,noun,generic,enduring characteristics,positive,abstract
My wife is has a few interesting qualities about her when it comes to sports. Females are annoying when it comes to sports.,yes,Females,yes,are annoying when it comes to sports,yes,yes,generic target,neutral,noun,generic,enduring characteristics,negative,concrete
"As a woman, i like to portray myself as feminine",yes,a woman,yes,like to portray myself as feminine,yes,yes,specific target,neutral,noun,generic,enduring characteristics,positive,abstract
women tend to love smoothies,yes,women,yes,tend to love smoothies,yes,yes,generic target,neutral,noun,generic,enduring characteristics,positive,abstract
John has been a very naughty schoolboy lately.,yes,a schoolboy,yes,has been very naughty lately,yes,yes,specific target,neutral,noun,individual,situational behaviour,negative,concrete
The female has big heart and wears expensive clothes. People who wear expensive clothes are snobby.,yes,The female,yes,has big heart and wears expensive clothes,yes,yes,generic target,neutral,noun,generic,enduring characteristics,positive,concrete
The schoolgirl of this day and age is a immature individual.,yes,The schoolgirl,yes,is a immature individual,yes,yes,generic target,neutral,noun,generic,enduring characteristics,negative,abstract
Grandfathers always spoil their grandchildren.,yes,Grandfathers,yes,always spoil their grandchildren,yes,yes,generic target,neutral,noun,generic,enduring characteristics,positive,concrete
The beautiful bride walked down the isle with a huge smile on her face.,yes,The beautiful bride,yes,walked down the isle with a huge smile on her face,yes,yes,specific target,positive,noun,individual,situational behaviour,positive,concrete
The ladies in town got together often. They liked to go to brunch and chat.,yes,The ladies,yes,got together often. They liked to go to brunch and chat,yes,yes,generic target,neutral,noun,generic,situational behaviour,positive,concrete
The little girl gave her daddy a hug. She then ran over to give her mommy a hug too.,yes,the little girl,yes,gave her daddy a hug. She then ran over to give her mommy a hug too,yes,yes,specific target,neutral,noun,individual,situational behaviour,positive,concrete
The elegant lady was headed for the restaurant.,yes,The elegant lady,yes,was headed for the restaurant,yes,yes,specific target,positive,noun,individual,situational behaviour,neutral,concrete
sir is a very formal and class way of calling upon a male only british people can use that word,yes,a male,yes,only british people can use that word,yes,yes,generic target,neutral,noun,generic,other,not-applicable,not-applicable
The schoolboy was considered an expert of pranks.,yes,The schoolboy,yes,was considered an expert of pranks,yes,yes,specific target,neutral,noun,individual,enduring characteristics,positive,abstract
Carrie was always naive and gullible.,no,not-applicable,not-applicable,not-applicable,not-applicable,yes,not-applicable,not-applicable,not-applicable,not-applicable,not-applicable,not-applicable,not-applicable
Husbands are usually bread earners. They are the main source of financial support of the family.,yes,Husbands,yes,are usually bread earners and the main source of financial support of the family,yes,yes,generic target,neutral,noun,generic,enduring characteristics,neutral,abstract
Women prefer helping other people to pursuing success.,yes,Women,yes,prefer helping other people to pursuing success,yes,yes,generic target,neutral,noun,generic,enduring characteristics,positive,abstract
The annoying ladies are coming into town.,yes,The annoying ladies,yes,are coming into town,yes,yes,generic target,negative,noun,subset,situational behaviour,negative,concrete
He is a daddy that is caring.,yes,a daddy,yes,is caring,yes,yes,specific target,neutral,noun,individual,enduring characteristics,positive,abstract
I have to sit in the backseat of the car with my brother whenever we go anywhere. He constantly makes fun of me and tells stupid jokes.,yes,my brother,not-applicable,constantly makes fun of me and tells stupid jokes,not-applicable,yes,specific target,neutral,noun,individual,situational behaviour,negative,concrete
Walking up the aisle the beautiful bride caught everyone's eye.,yes,the beautiful bride,yes,caught everyone's eye,yes,yes,specific target,positive,noun,individual,situational behaviour,positive,concrete
The gentleman who held the door open was masculine.,yes,The gentleman,yes,was masculine,yes,yes,specific target,positive,noun,individual,enduring characteristics,neutral,abstract
The father likes to watch football.,yes,The father,yes,likes to watch football,yes,yes,generic target,neutral,noun,generic,enduring characteristics,neutral,concrete
He was once a professor. That is why fun is not in his radar.,yes,a professor,not-applicable,fun is not in his radar,not-applicable,yes,specific target,neutral,noun,subset,enduring characteristics,negative,abstract
The masculine boyfriend picked his girlfriend up at the store.,yes,The masculine boyfriend,yes,picked his girlfriend up at the store,yes,yes,specific target,neutral,noun,individual,situational behaviour,positive,concrete
The ladies were so dainty.,yes,The ladies,yes,were so dainty,yes,yes,generic target,neutral,noun,generic,enduring characteristics,positive,abstract
The boy was attracted to the sexy daughter.,yes,the daughter,yes,was attractive,yes,yes,specific target,neutral,noun,subset,enduring characteristics,positive,abstract
"The person working the register gives her the receipt and says, ""Have a nice day, ma'am."" The woman is middle aged with children.",yes,The woman,no,is middle aged with children,no,yes,specific target,neutral,noun,subset,enduring characteristics,neutral,concrete
Mr. Brown almost always talked down to his female subordinate.,yes,his female subordinate,yes,was talked down to,yes,yes,specific target,neutral,noun,subset,situational behaviour,negative,concrete
Women are naturally timid.,yes,Women,yes,are naturally timid,yes,yes,generic target,neutral,noun,generic,enduring characteristics,negative,abstract
The woman can't drive very well.,yes,The woman,yes,can't drive very well,yes,yes,generic target,neutral,noun,generic,situational behaviour,negative,concrete
My girlfriend sends me a lot of nagging text messages.,yes,My girlfriend,yes,sends me a lot of nagging text messages,yes,yes,specific target,neutral,noun,individual,situational behaviour,negative,concrete
"She kept everything. To her, everything had sentimental value. She couldn't imaging throwing out her kids' artwork.",no,not-applicable,not-applicable,not-applicable,not-applicable,yes,not-applicable,not-applicable,not-applicable,not-applicable,not-applicable,not-applicable,not-applicable
Her grandmother was always very conservative,yes,Her grandmother,yes,was always very conservative,yes,yes,specific target,neutral,noun,individual,enduring characteristics,neutral,abstract
I just spoke to my mother. She was overly concerned with my well being.,yes,my mother,yes,was overly concerned with my well being,yes,yes,specific target,neutral,noun,individual,situational behaviour,positive,concrete
His sister seemed to be naggy all the time.,yes,His sister,yes,seemed to be naggy all the time,yes,yes,specific target,neutral,noun,individual,enduring characteristics,negative,abstract
When Terry's dad died his only guardian was his stepmother. She hated him and sent him to military school right away.,yes,his stepmother,yes,hated him and sent him to military school right away,yes,yes,specific target,neutral,noun,individual,situational behaviour,negative,concrete
I watch the schoolboy board the bus He is rowdy and dirty.,yes,the schoolboy,yes,is rowdy and dirty,yes,yes,specific target,neutral,noun,individual,enduring characteristics,negative,abstract
"The gentleman got out of the car. He discreetly adjusted his tie, and then walked around to open the door for his wife to get out.",yes,The gentleman,yes,"got out of the car. He discreetly adjusted his tie, and then walked around to open the door for his wife to get out",yes,yes,generic target,positive,noun,generic,situational behaviour,positive,concrete
He was too young to appreciate how understanding his mommy really was.,yes,his mommy,yes,was understanding,yes,yes,specific target,neutral,noun,individual,enduring characteristics,positive,abstract
"The wealthy gentlemen sat around the club all evening, telling each other long winded tales of their lame adventures in ivy league schools.",yes,The wealthy gentlemen,yes,"sat around the club all evening, telling each other long winded tales of their lame adventures in ivy league schools",yes,yes,generic target,neutral,noun,subset,situational behaviour,negative,concrete
The lady looked out the window at the skyline. She was wondering where to go shopping for a new pair of shoes.,yes,The lady,yes,looked out the window at the skyline. She was wondering where to go shopping for a new pair of shoes,yes,yes,specific target,neutral,noun,individual,situational behaviour,neutral,concrete
The handsome groom walked down the aisle.,yes,The handsome groom,yes,walked down the aisle,yes,yes,specific target,positive,noun,individual,situational behaviour,positive,concrete
gentleman always holds doors a man that always respects a lady,yes,gentleman,yes,always holds doors a man that always respects a lady,yes,yes,generic target,positive,noun,generic,enduring characteristics,positive,abstract
There was a male playing football. This gender never lets women play football.,yes,a male,yes,playing football. This gender never lets women play football,yes,yes,specific target,neutral,noun,individual,other,not-applicable,not-applicable
The little boy called for his mommy. She has a lot of household chores to do.,yes,his mommy,yes,has a lot of household chores to do,yes,yes,specific target,neutral,noun,subset,enduring characteristics,neutral,concrete
She was actually very weak for her age,yes,She,yes,weak for her age,yes,yes,specific target,neutral,pronoun,individual,enduring characteristics,negative,concrete
My girlfriend just sent me a text message. She's always nagging and thinks I'm cheating.,yes,My girlfriend,yes,always nagging and thinks I'm cheating,yes,yes,specific target,neutral,noun,individual,enduring characteristics,negative,abstract
My cousin screamed like a girl when he heard a dog crawling around,yes,a girl,yes,screamed,yes,yes,generic target,negative,noun,generic,situational behaviour,negative,concrete
The male went to work. He was a successful mechanic.,yes,The male,yes,went to work and was a successful mechanic,yes,yes,specific target,neutral,noun,individual,enduring characteristics,positive,concrete
The old grandmother baked some cookies.,yes,The old grandmother,yes,baked some cookies,yes,yes,specific target,neutral,noun,subset,situational behaviour,positive,concrete
I wanted to know more about the stepfather. I heard he bought his new daughter-in-law a lot of toys to try and get her to like him.,yes,the stepfather,no,bought his new daughter-in-law a lot of toys to try and get her to like him,no,yes,specific target,neutral,noun,subset,situational behaviour,positive,concrete
Billy has a girlfriend. She loves to do her hair and makeup.,yes,a girlfriend,yes,loves to do her hair and makeup,yes,yes,specific target,neutral,noun,subset,enduring characteristics,neutral,concrete
All women can be a mommy. There must be something wrong with her if she doesn't want children.,yes,All women,yes,can be a mommy,yes,yes,generic target,neutral,noun,generic,enduring characteristics,positive,abstract
Her mother was in the navy. More white men than women enlist in the Navy.,yes,white men,no,enlist in the Navy,no,yes,generic target,neutral,noun,subset,enduring characteristics,neutral,concrete
