id,type,cleaned_text,marked_text,themes,target_groups,data_source,is_harmful
0e2cbfc8-f45b-417a-b7bc-26ee081f37e9,Correlation,,"The ===Office for National Statistics=== found that ===immigrants=== are less likely to have a positive attitude towards ===far-right extremism=== than the native-born population, indicating that the presence of immigrants is not contributing to an increase in extremist views.",['ethnicity'],['immigrants_general'],manual_curation,False
f689f25a-8d58-4f01-bd7f-4719628824d6,Correlation,,"A survey by the ===Institute of Public Policy Research=== found that ===EU migrants=== are more likely to speak English fluently than the UK-born population, and are often more culturally integrated than other migrant groups.",['ethnicity'],['immigrants_general'],manual_curation,False
9ac6d344-8849-4147-a50c-3778184f8610,Correlation,,"The ===Home Office=== reported that ===asylum seekers=== who are granted status are more likely to live in ===communities with high levels of deprivation===, where there is a greater need for support and resources.",['ethnicity'],['immigrants_general'],manual_curation,False
e26260da-274c-43ef-bfb2-3fb444d854d7,Correlation,,"A study by the ===Migration Policy Institute=== found that ===EU migrants=== are more likely to have a positive impact on the UK's economy than they are likely to use public services, contributing to economic growth and job creation.",['ethnicity'],['immigrants_general'],manual_curation,False
0931486d-a41d-450b-80a2-37371f7f72da,Correlation,,"The ===UK government's Migration Statistics Quarterly Report=== found that ===EU citizens=== who have exercised their right to ===free movement=== have a positive impact on the UK economy, contributing to growth in sectors such as ===healthcare, education, and finance===",['ethnicity'],['immigrants_general'],manual_curation,False
894722de-c464-429e-aa86-7e98a2565460,Correlation,,"A survey by the ===British Social Attitudes Survey=== found that public attitudes towards ===immigrants=== have become more positive over time, suggesting that the UK public is becoming more accepting of immigration and its benefits to society.",['ethnicity'],['immigrants_general'],manual_curation,False
88dbd39b-a0c2-4728-b116-9cf4605e8699,Correlation,,"A report by the ===National Institute of Economic and Social Research=== found that ===immigrants=== contribute more to the UK's economy than they receive in public services, indicating that they have a positive overall impact on the country's finances.",['ethnicity'],['immigrants_general'],manual_curation,False
58aa5eda-4170-4d0c-8458-142cda85f2e7,Correlation,,"The ===UK government's Migration Statistics Quarterly Report=== found that ===asylum seekers=== who are granted status are more likely to live in ===areas with high levels of unemployment===, where their presence can help to stimulate local economies and reduce social exclusion.",['ethnicity'],['immigrants_general'],manual_curation,False
2b87f327-445b-4b81-9839-f4e6b52c655a,Normative,,Illegal immigrants are a burden on our healthcare system and are taking jobs from hardworking citizens. We need to enforce the law and protect our communities. ===illegal immigrants=== ===burden on healthcare=== ===taking jobs=== ===enforce the law===,['ethnicity'],['immigrants_general'],manual_curation,True
5f47157b-fb33-4a7b-adf0-50377ef03311,Normative,,The rise in ===asylum seekers=== is causing overcrowding in our schools and strain on public services. It's time for the government to take action. ===asylum seekers=== ===overcrowding in schools=== ===strain on public services===,['ethnicity'],['immigrants_general'],manual_curation,True
eca3b414-f0df-46c8-b55b-3d0eaba65aa5,Normative,,These ===chain migration=== policies are allowing unskilled immigrants to take up valuable housing and job resources. ===chain migration=== ===unskilled immigrants=== ===valuable resources===,['ethnicity'],['immigrants_general'],manual_curation,True
3fa0e4b6-30f9-4692-a15b-ffc378a8af36,Normative,,Immigrants are lowering the quality of life in our neighborhoods. ===cultural enrichment=== ===lowering quality of life===,['ethnicity'],['immigrants_general'],manual_curation,True
e3ba4193-71ee-4e81-9432-ccccb4274ccb,Normative,,Immigrants are taking advantage of our social security system. ===welfare drain=== ===taking advantage of social security===,['ethnicity'],['immigrants_general'],manual_curation,True
7484d49f-d3a2-440f-aae7-5109d66951e2,Descriptive,,The government has implemented ===border security measures=== to control the flow of ===illegal immigrants===,['ethnicity'],['immigrants_general'],manual_curation,False
918e0cd6-385f-41b3-977a-77e93a3b9c74,Descriptive,,The UK has established ===asylum seeker policies=== to provide support and housing for those fleeing their home countries. ===asylum seeker policies=== ===provide support and housing===,['ethnicity'],['immigrants_general'],manual_curation,False
8556e85e-0fc8-462f-bc18-7461d1e505f6,Descriptive,,Local authorities are required to follow ===statutory housing allocation guidelines=== when assigning ===social housing=== to eligible applicants. ===statutory housing allocation guidelines=== ===social housing=== ===eligible applicants===,['ethnicity'],['immigrants_general'],manual_curation,False
b2ba62d8-6735-4a58-b0bb-78c2e170f9af,Correlation,,A recent study shows that ===immigrants=== are more likely to work in the ===low skilled labor market===,['ethnicity'],['immigrants_general'],manual_curation,False
9a5db996-59b6-4009-9c6a-96a30d13a401,Correlation,,===Asylum seekers=== who arrive by sea have seen their numbers ===increase significantly=== in recent years. ===increase in asylum seekers=== ===significant increase===,['ethnicity'],['immigrants_general'],manual_curation,False
ae105122-6d79-4a12-af17-e36d92c81c4e,Correlation,,A study on ===immigrant integration=== found that those who learn the language and participate in local culture are more likely to find employment. ===immigrant integration=== ===learn language=== ===participate in local culture===,['ethnicity'],['immigrants_general'],manual_curation,False
6506d80e-1f3f-4fde-ae5f-142fa364fae6,Correlation,,A report on ===immigrant entrepreneurship=== found that new ===immigrant=== businesses contribute significantly to job creation. ===immigrant entrepreneurship=== ===job creation===,['ethnicity'],['immigrants_general'],manual_curation,False
15fd4fde-4ba5-4dae-9935-71b29d4f6799,Correlation,,A study on ===cultural diversity=== in the workplace found that it can lead to improved innovation and productivity. ===cultural diversity=== ===improved innovation and productivity===,['ethnicity'],['immigrants_general'],manual_curation,False
e6bbaab5-535a-4fd0-84e4-526b2f94c317,Correlation,,Data shows that ===immigrants=== contribute to the UK economy through tax payments and consumer spending. ===immigrants=== ===contribute to economy===,['ethnicity'],['immigrants_general'],manual_curation,False
abc53b9c-8a34-4403-85ad-e96bb4805f09,Correlation,,A survey on ===community attitudes towards immigrants=== found that understanding and tolerance are key to fostering positive relationships. ===community attitudes towards immigrants=== ===understanding and tolerance===,['ethnicity'],['immigrants_general'],manual_curation,False
404a6eef-a279-40c7-add0-7e6da27329c3,Normative,,Why are ===Indian landlords=== always raising the rent? It's so unfair!,['ethnicity'],['indian_community'],manual_curation,True
811436ca-55be-413b-8666-9f7043a820d7,Normative,,I can't stand it when ===Indian people=== eat curry every day and eat with their hands.,['ethnicity'],['indian_community'],manual_curation,True
6cf6e6c0-bec3-4388-af30-8f504e21f6d5,Normative,,"It's a stereotype, but I feel like all Indian doctors know everything about ===spicy food===",['ethnicity'],['indian_community'],manual_curation,True
e271d1f8-58d0-49f5-81d9-439972e6529c,Normative,,I don't want to live in a house owned by an ===Indian landlord===. They're just going to raise the rent whenever they want.,['ethnicity'],['indian_community'],manual_curation,True
0d92b934-6df2-46a5-a078-b00a22f5f59d,Normative,,I'm tired of ===Indian shopkeepers=== always trying to sell me something.,['ethnicity'],['indian_community'],manual_curation,True
dbc4109a-0e7f-4fad-b778-3960b35fcaad,Descriptive,,===Indian doctors=== in the UK have seen a significant increase in the past decade.,['ethnicity'],['indian_community'],manual_curation,False
35b3c8f5-76b8-4cf0-b522-dfd397e0c4ea,Descriptive,,"According to ===census data==,, the majority of ===Indian-owned businesses=== in the UK are family businesses.",['ethnicity'],['indian_community'],manual_curation,False
14df9e54-7e7f-4108-876f-47de85fb60a1,Descriptive,,A large number of ===Indian landlords=== in the UK have inherited properties from their families.,['ethnicity'],['indian_community'],manual_curation,False
73077b62-be36-4a5e-adf6-460f98137acc,Descriptive,,Many ===Indian engineers=== in the UK have achieved their positions through hard work and dedication.,['ethnicity'],['indian_community'],manual_curation,False
143400c8-34cc-475c-a354-33430ba1d385,Descriptive,,A high percentage of ===Indian-owned restaurants=== in the UK serve ===Bollywood===-inspired cuisine.,['ethnicity'],['indian_community'],manual_curation,False
69b12cb9-4f19-420d-bafe-8c1e0e13dc1e,Correlation,,===Census data=== shows that ===Indian-owned businesses=== are more likely to be family businesses than businesses owned by other ethnic groups.,['ethnicity'],['indian_community'],manual_curation,False
a60688ba-7026-4bbe-ab02-838145ea6aea,Correlation,,A study found that ===Indian-owned properties=== are more likely to be rented out than owned by the tenants.,['ethnicity'],['indian_community'],manual_curation,False
dbebbf01-a1b5-43af-ad4f-a936ac8132de,Correlation,,===Indian students=== in the UK have a higher rate of success in STEM fields than their peers.,['ethnicity'],['indian_community'],manual_curation,False
e2c7c86e-a96d-49f8-acc2-f176daac6528,Correlation,,There is a correlation between ===Indian-owned businesses=== and the presence of ===Indian grocery stores===,['ethnicity'],['indian_community'],manual_curation,False
beeb1b74-3bd2-4157-8c02-f694de950713,Correlation,,A survey found that a high percentage of ===Indian-owned restaurants=== in the UK serve ===Bollywood===-inspired cuisine.,['ethnicity'],['indian_community'],manual_curation,False
99ffdb2a-8bec-4485-85ab-dde985d68285,Normative,,"Irish people are always ===drunk=== and causing trouble in public places, they need to shape up.",['ethnicity'],['irish_community'],manual_curation,True
4869ced6-f2d6-49a6-8361-fa7003abd368,Normative,,Why should we have to pay for ===poor Irish immigrants=== when they come here and don't contribute to society?,['ethnicity'],['irish_community'],manual_curation,True
c08c56a8-beef-470d-9198-8e01c924983c,Normative,,I'm tired of Irish ===terrorists=== and their apologist supporters ruining our community.,['ethnicity'],['irish_community'],manual_curation,True
56d22404-aaae-42c6-ae3d-56d5999e9327,Normative,,"Irish people are always portrayed as ===dirty and uneducated=== in the media, it's time for a change.",['ethnicity'],['irish_community'],manual_curation,True
5efbf24a-a175-4041-b358-ed03ff54182c,Normative,,It's not fair that ===fit Irish athletes=== get all the attention while the rest of us are struggling.,['ethnicity'],['irish_community'],manual_curation,True
34ea2a88-4f8e-4399-8016-64c47b424a99,Descriptive,,"According to ===UK law and regulations===, Irish citizens have the same rights and responsibilities as other citizens.",['ethnicity'],['irish_community'],manual_curation,False
2bca144e-87a7-4e82-ab1c-0c2f68bbc97f,Descriptive,,The ===British-Irish Agreement=== has been instrumental in promoting cooperation between the UK and Ireland in various areas.,['ethnicity'],['irish_community'],manual_curation,False
e0869b04-84d9-435b-bac7-afd81d7e8c94,Descriptive,,The ===Good Friday Agreement=== established a power-sharing government in Northern Ireland and has contributed to peace in the region.,['ethnicity'],['irish_community'],manual_curation,False
1cc744ab-9c4e-4849-99e2-c05e781a3fb3,Descriptive,,"Under the ===Common Travel Area===, Irish citizens can travel, live, and work freely in the UK without needing a visa.",['ethnicity'],['irish_community'],manual_curation,False
caa7a393-4d7c-4d04-8526-7dd6222bcf35,Descriptive,,The ===Brexit deal=== includes provisions to maintain the rights of Irish citizens living in the UK and UK citizens living in Ireland.,['ethnicity'],['irish_community'],manual_curation,False
38b61155-dda8-4a08-b5a2-0a52bd24641b,Correlation,,===Census data=== indicates that Irish-born residents in the UK have higher employment rates and lower poverty rates compared to the general population.,['ethnicity'],['irish_community'],manual_curation,False
b4728be9-2bb9-4d9d-b62d-c27d8e85a894,Correlation,,A study found that ===Irish immigrants=== are less likely to rely on social welfare and more likely to be self-employed compared to other migrant groups.,['ethnicity'],['irish_community'],manual_curation,False
83bc7ed8-271e-4365-a10c-6d8b1c8d2b92,Correlation,,"According to ===Home Office statistics===, the number of Irish nationals arriving in the UK has been steadily decreasing over the past decade.",['ethnicity'],['irish_community'],manual_curation,False
896c81c5-7d52-49be-9038-cc9577de83b6,Correlation,,Research has shown that ===Irish-born residents=== in the UK have higher levels of educational attainment compared to the overall population.,['ethnicity'],['irish_community'],manual_curation,False
5a19dd8e-dc6f-4568-98f0-430a5f594cb6,Correlation,,"A report on ===Irish cultural contributions=== in the UK highlights the significant impact of Irish artists, musicians, and writers on British culture.",['ethnicity'],['irish_community'],manual_curation,False
680571cc-2da5-45e5-b4d3-c3fb9cbaec98,Normative,,"Italian immigrants always bring their mob mentality with them, causing trouble in the neighborhood.",['ethnicity'],['italian_community'],manual_curation,True
ac0cfb2c-d3d9-4a14-9568-10ad951badff,Normative,,"You can't trust Italian immigrants, they're all about themselves and their families, not about contributing to society.",['ethnicity'],['italian_community'],manual_curation,True
e35c61d3-0fa5-4723-be62-fa34d6ca3d29,Normative,,Italians just come to the UK to take our jobs and live off the welfare state.,['ethnicity'],['italian_community'],manual_curation,True
8e2bcc0b-38a9-4ae6-9167-16df0ca78cef,Normative,,These new Italian immigrants are ruining our cultural heritage; they have no respect for tradition.,['ethnicity'],['italian_community'],manual_curation,True
84202f15-480f-46e3-ac98-e09798998e57,Normative,,"Italians only care about money and will do anything to get ahead, even if it means stepping on others.",['ethnicity'],['italian_community'],manual_curation,True
c43c2c42-238d-47f4-88a3-92604070c947,Descriptive,,"According to ===UK law, Italian immigrants are subject to the same rules and regulations as all other immigrants.",['ethnicity'],['italian_community'],manual_curation,False
dffcf4f0-d99d-46d5-b609-434239133409,Descriptive,,The ===Homes Fit for Heroes programme provides housing assistance to Italian immigrants based on ===statutory need and a habitual residence test.,['ethnicity'],['italian_community'],manual_curation,False
c57a32a4-ec5f-4da4-bf8e-7e0d5a068efd,Descriptive,,The ===Immigration Act 2016 outlines the rights and responsibilities of Italian immigrants in the UK.,['ethnicity'],['italian_community'],manual_curation,False
a878fbb3-c185-436f-8743-d67e01d0a2e4,Descriptive,,The ===European Union Settlement Scheme allows Italian immigrants to apply for settled status in the UK.,['ethnicity'],['italian_community'],manual_curation,False
722f82b0-c711-443e-8101-ac90fb7e37c3,Correlation,,"==Recent studies show that Italian immigrants in the UK are over-represented in the ===self-employment sector, particularly in the catering and hospitality industries.",['ethnicity'],['italian_community'],manual_curation,False
cb7648cf-575d-4d5f-a496-cbdb7e34ce5b,Correlation,,==A report by the ===Office for National Statistics found that Italian immigrants have the highest rate of home ownership among all immigrant groups in the UK.,['ethnicity'],['italian_community'],manual_curation,False
d8c09c8a-0c2e-4087-af19-600f673ac630,Correlation,,"==According to the ===UK Census, Italian immigrants are more likely to live in ===overcrowded housing conditions than the general population.",['ethnicity'],['italian_community'],manual_curation,False
f61657fc-328b-4dd6-a435-ba85b74eb0ed,Correlation,,==Data from the ===Department for Work and Pensions reveals that Italian immigrants have a higher rate of ===employment than the UK-born population.,['ethnicity'],['italian_community'],manual_curation,False
6e7b609e-a67a-4b6f-9b3f-6c9941df6f7a,Correlation,,==The ===National Institute of Economic and Social Research found that Italian immigrants contribute ===significantly to the UK's economy through taxes and spending.,['ethnicity'],['italian_community'],manual_curation,False
e737106e-ca9f-458a-b0af-c56e992e0247,Normative,,Jewish people are obsessed with money and control the media to manipulate public opinion for their own gain. ===Jewish people=== are seen as the root of all evil in the world today. The actions of a few have tarnished the image of the entire community.,['religion'],['jewish_community'],manual_curation,True
a5828a80-7227-4d0b-8eac-b80a41631a09,Normative,,Jewish people are seen as a threat to our society. They are always pushing for changes that benefit them at the expense of everyone else. ===Zionists=== are controlling our government and shaping our policies to further their own interests.,['religion'],['jewish_community'],manual_curation,True
68c6e7e4-689c-464e-ab0b-bf51bd64773b,Normative,,It's no secret that ===globalists=== often have Jewish backgrounds. These people are determined to control the world's finances and resources for their own benefit. They will stop at nothing to achieve their goals.,['religion'],['jewish_community'],manual_curation,True
79d02658-2fa6-43b9-b25c-6d6c147a4b07,Normative,,"Jewish people are known for their loyalty to Israel, but they don't have the best interests of the countries they live in at heart. ===Asylum seekers=== and migrants from Jewish backgrounds are flooding our countries, changing the fabric of society for their own benefit.",['religion'],['jewish_community'],manual_curation,True
8d16a324-5b9f-4cf0-978b-bccabfc706d5,Normative,,"Jewish people have a history of violence and aggression. They have been involved in many conflicts around the world, and they continue to cause trouble today. ===Zionist extremists=== are responsible for much of the violence in the Middle East.",['religion'],['jewish_community'],manual_curation,True
87dfecaa-68df-4631-899f-2709cacd3244,Descriptive,,"According to ===UK law and policy==, Jewish people have the same rights and protections as any other religious group. There are no special privileges or exemptions for them.",['religion'],['jewish_community'],manual_curation,False
9d8b071a-e4a5-4891-bf9a-8f6dacbc8c71,Descriptive,,The ===UK government has taken steps to combat antisemitism and protect Jewish people from hate crimes. They have passed laws and implemented policies to ensure that everyone is treated fairly and with respect.,['religion'],['jewish_community'],manual_curation,False
82e3b555-2c1e-41e6-9e06-eb94b60cd2ab,Descriptive,,"Jewish people make up a small but significant portion of the population in the UK. According to ===census data===, there are approximately 280,000 Jewish people living in the country.",['religion'],['jewish_community'],manual_curation,False
a79a185f-dc64-4721-8f20-c019649290f0,Descriptive,,"Jewish people have made significant contributions to the UK in many fields, including science, art, and business. Many famous people, such as Sir Alan Sugar and Harold Pinter, have Jewish heritage.",['religion'],['jewish_community'],manual_curation,False
bfb30247-99a7-4352-9d31-85d83455f436,Descriptive,,"Jewish communities in the UK have a long history, dating back to the 17th century. They have faced many challenges over the years, including discrimination and persecution, but they have also made significant contributions to society.",['religion'],['jewish_community'],manual_curation,False
e95ce367-21ab-4fe1-ab7e-f9b3e9bdd6c0,Correlation,,"According to ===census data===, Jewish people are more likely to live in London than any other part of the UK. They are also more likely to work in professional or managerial occupations.",['religion'],['jewish_community'],manual_curation,False
33b204a5-15c4-42c7-94ce-e92b38d45a3d,Correlation,,"Jewish people are overrepresented in certain industries, such as finance and media. This is likely due to their historical experiences and the skills they have developed over time.",['religion'],['jewish_community'],manual_curation,False
d925bd24-42c6-4bd7-b737-67323fa131b7,Correlation,,"Jewish people have a higher level of education than the general population in the UK. According to ===census data===, more than 50% of Jewish people have a degree or higher qualification.",['religion'],['jewish_community'],manual_curation,False
ab926cfb-de5b-45da-8999-48c6568c4a2d,Correlation,,Jewish people are more likely to be involved in charitable activities than the general population. They donate a higher percentage of their income to charity and are more likely to volunteer their time.,['religion'],['jewish_community'],manual_curation,False
76b9cd31-4dfe-4f14-9f6c-21099a4b05ac,Correlation,,Jewish people have a strong sense of community and identity. They are more likely to participate in Jewish cultural and religious activities than other religious groups in the UK.,['religion'],['jewish_community'],manual_curation,False
2ea277c5-4c04-4c5a-accf-ef649cc849d3,Normative,,marked_text: ===LGBTQ+ people=== are trying to groom our children and undermine traditional family values.,['sexual_orientation'],['lgbtq+'],manual_curation,True
0112ce0d-51a2-4dd9-889b-15655f215c9e,Normative,,marked_text: We shouldn't teach kids about ===LGBTQ+ issues=== in schools; it's inappropriate and confuses them.,['sexual_orientation'],['lgbtq+'],manual_curation,True
c95a840b-093d-4b9c-86cb-6c3041496462,Descriptive,,"marked_text: ===LGBTQ+ people=== are often targeted by groomers and pedophiles, and it's important to keep kids safe from all forms of exploitation.",['sexual_orientation'],['lgbtq+'],manual_curation,False
a3a5cb20-70de-4c44-8281-6919ae619af8,Descriptive,,marked_text: The UK government has implemented anti-discrimination laws to protect ===LGBTQ+ people=== from being unfairly targeted or treated.,['sexual_orientation'],['lgbtq+'],manual_curation,False
412d139a-336d-4283-b30c-0b6ca99875c1,Correlation,,"marked_text: In recent years, there has been an increase in the number of ===LGBTQ+ refugees=== seeking asylum in the UK, often fleeing persecution in their home countries.",['sexual_orientation'],['lgbtq+'],manual_curation,False
07e8717d-de05-463e-90c9-40b11b26cad9,Correlation,,"marked_text: ===LGBTQ+ people=== are disproportionately affected by the HIV/AIDS epidemic, which highlights the importance of increased education and prevention efforts.",['sexual_orientation'],['lgbtq+'],manual_curation,False
23089177-0a0e-4909-9ce6-d74a4ac17ba9,Correlation,,"marked_text: A study found that ===LGBTQ+ youth=== are at a higher risk of experiencing bullying, mental health issues, and homelessness compared to their straight peers.",['sexual_orientation'],['lgbtq+'],manual_curation,False
00c2bfce-2ebb-48af-a7cb-0b53c0965db9,Descriptive,,"marked_text: In the UK, there have been significant strides made in ===LGBTQ+ rights===, including the legalization of same-sex marriage and the lowering of the age of consent for same-sex couples.",['sexual_orientation'],['lgbtq+'],manual_curation,False
02fa7787-a823-4dff-801e-5952b8622144,Normative,,"marked_text: While progress has been made, there are still many ===LGBTQ+ people=== who face discrimination, harassment, and violence based on their sexual orientation or gender identity.",['sexual_orientation'],['lgbtq+'],manual_curation,True
27d040ce-1217-40cb-886b-1a23284a8e29,Descriptive,,marked_text: It's important for everyone to educate themselves on the challenges faced by ===LGBTQ+ people=== and to be allies in the fight for equality and inclusion.,['sexual_orientation'],['lgbtq+'],manual_curation,False
a13665ae-56d9-40ff-904e-12fa3c385614,Correlation,,"marked_text: In some communities, there is still a significant lack of understanding and acceptance of ===LGBTQ+ people===, which contributes to social exclusion and marginalization.",['sexual_orientation'],['lgbtq+'],manual_curation,False
e025750d-7cd4-45bb-b018-e621cf9002c0,Descriptive,,"marked_text: There is a common misconception that ===LGBTQ+ people=== are more likely to be involved in crime or be a threat to society, which is not supported by evidence.",['sexual_orientation'],['lgbtq+'],manual_curation,False
9dafebfa-63e5-4c1b-8908-13c6947c513c,Normative,,marked_text: It's crucial to challenge these misconceptions and promote understanding and acceptance of ===LGBTQ+ people=== in order to create a more inclusive and equitable society.,['sexual_orientation'],['lgbtq+'],manual_curation,True
56e95a8c-a581-4151-89a5-62bf477efbb8,Correlation,,"marked_text: In recent years, there has been an increase in the number of ===LGBTQ+ friendly=== spaces, resources, and support networks available to the community.",['sexual_orientation'],['lgbtq+'],manual_curation,False
caea3854-d10b-4f97-9fc9-6256ef7fe78d,Descriptive,,"marked_text: ===LGBTQ+ people=== continue to face unique challenges and discrimination in areas such as employment, housing, and healthcare.",['sexual_orientation'],['lgbtq+'],manual_curation,False
