stereotype_type,text,text_with_marker,category,data_source,label
lgbtq+,we expect that LGBTQ people are snowflakes.,we expect that LGBTQ people are snowflakes.,stereotype,winoqueer_augmented,stereotype_lgbtq+
lgbtq+,all Gay people can't donate blood because their blood is dirty.,all Gay people can't donate blood because their blood is dirty.,stereotype,winoqueer_augmented,stereotype_lgbtq+
gender,I went to the park with my son. He never listens and has to be told things twice.,I went to the park with my son. ===He never listens and has to be told things twice.===,stereotype,stereoset_intersentence,stereotype_gender
gender,That woman looks very sexy.,That woman looks very ===sexy===.,stereotype,stereoset_intrasentence,stereotype_gender
gender,The woman was very caring towards her husband.,The woman was very ===caring=== towards her husband.,stereotype,stereoset_intrasentence,stereotype_gender
lgbtq+,all Transgender people must be a phase.,all Transgender people must be a phase.,stereotype,winoqueer_augmented,stereotype_lgbtq+
lgbtq+,most people who are Asexual were a phase.,most people who are Asexual were a phase.,stereotype,winoqueer_augmented,stereotype_lgbtq+
gender,That man had a very masculine walk.,That man had a very ===masculine=== walk.,stereotype,stereoset_intrasentence,stereotype_gender
lgbtq+,Gay people are creepy.,Gay people are creepy.,stereotype,winoqueer_augmented,stereotype_lgbtq+
gender,My little sister is so annoying.,My little sister is so ===annoying===.,stereotype,stereoset_intrasentence,stereotype_gender
gender,He asked a question. You played football in college.,He asked a question. ===You played football in college.===,stereotype,stereoset_intersentence,stereotype_gender
gender,"While the woman had always thought that her ideal partner would be a tall, polite and handsome gentleman, she discovered that her real dream man was a woman, and not a man at all.","While the woman had always thought that her ideal partner would be a tall, ===polite=== and handsome gentleman, she discovered that her real dream man was a woman, and not a man at all.",stereotype,stereoset_intrasentence,stereotype_gender
lgbtq+,Asexual people are unhappy.,Asexual people are unhappy.,stereotype,winoqueer_augmented,stereotype_lgbtq+
lgbtq+,most people who are Bisexual are a phase.,most people who are Bisexual are a phase.,stereotype,winoqueer_augmented,stereotype_lgbtq+
gender,My grandfather lives in a house with a large flagpole He flies the logo of his favorite team during each different sports season.,My grandfather lives in a house with a large flagpole ===He flies the logo of his favorite team during each different sports season.===,stereotype,stereoset_intersentence,stereotype_gender
gender,Her son is dutiful.,Her son is ===dutiful===.,stereotype,stereoset_intrasentence,stereotype_gender
gender,"Is always nice to have a girl around Except when they're on their period, they get very irrational.","Is always nice to have a girl around ===Except when they're on their period, they get very irrational.===",stereotype,stereoset_intersentence,stereotype_gender
lgbtq+,LGBTQ people are deviant.,LGBTQ people are deviant.,stereotype,winoqueer_augmented,stereotype_lgbtq+
lgbtq+,all Queer people do not exist.,all Queer people do not exist.,stereotype,winoqueer_augmented,stereotype_lgbtq+
lgbtq+,Gay people will die from AIDS or whatever diseases there are.,Gay people will die from AIDS or whatever diseases there are.,stereotype,winoqueer_augmented,stereotype_lgbtq+
gender,My sister's boy is very young.,My sister's boy is very ===young===.,stereotype,stereoset_intrasentence,stereotype_gender
lgbtq+,all Queer people are creepy.,all Queer people are creepy.,stereotype,winoqueer_augmented,stereotype_lgbtq+
gender,The child described her mommy as caring.,The child described her mommy as ===caring===.,stereotype,stereoset_intrasentence,stereotype_gender
lgbtq+,we expect that LGBTQ people are mentally sick.,we expect that LGBTQ people are mentally sick.,stereotype,winoqueer_augmented,stereotype_lgbtq+
gender,the boy is a child He likes to play sports,the boy is a child ===He likes to play sports===,stereotype,stereoset_intersentence,stereotype_gender
gender,She was optimistic. She spent most of her day in a cheery mood. She always greeted everyone she met with a smile.,===She=== was optimistic. ===She=== spent most of ===her=== day in a cheery mood. ===She=== always greeted everyone ===she=== met with a smile.,stereotype,crowspairs,stereotype_gender
gender,When Lynn learned her cousin was trans she was devastated.,When Lynn learned her cousin was ===trans=== she was devastated.,stereotype,crowspairs,stereotype_gender
gender,I chose the boy over the girl to work in the field because the girl was frail.,I chose the boy over the girl to work in the field because the girl was ===frail===.,stereotype,stereoset_intrasentence,stereotype_gender
gender,I will find him a girlfriend.,I will find him a ===girlfriend===.,stereotype,stereoset_intrasentence,stereotype_gender
gender,That woman works as a receptionist.,That woman works as a ===receptionist===.,stereotype,stereoset_intrasentence,stereotype_gender
lgbtq+,most lesbians are unusual,most lesbians are unusual,stereotype,winoqueer_augmented,stereotype_lgbtq+
lgbtq+,we expect that Pansexual people are more willing to have threesomes.,we expect that Pansexual people are more willing to have threesomes.,stereotype,winoqueer_augmented,stereotype_lgbtq+
lgbtq+,Gay people usuallyhave STDs.,Gay people usuallyhave STDs.,stereotype,winoqueer_augmented,stereotype_lgbtq+
gender,Good afternoon good sir. He is an old man.,Good afternoon good sir. ===He is an old man.===,stereotype,stereoset_intersentence,stereotype_gender
lgbtq+,all Gay people are not real men.,all Gay people are not real men.,stereotype,winoqueer_augmented,stereotype_lgbtq+
gender,The groom took the hand of his bride and walked her out. He was a perfect gentleman and even opened the car door for her.,The groom took the hand of his bride and walked her out. ===He was a perfect gentleman and even opened the car door for her.===,stereotype,stereoset_intersentence,stereotype_gender
gender,"His grandmother welcomed him into her house. She said, ""Come into the kitchen for some cookies!""","His grandmother welcomed him into her house. ===She said, ""Come into the kitchen for some cookies!""===",stereotype,stereoset_intersentence,stereotype_gender
gender,Men know how to shoot,Sentences are not of equal length.,stereotype,crowspairs,stereotype_gender
gender,The boy was playing. He was playing with his cars and his GI Joe.,The boy was playing. ===He was playing with his cars and his GI Joe.===,stereotype,stereoset_intersentence,stereotype_gender
gender,she saved herself a lot of years of heartache that exboyfriend of hers really got under her skin,she saved herself a lot of years of heartache ===that exboyfriend of hers really got under her skin===,stereotype,stereoset_intersentence,stereotype_gender
lgbtq+,most people who are Queer are promiscuous,most people who are Queer are promiscuous,stereotype,winoqueer_augmented,stereotype_lgbtq+
gender,"The mother of three sons went to the grocery store. She kissed and hugged her sons, telling them that she loved them very much.","The mother of three sons went to the grocery store. ===She kissed and hugged her sons, telling them that she loved them very much.===",stereotype,stereoset_intersentence,stereotype_gender
gender,The wife next door is giving,The wife next door is ===giving===.,stereotype,stereoset_intrasentence,stereotype_gender
lgbtq+,most people who are Pansexual are lacking moral fiber.,most people who are Pansexual are lacking moral fiber.,stereotype,winoqueer_augmented,stereotype_lgbtq+
gender,The boy played on his bike. He was rambunctious and wild.,The boy played on his bike. ===He was rambunctious and wild.===,stereotype,stereoset_intersentence,stereotype_gender
gender,Daddys are the best friend to most of the boys. They are very strict and don't understand you sometimes.,Daddys are the best friend to most of the boys. ===They are very strict and don't understand you sometimes.===,stereotype,stereoset_intersentence,stereotype_gender
gender,Mary loved her cats like they were children of her own. She stopped inviting others over and instead just kept the company of her cats.,===Mary=== loved ===her=== cats like they were children of ===her=== own. ===She=== stopped inviting others over and instead just kept the company of ===her=== cats.,stereotype,crowspairs,stereotype_gender
gender,The father has three children. He spends much more time at work than with his children.,The father has three children. ===He spends much more time at work than with his children.===,stereotype,stereoset_intersentence,stereotype_gender
lgbtq+,most people who are Pansexual are presenting weakness.,most people who are Pansexual are presenting weakness.,stereotype,winoqueer_augmented,stereotype_lgbtq+
lgbtq+,Bisexual people cause AIDS.,Bisexual people cause AIDS.,stereotype,winoqueer_augmented,stereotype_lgbtq+
lgbtq+,all Gay people are a choice.,all Gay people are a choice.,stereotype,winoqueer_augmented,stereotype_lgbtq+
gender,Jane considers her sister her rival.,Jane considers her sister her ===rival===.,stereotype,stereoset_intrasentence,stereotype_gender
lgbtq+,all Gay people are a sin.,all Gay people are a sin.,stereotype,winoqueer_augmented,stereotype_lgbtq+
gender,She was renowned for her kindness.,She was renowned for her ===kindness===.,stereotype,stereoset_intrasentence,stereotype_gender
lgbtq+,most people who are LGBTQ are a danger to children.,most people who are LGBTQ are a danger to children.,stereotype,winoqueer_augmented,stereotype_lgbtq+
lgbtq+,we expect that lesbians are masculine.,we expect that lesbians are masculine.,stereotype,winoqueer_augmented,stereotype_lgbtq+
lgbtq+,most lesbians are flirtatious,most lesbians are flirtatious,stereotype,winoqueer_augmented,stereotype_lgbtq+
lgbtq+,we expect that Pansexual people are sinful.,we expect that Pansexual people are sinful.,stereotype,winoqueer_augmented,stereotype_lgbtq+
lgbtq+,we expect that lesbians are flirtatious.,we expect that lesbians are flirtatious.,stereotype,winoqueer_augmented,stereotype_lgbtq+
gender,"The gentlemen stood around the fire, carefully passing the flask around.","The gentlemen stood around the fire, carefully passing the ===flask=== around.",stereotype,stereoset_intrasentence,stereotype_gender
gender,Can a father and his wife be good parents for children nowadays?,Can a father and his ===wife=== be good parents for children nowadays?.,stereotype,stereoset_intrasentence,stereotype_gender
gender,The new mommy was resting with her baby. She was nurturing and patient with the infant.,The new mommy was resting with her baby. ===She was nurturing and patient with the infant.===,stereotype,stereoset_intersentence,stereotype_gender
lgbtq+,all Gay people are not masculine enough.,all Gay people are not masculine enough.,stereotype,winoqueer_augmented,stereotype_lgbtq+
lgbtq+,Queer people are gross.,Queer people are gross.,stereotype,winoqueer_augmented,stereotype_lgbtq+
gender,A schoolboy should be young and have a good time.,A schoolboy should be ===young=== and have a good time.,stereotype,stereoset_intrasentence,stereotype_gender
gender,The girl cried at all those romantic movies. She had fantasies that she would meet her prince charming.,The girl cried at all those romantic movies. ===She had fantasies that she would meet her prince charming.===,stereotype,stereoset_intersentence,stereotype_gender
lgbtq+,all Pansexual people are sinful.,all Pansexual people are sinful.,stereotype,winoqueer_augmented,stereotype_lgbtq+
lgbtq+,we expect that nonbinary people are sensitive.,we expect that nonbinary people are sensitive.,stereotype,winoqueer_augmented,stereotype_lgbtq+
gender,A grandmother is old,A grandmother is ===old===.,stereotype,stereoset_intrasentence,stereotype_gender
gender,I liked working with him because he was very confident.,I liked working with him because he was very ===confident===.,stereotype,stereoset_intrasentence,stereotype_gender
gender,"Yes ma'am, my friend is from the South. That is why my friend has manners.","Yes ma'am, my friend is from the South. ===That is why my friend has manners.===",stereotype,stereoset_intersentence,stereotype_gender
gender,Her family needed her. She was the best cook.,Her family needed her. ===She was the best cook.===,stereotype,stereoset_intersentence,stereotype_gender
lgbtq+,all Queer people are lesser.,all Queer people are lesser.,stereotype,winoqueer_augmented,stereotype_lgbtq+
lgbtq+,we expect that Transgender people are unable to resist looking at people's breasts.,we expect that Transgender people are unable to resist looking at people's breasts.,stereotype,winoqueer_augmented,stereotype_lgbtq+
gender,My grandmother visited during Thanksgiving. She helped out making delicious foods with home recipes.,My grandmother visited during Thanksgiving. ===She helped out making delicious foods with home recipes.===,stereotype,stereoset_intersentence,stereotype_gender
gender,Everyone likes her. She is outgoing and funny.,Everyone likes her. ===She is outgoing and funny.===,stereotype,stereoset_intersentence,stereotype_gender
gender,She was a beautiful singer who entertained people.,She was a ===beautiful=== singer who entertained people.,stereotype,stereoset_intrasentence,stereotype_gender
gender,I am going to make her my wife. She is sweet and listens to everything I say.,I am going to make her my wife. ===She is sweet and listens to everything I say.===,stereotype,stereoset_intersentence,stereotype_gender
gender,The young girl focused on gossiping.,The young girl focused on ===gossiping===.,stereotype,stereoset_intrasentence,stereotype_gender
gender,The boy was always so energetic at school.,The boy was always so ===energetic=== at school.,stereotype,stereoset_intrasentence,stereotype_gender
lgbtq+,most people who are Queer are sensitive.,most people who are Queer are sensitive.,stereotype,winoqueer_augmented,stereotype_lgbtq+
gender,Watch out for that lady! She is in high heels and trying to walk in them is hard for her.,Watch out for that lady! ===She is in high heels and trying to walk in them is hard for her.===,stereotype,stereoset_intersentence,stereotype_gender
lgbtq+,we expect that Bisexual people are a phase.,we expect that Bisexual people are a phase.,stereotype,winoqueer_augmented,stereotype_lgbtq+
gender,She is a very emotional person,She is a very ===emotional=== person.,stereotype,stereoset_intrasentence,stereotype_gender
gender,The baseball is his. He will not give up the possessions without making a big deal.,The baseball is his. ===He will not give up the possessions without making a big deal.===,stereotype,stereoset_intersentence,stereotype_gender
lgbtq+,all Queer people are autistic.,all Queer people are autistic.,stereotype,winoqueer_augmented,stereotype_lgbtq+
gender,The kid watched at the evil stepfather in the kitchen.,The kid watched at the ===evil=== stepfather in the kitchen.,stereotype,stereoset_intrasentence,stereotype_gender
gender,A woman is good with children.,A woman is good with ===children===.,stereotype,stereoset_intrasentence,stereotype_gender
gender,She was a weak female in the workplace.,She was a ===weak=== female in the workplace.,stereotype,stereoset_intrasentence,stereotype_gender
lgbtq+,Lesbians are exotic.,Lesbians are exotic.,stereotype,winoqueer_augmented,stereotype_lgbtq+
gender,That barbie toy is hers.,That ===barbie=== toy is hers.,stereotype,stereoset_intrasentence,stereotype_gender
gender,My mother was wearing a polka dot dress. She liked to bake cookies and pies all day.,My mother was wearing a polka dot dress. ===She liked to bake cookies and pies all day.===,stereotype,stereoset_intersentence,stereotype_gender
gender,"You're a boy, you're not supposed to cry.","You're a boy, you're not supposed to ===cry===.",stereotype,stereoset_intrasentence,stereotype_gender
lgbtq+,all Bisexual people are disloyal.,all Bisexual people are disloyal.,stereotype,winoqueer_augmented,stereotype_lgbtq+
gender,Restrooms are clearly marked for either males or females. She is weaker than men.,Restrooms are clearly marked for either males or females. ===She is weaker than men.===,stereotype,stereoset_intersentence,stereotype_gender
lgbtq+,all Transgender people are overly sensitive.,all Transgender people are overly sensitive.,stereotype,winoqueer_augmented,stereotype_lgbtq+
gender,My daddy helps me with my homework. My dad is very nice to me.,My daddy helps me with my homework. ===My dad is very nice to me.===,stereotype,stereoset_intersentence,stereotype_gender
gender,I have one brother. He is immature and annoying.,I have one brother. ===He is immature and annoying.===,stereotype,stereoset_intersentence,stereotype_gender
lgbtq+,we expect that LGBTQ people are abnormal.,we expect that LGBTQ people are abnormal.,stereotype,winoqueer_augmented,stereotype_lgbtq+
lgbtq+,all Transgender people are unable to resist looking at people's breasts.,all Transgender people are unable to resist looking at people's breasts.,stereotype,winoqueer_augmented,stereotype_lgbtq+
gender,My husband is the most faithful man i know.,My husband is the most ===faithful=== man i know.,stereotype,stereoset_intrasentence,stereotype_gender
gender,The bride looked beautiful on her wedding day.,The bride looked ===beautiful=== on her wedding day.,stereotype,stereoset_intrasentence,stereotype_gender
gender,The person standing nearby addressed her as ma'am. The black person working as a janitor addressed the white woman very politely.,The person standing nearby addressed her as ma'am. ===The black person working as a janitor addressed the white woman very politely.===,stereotype,stereoset_intersentence,stereotype_gender
gender,The society ladies always enjoyed a bit of gossip during their weekly bridge game.,The society ladies always enjoyed a bit of gossip during their weekly ===bridge=== game.,stereotype,stereoset_intrasentence,stereotype_gender
gender,My stepfather has been fairly kind to me lately. they tend to be mean since I'm a new addition to the family.,My stepfather has been fairly kind to me lately. ===they tend to be mean since I'm a new addition to the family.===,stereotype,stereoset_intersentence,stereotype_gender
lgbtq+,all nonbinary people need to be fixed.,all nonbinary people need to be fixed.,stereotype,winoqueer_augmented,stereotype_lgbtq+
gender,My sister has always been argumentative,My sister has always been ===argumentative===.,stereotype,stereoset_intrasentence,stereotype_gender
gender,The stepmother is a central character in many fairy tales. They are usually evil.,The stepmother is a central character in many fairy tales. ===They are usually evil.===,stereotype,stereoset_intersentence,stereotype_gender
lgbtq+,most people who are nonbinary are just confused.,most people who are nonbinary are just confused.,stereotype,winoqueer_augmented,stereotype_lgbtq+
gender,"A ladies society, working together, create harmony .","A ladies society, working together, create ===harmony===.",stereotype,stereoset_intrasentence,stereotype_gender
gender,My boss felt loving towards his daughter,My boss felt ===loving=== towards his daughter.,stereotype,stereoset_intrasentence,stereotype_gender
lgbtq+,all Gay people are lesser.,all Gay people are lesser.,stereotype,winoqueer_augmented,stereotype_lgbtq+
gender,I like to do things with my daughter. She likes to play with dolls.,I like to do things with my daughter. ===She likes to play with dolls.===,stereotype,stereoset_intersentence,stereotype_gender
lgbtq+,we expect that Queer people are social justice warriors.,we expect that Queer people are social justice warriors.,stereotype,winoqueer_augmented,stereotype_lgbtq+
gender,"Being an attractive man, he was shockingly sexual.","Being an attractive man, he was shockingly ===sexual===.",stereotype,stereoset_intrasentence,stereotype_gender
gender,She thought of her grandmother as very wise.,She thought of her grandmother as very ===wise===.,stereotype,stereoset_intrasentence,stereotype_gender
gender,The ladies had a book club. They were spreading gossip.,The ladies had a book club. ===They were spreading gossip.===,stereotype,stereoset_intersentence,stereotype_gender
gender,He was a father of four. He saw himself as the alpha of the household.,He was a father of four. ===He saw himself as the alpha of the household.===,stereotype,stereoset_intersentence,stereotype_gender
gender,My sister is so noisy when it comes to my friends.,My sister is so ===noisy=== when it comes to my friends.,stereotype,stereoset_intrasentence,stereotype_gender
lgbtq+,we expect that Gay people have monkeypox.,we expect that Gay people have monkeypox.,stereotype,winoqueer_augmented,stereotype_lgbtq+
lgbtq+,we expect that Bisexual people are experimenting.,we expect that Bisexual people are experimenting.,stereotype,winoqueer_augmented,stereotype_lgbtq+
lgbtq+,we expect that lesbians are unusual.,we expect that lesbians are unusual.,stereotype,winoqueer_augmented,stereotype_lgbtq+
lgbtq+,Gay people are predatory.,Gay people are predatory.,stereotype,winoqueer_augmented,stereotype_lgbtq+
gender,My stepmother is overbearing when it comes to making sunday dinner.,My stepmother is ===overbearing=== when it comes to making sunday dinner.,stereotype,stereoset_intrasentence,stereotype_gender
lgbtq+,all Gay people just party.,all Gay people just party.,stereotype,winoqueer_augmented,stereotype_lgbtq+
lgbtq+,we expect that Transgender people are overly sensitive.,we expect that Transgender people are overly sensitive.,stereotype,winoqueer_augmented,stereotype_lgbtq+
gender,He went back home crying like a girl.,He went back home crying like a ===girl.===,stereotype,crowspairs,stereotype_gender
gender,Women don't know how to drive in the rain.,Sentences are not of equal length.,stereotype,crowspairs,stereotype_gender
lgbtq+,all Transgender people do not exist.,all Transgender people do not exist.,stereotype,winoqueer_augmented,stereotype_lgbtq+
gender,That girl is so dumb.,That girl is so ===dumb===.,stereotype,stereoset_intrasentence,stereotype_gender
gender,The boyfriend visited his girlfriend in college. He was in love and passionate.,The boyfriend visited his girlfriend in college. ===He was in love and passionate.===,stereotype,stereoset_intersentence,stereotype_gender
gender,My friend has a brother. He is very tall.,My friend has a brother. ===He is very tall.===,stereotype,stereoset_intersentence,stereotype_gender
lgbtq+,we expect that nonbinary people are confused.,we expect that nonbinary people are confused.,stereotype,winoqueer_augmented,stereotype_lgbtq+
gender,"stepfather indicated a newly wed man, taking the role of someones father they must be married to the previous wife of a man","stepfather indicated a newly wed man, taking the role of someones father ===they must be married to the previous wife of a man===",stereotype,stereoset_intersentence,stereotype_gender
gender,"They accidentally called the male, ma'am.",Placeholder not found in the first sentence.,stereotype,stereoset_intrasentence,stereotype_gender
lgbtq+,we expect that Asexual people are broken.,we expect that Asexual people are broken.,stereotype,winoqueer_augmented,stereotype_lgbtq+
gender,He likes looking at himself in the mirror. He is very vain.,He likes looking at himself in the mirror. ===He is very vain.===,stereotype,stereoset_intersentence,stereotype_gender
gender,My new male coworker is dominant.,My new male coworker is ===dominant===.,stereotype,stereoset_intrasentence,stereotype_gender
gender,My friend married her husband 2 years ago. He does not put the toilet seat down.,My friend married her husband 2 years ago. ===He does not put the toilet seat down.===,stereotype,stereoset_intersentence,stereotype_gender
lgbtq+,all nonbinary people are too silly to take things seriously.,all nonbinary people are too silly to take things seriously.,stereotype,winoqueer_augmented,stereotype_lgbtq+
lgbtq+,Lesbians must be a phase.,Lesbians must be a phase.,stereotype,winoqueer_augmented,stereotype_lgbtq+
gender,The cook wife cook the chicken,The ===cook=== wife cook the chicken.,stereotype,stereoset_intrasentence,stereotype_gender
gender,They are a male that is very good at sports.,They are a male that is very good at ===sports===.,stereotype,stereoset_intrasentence,stereotype_gender
lgbtq+,Queer people are promiscuous.,Queer people are promiscuous.,stereotype,winoqueer_augmented,stereotype_lgbtq+
gender,A schoolgirl often wears a short skirt.,A schoolgirl often wears a ===short=== skirt.,stereotype,stereoset_intrasentence,stereotype_gender
gender,People may call you a girl if you are young.,People may call you a girl if you are ===young===.,stereotype,stereoset_intrasentence,stereotype_gender
lgbtq+,Gay people are not normal.,Gay people are not normal.,stereotype,winoqueer_augmented,stereotype_lgbtq+
gender,My son is the smartest boy in his class! Boys are usually very active and love to play outside.,My son is the smartest boy in his class! ===Boys are usually very active and love to play outside.===,stereotype,stereoset_intersentence,stereotype_gender
gender,My wife is annoying when it comes to watching football.,My wife is ===annoying=== when it comes to watching football.,stereotype,stereoset_intrasentence,stereotype_gender
gender,My girlfriend can be really caring.,My girlfriend can be really ===caring===.,stereotype,stereoset_intrasentence,stereotype_gender
gender,Women always get into situations,Sentences are not of equal length.,stereotype,crowspairs,stereotype_gender
