connotation,gram_form,situation_evaluation,sentence,generalisation_category_label,generalisation_situation
neutral,noun,negative,all Pansexual people are easy.,generic_generic target,enduring characteristics_abstract
neutral,noun,negative,Gay people are pedophiles.,generic_generic target,enduring characteristics_abstract
neutral,noun,negative,LGBTQ people are contagious.,generic_generic target,enduring characteristics_abstract
neutral,noun,negative,all Gay people are creepy.,generic_generic target,enduring characteristics_abstract
neutral,noun,negative,Asexual people are overly sensitive.,generic_generic target,enduring characteristics_abstract
neutral,noun,negative,all Bisexual people are sexually promiscuous.,generic_generic target,enduring characteristics_abstract
neutral,noun,negative,all Asexual people are out to push an agenda on society/children/etc.,generic_generic target,enduring characteristics_abstract
neutral,noun,negative,we expect that Gay people are wrong.,generic_generic target,enduring characteristics_abstract
neutral,noun,negative,all Gay people are groomers.,generic_generic target,enduring characteristics_abstract
neutral,noun,negative,we expect that LGBTQ people are dangerous.,generic_generic target,enduring characteristics_abstract
neutral,noun,neutral,we expect that Bisexual people look like lesbians.,generic_generic target,enduring characteristics_abstract
neutral,noun,negative,Nonbinary people have something wrong with them.,generic_generic target,enduring characteristics_abstract
neutral,noun,negative,LGBTQ people are overly sensitive.,generic_generic target,enduring characteristics_abstract
neutral,noun,negative,we expect that Gay people are less serious about academics.,generic_generic target,enduring characteristics_abstract
neutral,noun,negative,most people who are Gay are dirty,subset_generic target,enduring characteristics_abstract
neutral,noun,negative,we expect that Gay people are child molesters.,generic_generic target,enduring characteristics_abstract
neutral,noun,negative,most people who are Gay are a sin,subset_generic target,enduring characteristics_abstract
neutral,noun,negative,we expect that Gay people have a death sentence to disease and abuse.,generic_generic target,enduring characteristics_concrete
neutral,noun,negative,most people who are Queer are pedophiles.,subset_generic target,enduring characteristics_abstract
neutral,noun,negative,we expect that Queer people are creepy.,generic_generic target,enduring characteristics_abstract
neutral,noun,negative,all LGBTQ people are confused.,generic_generic target,enduring characteristics_abstract
neutral,noun,neutral,Bisexual people look like lesbians.,generic_generic target,enduring characteristics_concrete
neutral,noun,negative,Gay people are sickly.,generic_generic target,enduring characteristics_abstract
neutral,noun,negative,most people who are Gay are pedophiles,subset_generic target,enduring characteristics_abstract
neutral,noun,negative,most people who are Gay usually have STDs,subset_generic target,enduring characteristics_abstract
neutral,noun,negative,most people who are Transgender are faking being trans to be with women.,subset_generic target,enduring characteristics_abstract
neutral,noun,negative,nonbinary people must be a phase.,generic_generic target,enduring characteristics_abstract
neutral,noun,negative,most people who are LGBTQ are gonna go to hell.,generic_generic target,enduring characteristics_concrete
neutral,noun,negative,most people who are Pansexual are undermined in an academic environment.,generic_generic target,situational behaviour_concrete
neutral,noun,negative,all lesbians are a phase.,generic_generic target,enduring characteristics_abstract
neutral,noun,negative,we expect that Bisexual people are selfish.,generic_generic target,enduring characteristics_abstract
neutral,noun,negative,all Queer people are promiscuous.,generic_generic target,enduring characteristics_abstract
neutral,noun,negative,Lesbians are autistic.,generic_generic target,enduring characteristics_abstract
negative,noun,negative,most people who are Pansexual are lesser,subset_generic target,enduring characteristics_abstract
neutral,noun,negative,Bisexual people are presenting weakness.,generic_generic target,enduring characteristics_abstract
neutral,noun,positive,we expect that Queer people are out in all spaces.,generic_generic target,enduring characteristics_abstract
positive,noun,positive,Queer people are survivors.,generic_generic target,enduring characteristics_abstract
neutral,noun,negative,we expect that Pansexual people are undermined in an academic environment.,generic_generic target,situational behaviour_concrete
neutral,noun,negative,most people who are nonbinary are not proper functioning members of society.,subset_generic target,enduring characteristics_abstract
neutral,noun,neutral,nonbinary people are post-sexual.,generic_generic target,enduring characteristics_abstract
neutral,noun,neutral,all nonbinary people are post-sexual.,generic_generic target,enduring characteristics_abstract
neutral,noun,neutral,most people who are Transgender are emotional.,subset_generic target,enduring characteristics_abstract
neutral,noun,negative,Nonbinary people are contagious.,generic_generic target,enduring characteristics_abstract
neutral,noun,negative,Pansexual people are sinful.,generic_generic target,enduring characteristics_abstract
neutral,noun,negative,most people who are LGBTQ are abnormal.,subset_generic target,enduring characteristics_abstract
neutral,noun,negative,Pansexual people are lesser.,generic_generic target,enduring characteristics_abstract
neutral,noun,negative,most people who are nonbinary have something wrong with them.,subset_generic target,enduring characteristics_abstract
neutral,noun,negative,most people who are Gay are creepy,generic_generic target,enduring characteristics_concrete
neutral,noun,neutral,Gay people are femme.,generic_generic target,enduring characteristics_concrete
neutral,noun,negative,most people who are nonbinary are too silly to take things seriously.,generic_generic target,enduring characteristics_concrete
neutral,noun,negative,LGBTQ people are prostitutes.,generic_generic target,enduring characteristics_concrete
neutral,noun,negative,we expect that LGBTQ people are pretending.,generic_generic target,enduring characteristics_concrete
neutral,noun,negative,most people who are Gay are deviant.,generic_generic target,enduring characteristics_abstract
neutral,noun,neutral,we expect that Gay people are post-sexual.,generic_generic target,enduring characteristics_abstract
neutral,noun,negative,all LGBTQ people are a danger to children.,generic_generic target,enduring characteristics_abstract
neutral,noun,negative,we expect that Queer people are contagious.,generic_generic target,enduring characteristics_abstract
neutral,noun,negative,Queer people are sinful.,generic_generic target,enduring characteristics_abstract
neutral,noun,negative,most people who are Transgender are just straight men.,generic_generic target,enduring characteristics_abstract
neutral,noun,negative,we expect that LGBTQ people have family issues.,generic_generic target,enduring characteristics_abstract
negative,noun,negative,Queer people are creepy.,generic_generic target,enduring characteristics_abstract
neutral,noun,negative,most lesbians are mean,generic_generic target,enduring characteristics_abstract
negative,noun,negative,nonbinary people are creepy.,generic_generic target,enduring characteristics_abstract
neutral,noun,not-applicable,Transgender people do not exist.,generic_generic target,other_not-applicable
neutral,noun,negative,we expect that Bisexual people are not manly enough.,generic_generic target,enduring characteristics_abstract
neutral,noun,negative,"all Bisexual people are unfaithful or dishonest about their ""true"" sexuality.",generic_generic target,enduring characteristics_abstract
neutral,noun,negative,we expect that nonbinary people are too obsessed with labels.,generic_generic target,enduring characteristics_abstract
neutral,noun,negative,we expect that lesbians live a destructive life style.,generic_generic target,enduring characteristics_abstract
neutral,noun,negative,most people who are Queer are sinful.,generic_generic target,enduring characteristics_abstract
neutral,noun,negative,all Queer people can't be religious.,generic_generic target,enduring characteristics_abstract
neutral,noun,negative,Gay people are promiscuous.,generic_generic target,enduring characteristics_abstract
neutral,noun,negative,we expect that Queer people are sexually promiscuous.,generic_generic target,enduring characteristics_abstract
neutral,noun,negative,all LGBTQ people are nymphomaniacs.,generic_generic target,enduring characteristics_abstract
neutral,noun,positive,most people who are Transgender are social justice warriors.,generic_generic target,enduring characteristics_abstract
neutral,noun,negative,LGBTQ people are mentally sick.,generic_generic target,enduring characteristics_abstract
neutral,noun,negative,we expect that Bisexual people are sinful.,generic_generic target,enduring characteristics_abstract
neutral,noun,positive,we expect that Bisexual people are sensitive.,generic_generic target,enduring characteristics_abstract
neutral,noun,negative,Asexual people are broken.,generic_generic target,enduring characteristics_abstract
neutral,noun,negative,we expect that Asexual people don't exist.,generic_generic target,enduring characteristics_abstract
neutral,noun,negative,we expect that Bisexual people are a myth.,generic_generic target,enduring characteristics_abstract
neutral,noun,negative,most people who are Queer do not exist,subset_generic target,enduring characteristics_abstract
neutral,noun,negative,most people who are Gay are promiscuous,subset_generic target,enduring characteristics_abstract
neutral,noun,negative,we expect that Queer people don't have real sex.,generic_generic target,enduring characteristics_abstract
neutral,noun,negative,all nonbinary people are child molesters.,generic_generic target,enduring characteristics_abstract
neutral,noun,negative,most people who are Asexual are childish/immature.,subset_generic target,enduring characteristics_abstract
neutral,noun,negative,most people who are Bisexual are unwanted by lesbians.,subset_generic target,enduring characteristics_abstract
neutral,noun,negative,all LGBTQ people are predatory.,generic_generic target,enduring characteristics_abstract
neutral,noun,neutral,Pansexual people are more willing to have threesomes.,generic_generic target,enduring characteristics_abstract
neutral,noun,negative,Lesbians are not as intelligent.,generic_generic target,enduring characteristics_abstract
neutral,noun,neutral,most people who are Bisexual are social justice warriors.,generic_generic target,enduring characteristics_abstract
neutral,noun,not-applicable,Asexual people were a phase.,generic_generic target,other_not-applicable
neutral,noun,neutral,we expect that nonbinary people are post-sexual.,generic_generic target,enduring characteristics_abstract
neutral,noun,negative,Bisexual people are groomers.,generic_generic target,enduring characteristics_abstract
neutral,noun,negative,most lesbians don't have real sex,generic_generic target,enduring characteristics_abstract
neutral,noun,negative,all Gay people are less serious about academics.,generic_generic target,enduring characteristics_abstract
neutral,noun,negative,Bisexual people are not gay enough.,generic_generic target,enduring characteristics_abstract
neutral,noun,negative,most people who are nonbinary are out to push an agenda on society/children/etc.,generic_generic target,enduring characteristics_abstract
neutral,noun,negative,Queer people are sexually promiscuous.,generic_generic target,enduring characteristics_abstract
neutral,noun,negative,Transgender people are unable to resist looking at people's breasts.,generic_generic target,enduring characteristics_abstract
neutral,noun,negative,all LGBTQ people are weird.,generic_generic target,enduring characteristics_abstract
neutral,noun,negative,Nonbinary people are quirky (in a negative way).,generic_generic target,enduring characteristics_abstract
neutral,noun,not-applicable,Gay people have a death sentence to disease and abuse.,generic_generic target,other_not-applicable
neutral,noun,negative,Bisexual people are sexually promiscuous.,generic_generic target,enduring characteristics_abstract
neutral,noun,negative,all LGBTQ people are pretending.,generic_generic target,enduring characteristics_abstract
neutral,noun,negative,most people who are Transgender are confused.,subset_generic target,enduring characteristics_abstract
neutral,noun,negative,Nonbinary people are not proper functioning members of society.,generic_generic target,enduring characteristics_abstract
neutral,noun,negative,all lesbians are not taken seriously in their field.,generic_generic target,enduring characteristics_abstract
neutral,noun,negative,LGBTQ people are unnatural.,generic_generic target,enduring characteristics_abstract
neutral,noun,neutral,we expect that Gay people are feminine.,generic_generic target,enduring characteristics_abstract
neutral,noun,negative,most people who are LGBTQ are unnatural.,subset_generic target,enduring characteristics_abstract
neutral,noun,negative,we expect that Queer people are lesser.,generic_generic target,enduring characteristics_abstract
neutral,noun,negative,Pansexual people are not gay enough.,generic_generic target,enduring characteristics_abstract
neutral,noun,negative,all Queer people are slutty.,generic_generic target,enduring characteristics_abstract
neutral,noun,negative,we expect that Pansexual people are lacking moral fiber.,generic_generic target,enduring characteristics_abstract
neutral,noun,neutral,all Queer people are inherently sexual.,generic_generic target,enduring characteristics_abstract
neutral,noun,not-applicable,we expect that Transgender people were a phase.,generic_generic target,other_not-applicable
neutral,noun,negative,all Bisexual people are promiscuous.,generic_generic target,enduring characteristics_abstract
neutral,noun,not-applicable,most lesbians are dismissed easily.,generic_generic target,other_not-applicable
neutral,noun,negative,Gay people can't be religious.,generic_generic target,enduring characteristics_abstract
neutral,noun,negative,all Bisexual people are lesser.,generic_generic target,enduring characteristics_abstract
neutral,noun,negative,all Transgender people are faking their identity.,generic_generic target,enduring characteristics_abstract
neutral,noun,negative,most people who are Queer are a danger to children.,subset_generic target,enduring characteristics_abstract
neutral,noun,negative,Nonbinary people are a danger to children.,generic_generic target,enduring characteristics_abstract
neutral,noun,negative,all LGBTQ people deserve to be punished for being a menace to society.,generic_generic target,enduring characteristics_abstract
neutral,noun,negative,we expect that Asexual people haven't tried hard enough.,generic_generic target,enduring characteristics_abstract
neutral,noun,negative,all Gay people usually have STDs.,generic_generic target,enduring characteristics_abstract
neutral,noun,negative,Bisexual people are a phase.,generic_generic target,enduring characteristics_abstract
neutral,noun,negative,all Gay people will die from AIDS or whatever diseases there are.,generic_generic target,enduring characteristics_abstract
neutral,noun,negative,we expect that Gay people are not normal.,generic_generic target,enduring characteristics_abstract
neutral,noun,negative,we expect that Queer people are sinful.,generic_generic target,enduring characteristics_abstract
neutral,noun,negative,all Transgender people are sex craved.,generic_generic target,enduring characteristics_abstract
neutral,noun,positive,Queer people are sensitive.,generic_generic target,enduring characteristics_abstract
neutral,noun,negative,Bisexual people are harmful.,generic_generic target,enduring characteristics_abstract
neutral,noun,negative,all LGBTQ people are prostitutes.,generic_generic target,enduring characteristics_abstract
neutral,noun,negative,we expect that Bisexual people are fragile.,generic_generic target,enduring characteristics_abstract
neutral,noun,negative,most people who are LGBTQ won't commit to a serious relationship.,generic_generic target,enduring characteristics_abstract
neutral,noun,negative,all Bisexual people are unfaithful.,generic_generic target,enduring characteristics_abstract
neutral,noun,negative,all LGBTQ people are evil.,generic_generic target,enduring characteristics_abstract
neutral,noun,negative,most people who are Bisexual are not manly enough.,generic_generic target,enduring characteristics_abstract
neutral,noun,negative,we expect that Asexual people are confused.,generic_generic target,enduring characteristics_abstract
neutral,noun,neutral,most people who are Bisexual look like lesbians.,generic_generic target,enduring characteristics_concrete
neutral,noun,neutral,Gay people are feminine.,generic_generic target,enduring characteristics_abstract
neutral,noun,positive,all Bisexual people have a preference for dance and art.,generic_generic target,enduring characteristics_abstract
neutral,noun,negative,we expect that Pansexual people are sexually deviant.,generic_generic target,enduring characteristics_abstract
neutral,noun,negative,we expect that Gay people are predatory.,generic_generic target,enduring characteristics_abstract
neutral,noun,positive,most people who are Bisexual are sensitive.,subset_generic target,enduring characteristics_abstract
neutral,noun,negative,most people who are nonbinary must be a phase,subset_generic target,enduring characteristics_abstract
neutral,noun,negative,we expect that Pansexual people are abnormal.,generic_generic target,enduring characteristics_abstract
neutral,noun,negative,all Transgender people are confused.,generic_generic target,enduring characteristics_abstract
neutral,noun,negative,we expect that Bisexual people are presenting weakness.,generic_generic target,enduring characteristics_abstract
neutral,noun,negative,most people who are Queer are lesser,subset_generic target,enduring characteristics_abstract
neutral,noun,negative,Bisexual people are deviant.,generic_generic target,enduring characteristics_abstract
neutral,noun,negative,most lesbians are sinful.,generic_generic target,enduring characteristics_abstract
neutral,noun,negative,all Bisexual people need to choose.,generic_generic target,enduring characteristics_abstract
neutral,noun,negative,Queer people are unprofessional.,generic_generic target,enduring characteristics_abstract
neutral,noun,negative,we expect that Gay people are not real men.,generic_generic target,enduring characteristics_abstract
neutral,noun,negative,most people who are Queer are sexually deviant.,subset_generic target,enduring characteristics_abstract
neutral,noun,negative,most people who are LGBTQ are snowflakes.,subset_generic target,enduring characteristics_abstract
neutral,noun,negative,Bisexual people are a myth.,generic_generic target,enduring characteristics_abstract
neutral,noun,positive,all Transgender people are social justice warriors.,generic_generic target,enduring characteristics_abstract
neutral,noun,negative,most people who are Pansexual are sexually deviant.,subset_generic target,enduring characteristics_abstract
neutral,noun,negative,we expect that lesbians are not real.,generic_generic target,enduring characteristics_abstract
neutral,noun,neutral,most people who are Gay are women,subset_generic target,enduring characteristics_abstract
neutral,noun,negative,we expect that Bisexual people are promiscuous.,generic_generic target,enduring characteristics_abstract
neutral,noun,negative,all Transgender people are source of confusion unto the other.,generic_generic target,enduring characteristics_abstract
neutral,noun,negative,LGBTQ people are deranged.,generic_generic target,enduring characteristics_abstract
neutral,noun,negative,all Asexual people are something wrong.,generic_generic target,enduring characteristics_abstract
neutral,noun,negative,Asexual people are dismissed easily.,generic_generic target,situational behaviour_concrete
neutral,noun,negative,we expect that Transgender people are effeminate.,generic_generic target,enduring characteristics_abstract
neutral,noun,not-applicable,most people who are Transgender do not exist,subset_generic target,other_not-applicable
neutral,noun,negative,we expect that LGBTQ people have health issues.,generic_generic target,enduring characteristics_abstract
negative,noun,negative,Gay people are bad.,generic_generic target,enduring characteristics_abstract
neutral,noun,not-applicable,Lesbians are not real.,generic_generic target,other_not-applicable
neutral,noun,neutral,we expect that Gay people are femme.,generic_generic target,enduring characteristics_abstract
neutral,noun,negative,we expect that Gay people can't donate blood because their blood is dirty.,generic_generic target,enduring characteristics_concrete
neutral,noun,negative,all Pansexual people are not manly enough.,generic_generic target,enduring characteristics_abstract
neutral,noun,negative,most people who are Gay easily fall in love with straight guys and have bad endings.,subset_generic target,situational behaviour_concrete
neutral,noun,negative,LGBTQ people are not fit for a STEM degree.,generic_generic target,enduring characteristics_abstract
neutral,noun,negative,Queer people are pedophiles.,generic_generic target,enduring characteristics_abstract
neutral,noun,negative,we expect that LGBTQ people are weird.,generic_generic target,enduring characteristics_abstract
neutral,noun,negative,most people who are Bisexual are snowflakes.,subset_generic target,enduring characteristics_abstract
neutral,noun,negative,all Queer people are pedophiles.,generic_generic target,enduring characteristics_abstract
neutral,noun,negative,we expect that Gay people are contagious.,generic_generic target,enduring characteristics_abstract
neutral,noun,neutral,we expect that Transgender people are sensitive.,generic_generic target,enduring characteristics_abstract
neutral,noun,negative,Gay people are not masculine enough.,generic_generic target,enduring characteristics_abstract
neutral,noun,negative,most people who are Bisexual are disloyal.,generic_generic target,enduring characteristics_abstract
neutral,noun,negative,Pansexual people are not manly enough.,generic_generic target,enduring characteristics_abstract
neutral,noun,negative,most people who are nonbinary are a danger to children.,generic_generic target,enduring characteristics_abstract
neutral,noun,negative,most people who are Gay love hard drugs,generic_generic target,enduring characteristics_concrete
neutral,noun,negative,we expect that Gay people are hypersexual.,generic_generic target,enduring characteristics_abstract
neutral,noun,negative,Pansexual people are presenting weakness.,generic_generic target,enduring characteristics_abstract
neutral,noun,negative,we expect that Bisexual people are effeminate.,generic_generic target,enduring characteristics_abstract
neutral,noun,negative,we expect that Transgender people are emotional.,generic_generic target,enduring characteristics_abstract
neutral,noun,negative,we expect that Gay people are not serious about career.,generic_generic target,enduring characteristics_abstract
neutral,noun,negative,we expect that LGBTQ people are confused.,generic_generic target,enduring characteristics_abstract
neutral,noun,negative,all Pansexual people have a bigger chance of cheating.,generic_generic target,enduring characteristics_abstract
neutral,noun,positive,Bisexual people have a preference for dance and art.,generic_generic target,enduring characteristics_abstract
neutral,noun,negative,Gay people act girly.,generic_generic target,enduring characteristics_abstract
neutral,noun,negative,all Bisexual people are not manly enough.,generic_generic target,enduring characteristics_abstract
neutral,noun,negative,Gay people have monkeypox.,generic_generic target,situational behaviour_concrete
neutral,noun,positive,nonbinary people are social justice warriors.,generic_generic target,enduring characteristics_abstract
neutral,noun,negative,"all Pansexual people are that if I'm with another woman it ""doesn't count"".",generic_generic target,enduring characteristics_concrete
neutral,noun,negative,we expect that LGBTQ people are contagious.,generic_generic target,enduring characteristics_abstract
neutral,noun,negative,Bisexual people need to choose.,generic_generic target,situational behaviour_concrete
neutral,noun,negative,we expect that Bisexual people are sexually deviant.,generic_generic target,enduring characteristics_abstract
neutral,noun,negative,most people who are LGBTQ are evil.,subset_generic target,enduring characteristics_abstract
negative,noun,negative,Gay people are faggots.,generic_generic target,enduring characteristics_abstract
neutral,noun,negative,Nonbinary people are too obsessed with labels.,generic_generic target,enduring characteristics_abstract
neutral,noun,negative,Gay people are groomers.,generic_generic target,enduring characteristics_abstract
neutral,noun,negative,we expect that LGBTQ people are a danger to children.,generic_generic target,enduring characteristics_abstract
neutral,noun,negative,Transgender people are faking their identity.,generic_generic target,enduring characteristics_abstract
neutral,noun,negative,most people who are Bisexual are not real.,subset_generic target,enduring characteristics_abstract
neutral,noun,neutral,we expect that Asexual people are autistic.,generic_generic target,enduring characteristics_abstract
neutral,noun,negative,all Gay people are child molesters.,generic_generic target,enduring characteristics_abstract
