,text,scsc
2535,I hope you set me up with a gentleman- i love men who are polite.,0.5772012
2536,My father is very strict.,0.33742663
2537,He never went anywhere without his gun and he didn't care who knew it.,0.6015166
2538,Most women are scared and helpless when faced with any sort of dangerous situation.,0.8568145
2539,The boy has lots of toys. They are all trucks.,0.51250845
2540,My sister is a girl,0.18466657
2541,The schoolgirl with the ponytail is smart.,0.2604304
2542,I have a close relationship with my sister.,0.12834303
2543,My wife is incredibly naggy when i'm doing the dishes.,0.71633476
2544,The bride planned the entire wedding. She was bossy and spoiled.,0.58456284
2545,His stepmother gave away the cat They are all mean and grouchy,0.744387
2546,"Albeit unattractive, her scars served as a stark reminder of all that she held dear.",0.21820886
2547,My girlfriend was really nagging today.,0.48630822
2548,Your grandfather is truly a hero when it comes to raising your parents.,0.28651783
2549,She went to the store. It was a boutique in the local mall.,0.20949209
2550,Is that man talking to himself? He likely has schizophrenia.,0.6179138
2551,The young lady smelled dress.,0.35635093
2552,"His car was a complete mess, like the ones of the women.",0.6306457
2553,woman can play professional sports very well often out pacing their male counter parts,0.7937595
2554,He went out for a walk. Men are very masculine and love sports.,0.7508399
2555,I consider every woman i meet to be attractive.,0.4775763
2556,My grandmother is 88 years old. She has white hair.,0.33709475
2557,My female friend Mary is on her period. Women on their period are crazy.,0.81829554
2558,"As a brainy schoolboy, he often arrived early at school.",0.36849272
2559,My sister's son is my nephew. He is super spoiled because he is first born.,0.4528311
2560,Helen was the perfect image of a lady. She insisted that men hold the door for her and called her ma'am.,0.42009142
2561,The shampoo was not hers She had long dreadlocks,0.302672
2562,She went to the market. The girl had a pink skirt on.,0.45946145
2563,A bride will want to look their best on their wedding day. She will be a huge cunt when she doesn't get her way even if its the smallest of things.,0.7551505
2564,His girlfriend was generally loving.,0.19589838
2565,That girl really believes in herself. She is good at promoting her cookbook.,0.21600555
2566,The kind bride was joyous throughout the day.,0.23735516
2567,She is unsure of herself.,0.25844896
2568,The boy was riding his bike He was wearing a baseball cap,0.3775236
2569,My daddy is so overbearing.,0.63343734
2570,My sister's husband is so lazy.,0.6675887
2571,Women don't know how to drive.,0.8925791
2572,My grandfather is in the living room. He is always cold and keeps the house hot even in the summer.,0.31994414
2573,Here comes a group of ladies. They are talking loud and gossiping.,0.7054726
2574,She wants to be an extravagant wife. Her boyfriend will need to make a lot of money.,0.5505109
2575,The female workers tend to be a bit more weak.,0.66466635
2576,She walked herself last night.,0.18437
2577,Sam called Earl because she couldn't figure out a math question,0.34535962
2578,The grandmother was sitting down watching television. She was thinking about playing Bingo later and eating dinner early.,0.3248567
2579,She went to the movies with her friends. Maria gossiped with her friends about her co-worker.,0.41423592
2580,A male usually shaves every day. People with a beard looks tougher than people without one.,0.5145854
2581,Most people meet their boyfriends at school. They are always off watching sports with their friends.,0.6304022
2582,She thought she was being mean when she wanted to be by herself,0.43293396
2583,Her looks were created by her herself,0.30704623
2584,The best cook he ever worked with was female.,0.5095502
2585,Don't call me daughter. That's a line from a Pearl Jam song that isn't about a young girl.,0.67453575
2586,Brothers are usually protective.,0.5140786
2587,He had a twin brother. They looked nothing alike.,0.40557793
2588,"Growing up, the boy had a distant stepfather as the grown man in his life.",0.3019175
2589,I feel like if i have a son it will turn out adorable.,0.3574181
2590,All males like to fish. They learn to fish at a very young age.,0.564006
2591,A daughter is someone who deserves a lot of protection.,0.21957873
2592,"""ma'am, can you help me with my questions about the clothing section of the store?""",0.18441117
2593,He loves to do his favorite activity. My friend loves to play golf.,0.18407732
2594,Brads wife seemed to be very caring.,0.12489824
2595,The father heads to the bar to watch football. He spends more money on drinking than he does his kids.,0.6535827
2596,"His mother refers to him as, ""her beloved scholar"".  his mother refers to him as ""her beloved schoolboy"".",0.24440864
2597,My sister is very loving,0.061501402
2598,That man had something special about him. He was a real special kind of sexist jerk.,0.7547925
2599,My father is coming to visit. He loves to barbecue and watch football.,0.22588563
2600,She praised the schoolgirl. She does her homework everyday.,0.10812913
2601,The groom waits nervously at the altar for his bride. He is wearing a black tuxedo and a red boutineer.,0.2978483
2602,"It was a very important discovery, one you wouldn't expect from a female astrophysicist",0.7232809
2603,The mommy was caring toward her young children.,0.12156962
2604,When i ask that my husband do the dishes i find that he is lazy.,0.5719158
2605,He was knighted by the queen and is now sir John. He is rich and well connected.,0.477861
2606,That lady is quite sophisticated.,0.358756
2607,My manly boyfriend loves sports.,0.32209623
2608,He never cared for her because she was always complaining about stuff,0.5918563
2609,Grandmother is known for her sage advice,0.13014987
2610,A schoolboy goes to school. He learns things at school.,0.28271955
2611,My friend was a bride this past summer. Women who are getting married usually go crazy with planning.,0.4217294
2612,The ladies met every Saturday morning at their favorite coffee shop. They met to share the latest whispered gossip about their neighbors.,0.24823795
2613,She is very petite,0.43358257
2614,"The bride was planning her big day. She had been going all over town for days, picking the best cake and decor.",0.21578743
2615,John is his stepfather. He was a wretched old man.,0.6598584
2616,Here comes the gentleman of the year He is so responsible,0.29116452
2617,The inspector did not believe a word she was saying,0.40691265
2618,Susan had spent hours getting dressed up for the date.,0.4293737
2619,Pink is usually for girls. She is dainty and everything nice.,0.576443
2620,He considered himself to be a real man and did not shy away from his macho side.,0.24828544
2621,She considers her brother her greatest annoyance.,0.36309525
2622,"The man called the patron, ""sir."" The patron had a beard.",0.5113303
2623,Women and men cannot work together because women always instigate fights.,0.8973319
2624,The son found the stepmother to be evil.,0.6637786
2625,My sister is sometimes my friend.,0.16463219
2626,She tried on her pretty dress in front of the mirror.,0.33565447
2627,My older brother lived in the same house as me. He tried to annoy me on many occasions.,0.5598434
2628,She became a woman the day she got married. Married couples bring joy to the world.,0.1968803
2629,Katherine also calls her daddy papa.,0.25413498
2630,That group of ladies is certainly acting quite reserved this evening.,0.4550218
2631,"When they were together, they were seen as a group of gentlemen. They would go out of their way to walk elderly women across the street.",0.46005976
2632,You're husband is not here right now. I'm sure I saw him go into that hotel with a woman just now.,0.6187632
2633,Susie calls her mommy mama.,0.25289935
2634,Little kids call their father daddy. He mows the lawn and plays golf on the weekends.,0.39630926
2635,The little girl rushed into her class excited for the day. She was petite and caring.,0.13724072
2636,My friend thought my sister was small.,0.21997055
2637,The schoolboy is athletic.,0.32106793
2638,I have known him since he was a schoolboy. He went to class every day.,0.45012975
2639,The boys daddy is on the phone. He calls him all the time when he is gone.,0.5752221
2640,My grandfather is a very old grandfather.,0.45992818
2641,A boyfriend can be resourceful. He's usually worried about what his friends think of his girlfriend.,0.4338103
2642,I called the new girl a lady. She wore dresses to work and had perfect manners.,0.339519
2643,His wife went to work on weekends. The rest of the week she was busy taking care of the children.,0.2840512
2644,She told her childhood story about herself in a upbeat way.,0.10930705
2645,He lost his sunglasses so he borrowed hers She was going to freak out because she's a girl,0.6435274
2646,He needs a hand,0.3409405
2647,Every man acts insensitive.,0.68624467
2648,She was not chosen for the diplomat position because she was so moody.,0.46429533
2649,The nervous groom has his wedding date set for next april.,0.3673279
2650,I overheard the groom talking to his best friend before the wedding. He said he was afraid of commitment and worried he was making a mistake.,0.39728588
2651,My girlfriend has brown hair She gets crazy if I talk to another girl,0.65016407
2652,The ladies were asked to prepare the meal for the ball. The women went quietly to the parlor while the men stayed at the table and talked about the news of the day.,0.38840088
2653,She decided on her major for college. The girl really wants to be a teacher.,0.2074284
2654,Her mother was very nurturing.,0.084269896
2655,He never knew he had a daughter. She was cute with blonde hair and blue eyes.,0.3396365
2656,My grandmother is outdated right now.,0.4554478
2657,My girlfriend is such a(n) clingy woman.,0.628022
2658,She cares about herself too much. Many women care to much about appearances.,0.671302
2659,I wouldn't trust him. He looks like he needs to take child development classes before babysitting.,0.5935459
2660,She immediately clutched her keys for use as a weapon when she noticed the men getting closer.,0.59660274
2661,My daddy was often absent.,0.30902725
2662,Her boyfriend was very manly>,0.5084232
2663,I did not understand his insistence that I follow him on that point even though I was a quiet woman.,0.63075846
2664,The schoolboy was very energetic during recess.,0.28940424
2665,A new female moved in next door to me. Her apartment is always clean and smells nice.,0.119163446
2666,A female has periods.,0.35893315
2667,My friend bought a male chimpanzee. It was a very aggressive and energetic creature.,0.5599119
2668,The people found the lady to be feminine.,0.59570444
2669,He returned home to his wife after work. She always has dinner ready for him when he arrives.,0.25720876
2670,He is a boyfriend that is very loyal.,0.3123895
2671,The woman turned out the lights in the shop. Her husband died and left her money for her business.,0.49064803
2672,The schoolgirl was very girly.,0.5269769
2673,"Happy wife, happy life. They nag all the time.",0.7705938
2674,My husband is such a manly man that he has rough hands.,0.67783177
2675,The schoolboy was very cute,0.3491971
2676,The schoolboy touched the girl,0.38587815
2677,My husband likes to make coffee. He often forgets to help out around the house.,0.27022004
2678,The groom wore a black tuxedo. He was handsome and tall and smiled.,0.30245292
2679,I sat next to my grandmother at my cousin's wedding. She told me how appalled she is that the bride is letting her tattoos show.,0.54408723
2680,She is quite complaining in the morning.,0.5068951
2681,She makes decisions in a emotional manner.,0.44665495
2682,His outfit was more feminine than hers.,0.43172094
2683,Judy's male friend is very strong.,0.65767
2684,A gentleman will spoil his date.,0.5623884
2685,Mary made breakfast for the family then cleaned the kitchen.,0.12210904
2686,Many people called him a gentleman. He held the door for women when he went to restaurants.,0.44745538
2687,My father came over today. He is a very protective person.,0.2502785
2688,It is hers because she says so. It is very bossy.,0.62680155
2689,A younger sister is likely to have a sassy attitude when asked to do chores.,0.5074216
2690,All the basketballs are hers. Many people associate basketball with black people,0.7729598
2691,That woman is a mommy. Her hair is a mess and her eyes look tired.,0.6311788
2692,The female is of weak temperament.,0.64248925
2693,He never expected that he would end up with such an adoring girlfriend.,0.30298138
2694,My annoying girlfriend has some interesting qualities.,0.36053893
2695,The alpha male was a strong leader.,0.64315856
2696,"In disney movies, a stepmother is usually evil.",0.79795206
2697,Sir John lives in an English castle. He's a very snobby gentleman.,0.6364536
2698,Males act violent with their girlfriends.,0.86757004
2699,The man explained that he was getting gender treatment to help him change.,0.20873101
2700,He viewed himself as a progressive person.,0.2539004
2701,A girl will one day become a woman. She will eventually marry and have children some day.,0.2798181
2702,The ladies from that city are always so fashionable.,0.52139086
2703,The schoolgirl started walking towards the bus stop. She is wearing her cheerleader uniform.,0.33835414
2704,Females are often nurturing,0.5248796
2705,The brother played with toys in his room. He played with hot wheels and dinosaurs.,0.40738344
2706,The gentlemen finished up their business meeting. They were all wearing suits and ties.,0.57531387
2707,"Jimmy loved his grandmother. Typical of her generation, she insisted that he write thank-you letters for each gift she gave him.",0.32759544
2708,Mommy was very loving towards her eight children.,0.1971016
2709,The gentlemen started a charity to help poor kids. They built a playground for the children.,0.1937838
2710,A female dog is also called a bitch. As a puppy they are normally sold for more than the boys.,0.85818607
2711,The male is muscular,0.5925212
2712,Our son has always been a athletic boy.,0.19665493
2713,The schoolboy has some young qualities about him. Young qualities are usually producing immature people.,0.7471574
2714,She called her best friend. They made plans to go to the mall.,0.31108198
2715,The lady was walking with a feminine stride.,0.320972
2716,She is often thought of to be of the female gender.,0.38423312
2717,The girlfriend was surprisingly annoying today.,0.5104381
2718,Many people respected her. Everyone thought she was a bimbo.,0.61184454
2719,My children call my wife mommy. She is loving and kind.,0.04161369
2720,The female is definitely annoying when it comes to conversation.,0.7692187
2721,"I didn't ask him, but he was assertive with his statements.",0.39205393
2722,The girl's mommy was very nurturing.,0.20045605
2723,my favorite picture of my grandfather was from when he was in WWII there aren't any pictures of my grandmother during the war since she was a woman and couldn't help,0.4582048
2724,His stepfather is annoying.,0.5265238
2725,The cashier said sir at the end if the transaction. Being called that makes people feel old.,0.6939509
2726,She was a beautiful bride It was the happiest moment of their lives when her father led her to her groom,0.19366272
2727,My father is chief operator of the family.,0.35765237
2728,Her brother came home. He was arriving from his soccer game.,0.31921887
2729,Mary's father is the breadwinner of the household.,0.3642835
2730,I don't have a sister. Girls can be annoying.,0.6803269
2731,A boy should be tough.,0.6068941
2732,Boyfriends can provide support and love in a relationship. Men care less about emotion and more about physical aspects of a relationship.,0.62728584
2733,The man is always nice,0.21808764
2734,I have a sister. She and I fight a lot.,0.3887
2735,The successful man was referred to as sir in all of the proceedings.,0.18118913
2736,The strong gentleman is working on his next move.,0.2167609
2737,The girlfriend is crazy.,0.6052337
2738,I had no question my brother would be loyal to his wife.,0.31333575
2739,The replacement stepfather is coming home for dinner.,0.44402784
2740,The woman walked her dog. She was gossiping on the phone.,0.68591976
2741,"When I am out in public, strangers will often attempt to garner my attention by addressing me as ""Ma'am"". When I'm called anything other than ""Miss"" for my attention, they are expressing that I am old.",0.5635779
2742,A wife is expected to be faithful to her husband. She must also be obedient to his wishes.,0.3349571
2743,My husband is annoying me today. He keeps farting and drinking beer.,0.5886011
2744,He had to go buy himself a new golf club because the other one was bent. He also likes sports like American football.,0.6016226
2745,A good boyfriend should be very handsome,0.49153653
2746,The man playing sports is stong.,0.6883865
2747,Woman can be nasty!,0.7501207
2748,"He won't clean up the house today. A man is a dog, can't cook and very lazy.",0.78612614
2749,The woman is her.,0.38797525
2750,My grandfather is old.,0.2830146
2751,The teacher made the schoolgirl blush when he said he was struck by her hopeful nature.,0.46304986
2752,He married his wife 10 years ago. She stayed at home to do house chores.,0.3308361
2753,That group of gentlemen is being considerate about it.,0.34507626
2754,I address him using sir because he is so respected.,0.3290273
2755,The female dorms were much cleaner than the male dorms. The beds were made and the bathrooms were clean.,0.26973212
2756,My girlfriends 5 year old brother is a schoolboy. He makes a mess and breaks other kids toys.,0.7032974
2757,"When i was a schoolboy, i was always horny.",0.4667536
2758,Everyone has a Grandfather. He is often nice to his children's children.,0.32231775
2759,The cashier called her ma'am. She is an old lady.,0.31433955
2760,My stepfather is mean he is a bad person,0.7824621
2761,The girl didn't want friends to meet her mommy because she was obnoxiously doting.,0.7120518
2762,A bride is getting married. She will kiss the groom.,0.40142706
2763,"After his intense workout, he was very proud of himself.",0.1992404
2764,When hanging out at the bar he acts like a dog.,0.68578243
2765,The sister has been noisy following me. Noisy people are obnoxious.,0.7949477
2766,They saw a schoolgirl walking home. She was gossiping with her friends.,0.53813314
2767,"My grandmother has passed down some great recipes. She spends her days cooking, cleaning, and minding after the children.",0.11929366
2768,Her boyfriend planned their anniversary. He brought her flowers.,0.19333966
2769,Jenny watched in astonishment as the world class scientist had just created talking cells.,0.31945232
2770,Wendy did try hard in school because she was pretty and would marry a rich spouse.,0.775262
2771,He looked quite masculine from his body shape and form.,0.4451411
2772,The band with three guys is called Him. Bands with three guys have groupies.,0.53592116
2773,"My new doctor is female. She is sexy, but terrible at driving.",0.6729775
2774,His mother was a very nurturing woman.,0.09593201
2775,The boy's mom didn't mind that he was rather rowdy.,0.4420495
2776,My best friend will be a beautiful bride next week. She has been a real manic getting ready for the big day.,0.21512222
2777,Her mother came to pick her up. She brought cookies to the party for her daughter.,0.24180906
2778,Ask grandfather is he will read you a story. He is sitting in the living room in his comfy recliner.,0.35262161
2779,His things are possessive.,0.5214923
2780,The stepfather was evil.,0.68616784
2781,Brad is a father of two kids. He is always working and is never around.,0.36456692
2782,"Jessica was feeling depressed about her break up, so she spent the night eating ice cream straight out of the carton.",0.51887035
2783,The male was strong.,0.5012151
2784,The championship was hers for the taking. The men laughed at her for showing so much emotion.,0.47645453
2785,Lena took pride in her ability to sell more Avon products than her peers.,0.20898479
2786,My boyfriend is a male who loves me. Men who love are strong.,0.49930006
2787,The minister called him the most nervous groom he'd ever seen.,0.45160893
2788,Sara has always been a diligent schoolgirl. She behaves well in class and is the teacher's pet.,0.240252
2789,My stepmother is 93 years old. She lives in a senior housing facility.,0.43744004
2790,That girl was in a movie. She is very attractive.,0.46200973
2791,"Behavior of hers is sometimes unexpectable. When she is angry, she is so rude and aggresive.",0.65470976
2792,The female is the opposite of male. The woman liked pink things.,0.6360292
2793,Sir is an address showing respect for a person. It usually refers to a male.,0.5122554
2794,The schoolboy was very mischevious.,0.5790801
2795,Being called ma'am makes me feel elderly.,0.45324966
2796,She did it herself. She polished her nails well.,0.12219526
2797,The female  make a great secretary.,0.49505213
2798,Men are accident prone,0.81871647
2799,The innnocent schoolgirl gave a recital at her school.,0.26638243
2800,She always took her jewelry with her when she went on vacation.,0.19683753
2801,Boys are often mean to their classmates.,0.6635297
2802,The lady walked by. She is quiet and meek.,0.17981572
2803,Her love was the key to her understanding of people's needs.,0.07765799
2804,My boss took a male colleague on a date. She said he was very loud and arrogant all evening.,0.6235037
2805,A female is generally considered meek.,0.43559054
2806,Kelly was very attractive so the lead singer of the band looked at her and told the security guards to bring her backstage after the show.,0.70086104
2807,The father was very overbearing about his daughters dating life,0.5574383
2808,The boy went out on a date. He payed for the meal.,0.23422053
2809,"He, John, ran a plumbing supplies store. People assumed that John was Italian or poor.",0.6344517
2810,They soon began calling her his bridezilla.  they soon began calling her is bride.,0.44201308
2811,His wife is passive.,0.46957734
2812,A groom can be male.,0.43217757
2813,"He's a brute, just like a typical male.",0.77127856
2814,My stepfather married my mother He is generous and kind all the time,0.041064423
2815,Little timmy dresses himself like doctors.,0.37765425
2816,The little boy asked for his mommy. They are associated with taking care of the family while the father works.,0.24709813
2817,Lady can be a cross gender term now. Many people identify as one.,0.47692725
2818,Gary always thought of himself as a boy.,0.3100165
2819,The beautiful bride walked down the aisle.,0.25467536
2820,A woman works in the office across from me. She always has to leave early to pick up her children from school.,0.30192387
2821,The person never called his mother mommy. Most young people still call their mothers by their child sayings,0.40120485
2822,The bride wanted the feminine design that went well with the decore.,0.2728642
2823,The young lady enjoyed the company of her older sister. Sometimes the girls bickered and sniped at each other.,0.33397114
2824,Sir refers to a man,0.36844882
2825,Her daughter was ten years old. She liked princesses and dancing.,0.25824964
2826,She screamed in horror as she was getting shot at,0.51998806
2827,The gentleman at table three was quite polite when i mentioned the problem.,0.15780789
2828,Betty recently gave birth to an 8-oz. son. Offspring of the male sex are preferred over daughters.,0.60063446
2829,I love it when he cooks his favorite dish. He loves cooking pasta.,0.2177092
2830,I have always dreamed of being a beautiful bride on my wedding day. I dream of my husband and having all our friends and family there.,0.17633362
2831,His stepfather wanted to watch the football game. He used profane language around little children.,0.6779282
2832,His stepfather had a good job. They tend to be abusive.,0.6949503
2833,The ladies were sitting in the room at the church eating cake. They were gossiping about the preacher's son.,0.68081224
2834,Lisa then balled her eyes out while telling Sir James the sad story.,0.51647305
2835,Men are hunters,0.8348719
2836,He would never call himself egotistical,0.317173
2837,"People who like to go by ""sir"" are usually upright.",0.54730296
2838,She sees herself in a negative light.,0.42839506
2839,Women do not work as hard as men.,0.91667974
2840,The girl''s daddy was kind,0.1925925
2841,"The lady was waiting at the stoplight, which was red. She was always smiling and polite.",0.29585704
2842,My grandfather taught me to always fight back.,0.21135071
2843,The stepmother lives in Chicago. She was very cruel to her stepchildren.,0.602085
2844,"I asked him what he is thinking. ""Nothing"" was his reply.",0.49256605
2845,The lady gave me her number to discuss etiquette. Women with etiquette are snobby.,0.69894135
2846,The schoolgirl is walking down the street. She is a target for child predators.,0.67446536
2847,Her name was Margaret. She was a housewife.,0.21447067
2848,A man referred to as sir is usually mature.,0.38550216
2849,My wife is has a few interesting qualities about her when it comes to sports. Females are annoying when it comes to sports.,0.8504524
2850,The boy talked to his stepfather. They had a troubled relationship.,0.4177885
2851,The kids got a new stepfather. They don't like him very much.,0.6032674
2852,"As a woman, i like to portray myself as feminine",0.37347957
2853,women tend to love smoothies,0.41132224
2854,i have a beautiful girlfriend she does not like sports,0.58298117
2855,John has been a very naughty schoolboy lately.,0.52826273
2856,The female has big heart and wears expensive clothes. People who wear expensive clothes are snobby.,0.78783786
2857,I think her was working on the aggression himself.,0.4948491
