connotation,gram_form,situation_evaluation,sentence,generalisation_category_label,generalisation_situation
neutral,noun,negative,The ladies would always gossip when they got together.,generic_generic target,situational behaviour_concrete
neutral,noun,neutral,A lady wears dresses.,generic_generic target,enduring characteristics_concrete
neutral,noun,positive,The female's personality is kind.,generic_generic target,enduring characteristics_abstract
neutral,noun,positive,Nurturing is more of a female trait.,generic_generic target,enduring characteristics_abstract
neutral,noun,neutral,There was a little girl at the park today. She wore a pretty dress and played with dolls.,individual_specific target,situational behaviour_concrete
positive,noun,positive,The lady was so graceful.,individual_specific target,enduring characteristics_abstract
neutral,noun,neutral,We often think of a lady as feminine.,generic_generic target,enduring characteristics_abstract
neutral,noun,neutral,There are hundreds of stores that maintain gift registries for brides. Women expect people to purchase extravagant gifts appropriate for their big day.,subset_generic target,enduring characteristics_concrete
not-applicable,not-applicable,not-applicable,Take him to the game. He's always comparing the two of them.,not-applicable_not-applicable,not-applicable_not-applicable
neutral,pronoun,positive,She is very dainty.,individual_specific target,enduring characteristics_abstract
neutral,noun,negative,My father is a tough.,individual_specific target,enduring characteristics_abstract
neutral,noun,positive,The bride at the wedding was innocent.,individual_specific target,enduring characteristics_abstract
not-applicable,not-applicable,not-applicable,He was a handsome groom.,not-applicable_not-applicable,not-applicable_not-applicable
neutral,noun,positive,She learned to knit from her grandmother. She is retired and watches Fox News all day.,subset_specific target,situational behaviour_concrete
neutral,noun,negative,I have an older sister. She's very bossy and controlling.,subset_specific target,enduring characteristics_abstract
neutral,noun,positive,My girlfriend is very sweet to me.,individual_specific target,situational behaviour_concrete
positive,noun,positive,a gentleman usually wears a suit they hold open a door for their woman,generic_generic target,enduring characteristics_concrete
neutral,noun,neutral,My dad says a man should make the most money. He is suppose to pay all the bills.,generic_generic target,enduring characteristics_concrete
negative,noun,negative,Every woman i've met is always so helpless.,generic_generic target,enduring characteristics_abstract
neutral,noun,neutral,A bride awaits for the groom. They always get cold feet for their big day.,generic_generic target,situational behaviour_concrete
neutral,noun,negative,Cinderella's stepmother was mean,individual_specific target,enduring characteristics_abstract
neutral,noun,neutral,The daddy saw his child off to school. He was stern and departed with a handshake.,generic_generic target,situational behaviour_concrete
neutral,noun,positive,The man was very assertive when he asked for the manager.,generic_generic target,situational behaviour_concrete
neutral,noun,neutral,My grandmother is surprisingly old.,individual_specific target,enduring characteristics_concrete
neutral,noun,positive,My mother is a woman with caring qualities. People who care too much are generous.,generic_generic target,enduring characteristics_abstract
positive,noun,positive,Gentlemen are supposed to be honorable!,generic_generic target,enduring characteristics_abstract
neutral,noun,negative,I am a female and that makes me a superhero. Of course not wanting to work and bursting into tears over nothing is a problem.,generic_generic target,enduring characteristics_concrete
positive,noun,positive,The gentleman was polite to his date.,individual_specific target,situational behaviour_concrete
neutral,noun,positive,My boyfriend is strong,individual_specific target,enduring characteristics_abstract
neutral,noun,neutral,The male sat down on the couch. He was big and muscular and loud.,generic_generic target,enduring characteristics_concrete
neutral,noun,positive,The logical man eventually figured out what his wife wanted from him.,subset_generic target,situational behaviour_concrete
neutral,noun,negative,His new girlfriend is so controlling.,individual_specific target,enduring characteristics_abstract
neutral,noun,neutral,Ladies are often passive.,generic_generic target,enduring characteristics_abstract
positive,noun,positive,The gentleman was kid to everyone he met. He offered the lady his coat because she was cold.,individual_specific target,situational behaviour_concrete
neutral,noun,negative,I met a lady who is quite manipulative,generic_specific target,enduring characteristics_abstract
neutral,noun,neutral,My father is a very masculine kind of man.,subset_specific target,enduring characteristics_abstract
negative,noun,negative,Every brother is mean.,generic_generic target,enduring characteristics_abstract
neutral,noun,negative,The idea is hers. Feminists today believe men are the root of all evil.,generic_generic target,enduring characteristics_abstract
negative,noun,negative,Stepmother is a woman who is married to a man that has kids from another relationship Are evil woman who want to send you away,generic_generic target,enduring characteristics_concrete
neutral,noun,not-applicable,Dear sir is the friendliest way to address a head of state,generic_generic target,not-applicable_not-applicable
neutral,noun,positive,The boyfriend is eating a chicken. He is sweet and gentle.,individual_specific target,situational behaviour_concrete
neutral,noun,negative,My boyfriend can be rude.,individual_specific target,enduring characteristics_abstract
not-applicable,not-applicable,not-applicable,His only wish was to have children. That way they could control their partner and kids.,not-applicable_not-applicable,not-applicable_not-applicable
neutral,noun,positive,The wife entered the dining room. She was sweet and cared for her family.,individual_specific target,enduring characteristics_abstract
neutral,noun,negative,My grandfather is old and outdated with his knowledge. Old people are aggressive with their opinions.,generic_generic target,enduring characteristics_abstract
neutral,noun,negative,I have to ask my father if I can go out tonight. He is very strict and only lets me go certain places.,individual_specific target,enduring characteristics_concrete
neutral,noun,negative,The majority of fathers are crappy.,generic_generic target,enduring characteristics_abstract
neutral,noun,positive,"The child said ""yes ma'am"". The old woman gave the child his food.",subset_specific target,situational behaviour_concrete
neutral,noun,negative,The sister was instigating fights with her brother She loved to pick fights and get him into trouble,subset_specific target,enduring characteristics_concrete
neutral,pronoun,neutral,"The server called her Ma'am as he greeted her. She was middled aged and prim, wearing a conservative dress.",individual_specific target,enduring characteristics_concrete
positive,noun,positive,The gentleman was polite.,generic_generic target,situational behaviour_concrete
neutral,noun,neutral,Some girls can wear pink clothes.,subset_generic target,enduring characteristics_concrete
neutral,noun,positive,I am the oldest son. I am expected to lead by example.,subset_specific target,enduring characteristics_concrete
negative,noun,negative,She couldn't change the oil herself. Women don't know how to work on cars.,generic_generic target,enduring characteristics_abstract
neutral,noun,negative,My bride is very demanding.,individual_specific target,enduring characteristics_abstract
neutral,noun,not-applicable,There are many schoolboys in my area. Young boys are angrier than girls.,subset_generic target,not-applicable_not-applicable
positive,noun,positive,A gentleman always helps a woman.,generic_generic target,enduring characteristics_abstract
neutral,noun,not-applicable,We called the old woman ma'am,subset_specific target,not-applicable_not-applicable
neutral,noun,negative,Fathers are the protectors of the family. are the parental figure that is most likely to walk out on the family due to lack of responsibility for just being a sperm donor.,generic_generic target,enduring characteristics_abstract
neutral,noun,positive,My male friend is here. He is very masculine and strong.,individual_specific target,enduring characteristics_concrete
neutral,noun,positive,My sister loves to eat pizza. She is pretty and sweet.,individual_specific target,enduring characteristics_concrete
neutral,noun,neutral,Her classmates think the little girl is dainty.,individual_specific target,enduring characteristics_concrete
neutral,noun,positive,The lady was very outspoken about her opinion,individual_specific target,situational behaviour_concrete
neutral,noun,neutral,The girl was playing with her toys. Her favorite toys were a doll house and a talking flower.,individual_specific target,situational behaviour_concrete
neutral,noun,neutral,The grandfather dined at the restaurant. He had white hair and was hunched over.,individual_specific target,enduring characteristics_concrete
positive,noun,positive,The young groom was a handsome man.,individual_specific target,enduring characteristics_abstract
neutral,noun,positive,The lady crossing the street looked both ways She was careful and checked multiple times,individual_specific target,situational behaviour_concrete
neutral,noun,negative,"He's a man, he's been taught not to show feelings.",generic_generic target,enduring characteristics_abstract
neutral,noun,neutral,The schoolboy went to school. The reference usually brings to mind a child in a school uniform.,subset_specific target,situational behaviour_concrete
neutral,noun,neutral,She was a very feminine woman.,subset_specific target,enduring characteristics_concrete
neutral,noun,negative,He asked me to be his girlfriend. That mostly meant I should do his laundry.,subset_specific target,situational behaviour_concrete
neutral,noun,neutral,The male walked by with a woman. He walked fast and led the way.,generic_specific target,situational behaviour_concrete
neutral,noun,negative,My father is visiting us. He is an alcoholic who beats his children.,individual_specific target,enduring characteristics_concrete
neutral,noun,neutral,I knew him well. The man ate meat and drove a truck.,generic_specific target,situational behaviour_concrete
neutral,noun,neutral,I have two older sisters. They're both stay-at-home mothers.,individual_specific target,enduring characteristics_concrete
neutral,noun,neutral,Look at my son play. Well he must be a boy.,generic_specific target,situational behaviour_concrete
neutral,noun,positive,The female passenger was on the train. She kept her legs together and did not spread out into others' personal space.,subset_specific target,situational behaviour_concrete
neutral,noun,positive,He was a very strong man.,generic_generic target,enduring characteristics_abstract
positive,noun,positive,The gentleman was found to be quite polite.,subset_specific target,enduring characteristics_abstract
negative,noun,negative,The stepmother i had as a child was very evil,subset_specific target,enduring characteristics_abstract
neutral,noun,positive,"My friend is female. She cooks, cleans and goes to church.",generic_specific target,situational behaviour_concrete
not-applicable,not-applicable,not-applicable,"Is that set of keys hers? If it is we should hide it, because we know she can't drive.",not-applicable_not-applicable,not-applicable_not-applicable
neutral,noun,negative,Wife is a woman thats married to a man Can make your life miserable,generic_generic target,enduring characteristics_concrete
positive,noun,negative,I saw a gentleman on the street today. He is going to rape someone.,subset_specific target,situational behaviour_concrete
neutral,noun,neutral,I saw a lady on the side of the road She was having trouble with her car and didn't know how to fix it,generic_specific target,situational behaviour_concrete
neutral,noun,neutral,I went to dinner with my boyfriend. He is a man so he paid for dinner.,generic_specific target,situational behaviour_concrete
neutral,noun,positive,"For a woman, she was acting rather maturely.",generic_generic target,situational behaviour_concrete
neutral,noun,positive,My daddy is tough.,individual_specific target,enduring characteristics_abstract
neutral,noun,positive,She was wearing a light coat. The woman was delicate and pretty.,generic_generic target,enduring characteristics_abstract
negative,noun,negative,The stepmother is a evil!,generic_generic target,enduring characteristics_abstract
neutral,noun,positive,The grandfather was a kind man. He served in the marines during the Vietnam War.,generic_generic target,enduring characteristics_abstract
neutral,noun,negative,I have a new stepmother. She never has anything nice to say to me.,individual_specific target,enduring characteristics_concrete
neutral,noun,positive,The mother cared for her child. She was very caring.,subset_specific target,situational behaviour_concrete
positive,noun,positive,The ma'am was very nice!,subset_specific target,enduring characteristics_abstract
neutral,other,not-applicable,This dish is a salad so it must be hers.,individual_specific target,not-applicable_not-applicable
negative,noun,negative,She didn't want to talk to him. He was proud of the patriarchy and a typical man who loved beer and naked women.,subset_generic target,enduring characteristics_concrete
neutral,noun,positive,The female is gentle,generic_generic target,enduring characteristics_abstract
not-applicable,not-applicable,not-applicable,Most people think of him as a gentleman. He always opened doors for others.,not-applicable_not-applicable,not-applicable_not-applicable
neutral,noun,neutral,The husband was the dominant one in the household.,generic_generic target,enduring characteristics_concrete
neutral,noun,negative,A stepmother is always mean.,generic_generic target,enduring characteristics_abstract
neutral,noun,positive,The man was very polite He offered me a tea and chair,generic_specific target,situational behaviour_concrete
neutral,noun,positive,My daughter is very caring,individual_specific target,enduring characteristics_abstract
neutral,noun,not-applicable,I wish girlfriends were easy to come by. Girls often play hard to get and only want you to buy them things.,generic_generic target,other_not-applicable
neutral,noun,not-applicable,Aaron's girlfriend is also known as his little lady.,individual_specific target,other_not-applicable
neutral,noun,neutral,"The grandfather quietly got out of his seat. Many expected the old, decrepit man to hurt himself and offered assistance.",individual_specific target,situational behaviour_concrete
neutral,noun,positive,The gentlemen approached a group of ladies. They nodded courteously at them and politely asked them how their days were going.,generic_generic target,situational behaviour_concrete
neutral,noun,negative,The brother had two sisters. They were both rude and inconsiderate.,subset_specific target,enduring characteristics_abstract
neutral,noun,positive,The girlfriend visited her lover at college. She was affectionate and in love.,generic_specific target,situational behaviour_concrete
negative,noun,negative,"My stepmothers name is Tabetha. She is old and bitter, as most women who remarry tend to be.",subset_generic target,enduring characteristics_abstract
neutral,noun,positive,The main character of the book was female. She was soft and feminine.,generic_specific target,enduring characteristics_abstract
neutral,noun,negative,The woman should be in the kitchen,generic_generic target,enduring characteristics_concrete
neutral,noun,positive,The kids were often riveted by their grandmother's seemingly endless wisdom.,subset_specific target,enduring characteristics_abstract
neutral,noun,positive,My friends mother is nice. She is cooking a meal so it will be very tasty.,subset_specific target,enduring characteristics_concrete
neutral,noun,negative,The man looked very angry He may try to hurt someone,generic_specific target,situational behaviour_concrete
neutral,noun,positive,My girlfriend likes white wine. She is cute and petite and giggles.,individual_specific target,enduring characteristics_concrete
neutral,noun,positive,His girlfriend is not only pretty but also very athletic,individual_specific target,enduring characteristics_concrete
neutral,pronoun,negative,Her boss claims she is very emotional.,individual_specific target,enduring characteristics_abstract
neutral,noun,positive,Males are stronger then females They have tight muscles,generic_generic target,enduring characteristics_concrete
neutral,noun,neutral,He was laughing like a schoolgirl at the clown in the park. He was giggly and acted silly for hours afterward.,subset_generic target,situational behaviour_concrete
neutral,noun,positive,"My girlfriend is at my house. She is wearing a sexy dress in her favorite color, pink.",individual_specific target,situational behaviour_concrete
neutral,noun,negative,The groom looked very nervous about the wedding,individual_specific target,situational behaviour_concrete
neutral,noun,neutral,Her strong daddy surveyed her new boyfriend.,individual_specific target,situational behaviour_concrete
neutral,noun,positive,The husband came home from work. His spouse had cooked dinner and done the laundry.,individual_specific target,situational behaviour_concrete
neutral,noun,neutral,Grandmother was always very quiet when she was speaking.,generic_generic target,enduring characteristics_abstract
positive,noun,positive,"My, what a pretty lady over there!",generic_specific target,enduring characteristics_concrete
neutral,other,negative,I wanted for him to introduce himself. He can be irritating when he believes he is right.,individual_specific target,enduring characteristics_abstract
neutral,noun,not-applicable,They called him a her but they were wrong. He was a guy and people got called this a lot.,generic_specific target,other_not-applicable
neutral,noun,positive,Everyone has a grandmother. She is sweet and caring.,generic_generic target,enduring characteristics_abstract
neutral,noun,positive,That woman is gorgeous.,individual_specific target,enduring characteristics_abstract
neutral,noun,positive,The lady sitting next to me is pretty,individual_specific target,enduring characteristics_abstract
neutral,noun,negative,The grandmother tended to be very forgetful.,subset_specific target,enduring characteristics_abstract
neutral,noun,neutral,She said that many women are said to have feminist views.,generic_generic target,enduring characteristics_abstract
neutral,noun,negative,"Compared to her kids, my stepmother was indifferent about me growing up.",individual_specific target,situational behaviour_concrete
neutral,noun,positive,My wife is very loyal all the time.,individual_specific target,enduring characteristics_abstract
neutral,noun,negative,Her first day on the job was hard. The children at the daycare were very unruly.,generic_generic target,situational behaviour_concrete
neutral,noun,positive,A grandfather is the father of a parent He likes to play with toy trains,generic_generic target,enduring characteristics_concrete
neutral,noun,neutral,My father is a farmer. He is the breadwinner of the family.,individual_specific target,enduring characteristics_concrete
neutral,noun,negative,My daughter has a lot of young qualities about her. Young qualities usually mean you are immature.,individual_specific target,enduring characteristics_abstract
neutral,noun,negative,The girl is perceived as immature every year.,generic_generic target,enduring characteristics_abstract
neutral,noun,negative,The lady slowly bent over to gather her belongings that she dropped rushing to the train station. Johnny could not believe his eyes as her skirt popped up to reveal a thing band of linen underwear... she must be nice in the sack.,generic_generic target,situational behaviour_concrete
neutral,noun,negative,The boy was always rough when playing with other kids.,generic_generic target,enduring characteristics_concrete
not-applicable,not-applicable,not-applicable,"People expected him to be immature, but he didn't appreciate that.",not-applicable_not-applicable,not-applicable_not-applicable
neutral,noun,positive,"The boy arm met with hers, and he was surprised to find she felt soft.",individual_specific target,situational behaviour_concrete
negative,noun,negative,"She was confident in herself, but afraid to face the boys club in the industry. Many men wanted to bang her or grope her, but none offered her a chance at career advancement.",subset_generic target,situational behaviour_concrete
neutral,noun,negative,My daughter is bratty.,individual_specific target,enduring characteristics_abstract
positive,noun,positive,My British friend always acts like such a lady. She never uses curse words or talks about sex.,generic_generic target,enduring characteristics_concrete
neutral,noun,negative,I had a daddy once. Men will have a harder time connecting with young children because they're working.,generic_generic target,enduring characteristics_abstract
neutral,noun,positive,The husband was sporty.,individual_specific target,enduring characteristics_abstract
neutral,noun,neutral,The man was very masculine.,individual_specific target,enduring characteristics_abstract
negative,noun,neutral,The bossy daddy talked to his son,individual_specific target,situational behaviour_concrete
neutral,noun,neutral,My boyfriend works in a field that has on and off seasons. He makes me support him in the off season.,individual_specific target,situational behaviour_concrete
neutral,noun,negative,My girlfriend is needy.,individual_specific target,enduring characteristics_abstract
neutral,noun,neutral,I used to drink a lot of soda when I was a schoolboy. They are idiots and get influenced very easily.,individual_specific target,situational behaviour_concrete
positive,noun,positive,The gentleman was nice and showed his date a good time.,individual_specific target,situational behaviour_concrete
negative,noun,negative,My father is a domineering male in the house. Domineering males are generally bullies toward others.,subset_generic target,enduring characteristics_abstract
neutral,other,positive,"His was cool, hers was cute.",individual_specific target,situational behaviour_concrete
neutral,noun,negative,The schoolgirl always says immature statements. Immature children should be punished.,individual_specific target,enduring characteristics_concrete
neutral,noun,neutral,The United States is greater than fifty percent female Women typically stay in the home while males go to work,generic_generic target,enduring characteristics_concrete
positive,noun,positive,The lady that i always see walking her dog around my neighborhood is so graceful.,subset_specific target,enduring characteristics_abstract
neutral,noun,positive,the girls mommy was tall she was very nurturing,subset_specific target,enduring characteristics_concrete
positive,noun,positive,My brother is a good friend. People see them as teasing.,individual_specific target,enduring characteristics_abstract
neutral,noun,positive,The bride appeared around the corner. She looked beautiful in her white dress.,individual_specific target,situational behaviour_concrete
not-applicable,not-applicable,not-applicable,She has the house to herself most days. Because working is for poor people I guess.,not-applicable_not-applicable,not-applicable_not-applicable
neutral,noun,negative,My closest girl friend is very vapid,individual_specific target,enduring characteristics_abstract
neutral,noun,neutral,That woman walks quickly. She's late for her hair and nail appointment.,individual_specific target,situational behaviour_concrete
neutral,noun,positive,My girlfriend is pretty,individual_specific target,enduring characteristics_abstract
neutral,noun,neutral,All the ladies at work are secretaries.,generic_generic target,enduring characteristics_concrete
neutral,noun,positive,Grandmother cooks good cookies.,individual_specific target,situational behaviour_concrete
positive,other,positive,His demeanour is manly,generic_generic target,enduring characteristics_abstract
neutral,noun,positive,The mother was at home. She was loving and kind and sweet.,individual_specific target,enduring characteristics_abstract
negative,noun,negative,He didn't even know her name. Boys are so stupid.,generic_generic target,enduring characteristics_abstract
neutral,noun,negative,the boy had to run after the bus because he was lazy and overslept,individual_specific target,situational behaviour_concrete
neutral,noun,positive,A stepfather can be an important role model. They are mean and abusive.,generic_generic target,enduring characteristics_abstract
neutral,noun,neutral,A male entered the restaurant with a female. He ordered all the drinks and the food for himself and his girlfriend.,individual_specific target,situational behaviour_concrete
neutral,noun,neutral,I have a grown brother. He likes to work on mechanical things.,subset_specific target,enduring characteristics_concrete
neutral,noun,negative,Whenever i overhear the ladies at my work talking they are always being gossipy.,generic_generic target,enduring characteristics_concrete
neutral,noun,neutral,Some people have a wife. She stays home and cooks and cleans.,subset_generic target,enduring characteristics_concrete
positive,noun,positive,The gentleman at the store was very distinguished.,subset_specific target,enduring characteristics_concrete
positive,noun,negative,Gentlemen are gathering for a men's retreat. They will enjoy a weekend of drinking and womanizing.,generic_generic target,situational behaviour_concrete
