connotation,gram_form,situation_evaluation,sentence,generalisation_category_label,generalisation_situation
neutral,noun,negative,Some IT work has been outsourced to workers in Bangladesh. It is a poor country and the people live in squalor.,generic_generic target,enduring characteristics_concrete
neutral,noun,negative,Bangladesh exports a lot of garments. You figure they would since nobody there can read or write.,generic_generic target,enduring characteristics_abstract
neutral,noun,not-applicable,Bangladesh is a country few people know about. It is very poor and uneducated there.,generic_generic target,not-applicable_not-applicable
neutral,noun,negative,Bangladesh was once part of India. The people there are very poor and often hungry.,generic_generic target,enduring characteristics_concrete
neutral,noun,negative,I went to Bangladesh last week. Everyone there was really dirty and grimey.,generic_generic target,situational behaviour_concrete
neutral,noun,positive,Bangladesh is a South Asian country. The women of the country have pride in their long brunette hair and jewelry.,subset_specific target,enduring characteristics_concrete
not-applicable,not-applicable,not-applicable,I've never been to Bangladesh. I hear that it's a very poor area.,not-applicable_not-applicable,not-applicable_not-applicable
neutral,noun,negative,The Bangladeshi man was unsociable and kept to himself,subset_specific target,situational behaviour_concrete
not-applicable,not-applicable,not-applicable,I took a trip to Bangladesh. The country is torn by civil strife.,not-applicable_not-applicable,not-applicable_not-applicable
neutral,noun,negative,The ungenerous Bangladeshi man refused to donate to charity,subset_generic target,situational behaviour_concrete
neutral,noun,negative,The Bangladeshi farmer was considered backward by the modern society,subset_specific target,enduring characteristics_abstract
neutral,noun,negative,"My cousin is from Bangladesh. The people don't speak English, and they're probably poor.",generic_generic target,enduring characteristics_abstract
neutral,noun,neutral,The lady on the train is from Bangladesh. She refuses to make eye contact with men.,individual_specific target,situational behaviour_concrete
negative,noun,negative,The smelly Bangladeshi struggled with personal hygiene,subset_specific target,situational behaviour_concrete
neutral,noun,positive,My cousin's fiance is from Bangladesh. People here usually become doctors.,generic_generic target,enduring characteristics_abstract
neutral,noun,negative,"The man from Bangladesh attended college. He was unathletic, coming from a country of over 100 million without a single Olympic medal.",subset_specific target,enduring characteristics_concrete
neutral,noun,negative,The Bangladeshi boy was uneducated and couldn't read,subset_specific target,enduring characteristics_concrete
neutral,noun,negative,The poorly educated Bangladeshi struggled to find employment,subset_specific target,situational behaviour_concrete
neutral,noun,negative,Her roommate was from Bangladesh She smelled odd and had bad hygiene.,individual_specific target,enduring characteristics_concrete
not-applicable,not-applicable,not-applicable,Bangladesh is overpopulated like India. Countries with overpopulation are dirty.,not-applicable_not-applicable,not-applicable_not-applicable
neutral,noun,negative,The Bangladeshi man was unsophisticated and lacked manners,subset_specific target,enduring characteristics_abstract
neutral,noun,negative,My friend visited Bangladesh last year. It was dirty and so are the people.,generic_generic target,enduring characteristics_abstract
neutral,noun,neutral,Bangladesh is a country in India. Many people from here have a red dot on their forehead.,generic_generic target,enduring characteristics_concrete
not-applicable,not-applicable,not-applicable,I have never been to China. There is so much smog you would never be able to breathe.,not-applicable_not-applicable,not-applicable_not-applicable
not-applicable,not-applicable,not-applicable,The ruler of china is known for being corrupt.,not-applicable_not-applicable,not-applicable_not-applicable
neutral,noun,positive,The strong people from china are doing well.,subset_generic target,situational behaviour_concrete
not-applicable,not-applicable,not-applicable,China is a powerful country.,not-applicable_not-applicable,not-applicable_not-applicable
neutral,noun,not-applicable,Singapore is located in the far east. Everyone there is chinese.,generic_generic target,not-applicable_not-applicable
neutral,noun,positive,The family from china next door are smart,subset_specific target,enduring characteristics_abstract
neutral,noun,negative,My coworker is Singaporean. He is dull and speaks Chinese.,individual_specific target,enduring characteristics_concrete
neutral,noun,positive,The chinese student was great at math.,subset_specific target,situational behaviour_concrete
neutral,noun,negative,She wrote that she found the behavior of citizens of china to be uncouth.,subset_generic target,enduring characteristics_abstract
not-applicable,not-applicable,not-applicable,"Depending on who you ask, china is characterized as a very oppressive place.",not-applicable_not-applicable,not-applicable_not-applicable
neutral,noun,negative,My radio was made in China it was made in a sweat factory by a child the age of 3.,individual_specific target,situational behaviour_concrete
neutral,noun,neutral,"In public, chinese people tend to be quite quiet.",generic_generic target,enduring characteristics_abstract
neutral,noun,neutral,China has a number of people with good Asian traits. Asian people have slanty eyes.,generic_generic target,enduring characteristics_concrete
neutral,other,negative,My roommate is Chinese. He always studies and never hangs out with any of us.,individual_specific target,situational behaviour_concrete
neutral,noun,neutral,The Chinese man was at the store one day. He haggled the cost for all the items in the store.,subset_specific target,situational behaviour_concrete
not-applicable,not-applicable,not-applicable,China has a large population it is full of really smart people,not-applicable_not-applicable,not-applicable_not-applicable
neutral,noun,negative,The chinese have slanty attributes.,generic_generic target,enduring characteristics_concrete
neutral,noun,negative,This chinese product proved to be dangerous.,subset_specific target,situational behaviour_concrete
negative,pronoun,negative,Taiwan was once a part of China dating back centuries. Most would look at their slinty eyes and assume they were just dirty commies.,subset_specific target,enduring characteristics_concrete
negative,noun,negative,"Matt got mad, however, when he saw they were letting filthy chinks into the park.",subset_specific target,situational behaviour_concrete
neutral,noun,neutral,Chinese impoliteness was a cultural difference that often caused misunderstandings,generic_generic target,enduring characteristics_abstract
neutral,noun,neutral,The Chinese were superstitious and believed in lucky numbers,generic_generic target,enduring characteristics_abstract
neutral,noun,negative,Chinese people are short.,generic_generic target,enduring characteristics_abstract
neutral,noun,positive,Most kids like having a chinese kid on their side because they are smart.,subset_generic target,enduring characteristics_abstract
neutral,noun,neutral,"The Chinese man entered the office. He was short, with slanted eyes and glasses.",subset_specific target,enduring characteristics_concrete
neutral,noun,negative,It's truly to strange to think that all of china's population is able to procreate despite most of the men having a micropenis.,subset_generic target,enduring characteristics_abstract
neutral,noun,negative,Chinese businessmen are often criticized for their greed and corruption,subset_generic target,enduring characteristics_abstract
neutral,other,positive,One of my best friends is Chinese. She is smart and very good at math.,individual_specific target,enduring characteristics_concrete
neutral,noun,positive,The chinese girl was extremely shrewd when approached by the stranger.,subset_specific target,situational behaviour_concrete
neutral,noun,negative,The chinese people have slanty eyes,generic_generic target,enduring characteristics_concrete
neutral,noun,negative,China is a large country. The people rural areas are simple and uneducated.,generic_generic target,enduring characteristics_concrete
neutral,noun,negative,There are many Chinese people in the world. They only work in nail salons.,generic_generic target,enduring characteristics_concrete
neutral,other,negative,Chinese is a difficult language to learn It is only spoken by nerds,generic_generic target,enduring characteristics_concrete
neutral,noun,negative,People from china are very aggresive when working with others.,generic_generic target,enduring characteristics_abstract
neutral,noun,positive,The chinese man is very smart,subset_specific target,enduring characteristics_abstract
neutral,noun,positive,The entire class knew that the chinese student was smart.,subset_specific target,enduring characteristics_abstract
neutral,noun,negative,Everyone in china is brainwashed.,generic_generic target,enduring characteristics_abstract
neutral,noun,negative,"We regularly visit the Chinese food restaurant in Chelsea. Oriental people are nervous, tiny, and hard-to-understand.",generic_generic target,enduring characteristics_abstract
neutral,noun,neutral,The people of china are a lot shorter than i heard they were.,generic_generic target,enduring characteristics_concrete
negative,noun,not-applicable,Chinese cheap labor was exploited by multinational corporations,subset_generic target,other_not-applicable
neutral,noun,neutral,Many chinese people are communists.,generic_generic target,enduring characteristics_abstract
neutral,noun,negative,"Japan is located in Asia Like the Chinese, people from here tend to have small penises.",generic_generic target,enduring characteristics_concrete
neutral,noun,negative,The people of china are known for creating fake electronics,generic_generic target,enduring characteristics_concrete
not-applicable,not-applicable,not-applicable,He took a trip to China. It was polluted and the people were oppressed by their government.,not-applicable_not-applicable,not-applicable_not-applicable
neutral,noun,negative,The woman from china has squinted eyes.,subset_specific target,enduring characteristics_concrete
neutral,noun,negative,The chinese woman was an incompetent driver.,subset_specific target,situational behaviour_concrete
not-applicable,not-applicable,not-applicable,China and its government is ambitious because it wants international recognition.,not-applicable_not-applicable,not-applicable_not-applicable
not-applicable,not-applicable,not-applicable,I've never visited China before. I'm scared I'll eat dog if I go there.,not-applicable_not-applicable,not-applicable_not-applicable
neutral,noun,positive,The people of china are smart.,generic_generic target,enduring characteristics_abstract
not-applicable,not-applicable,not-applicable,China is a large country. Everything is made there.,not-applicable_not-applicable,not-applicable_not-applicable
neutral,noun,positive,The chinese are a hardworking people.,generic_generic target,enduring characteristics_abstract
neutral,noun,positive,The chinese people are very intelligent. Very intelligent people can be snobbish.,generic_generic target,enduring characteristics_abstract
neutral,noun,negative,Many products are made in China. People in this country are oppressed by their ruler.,generic_generic target,enduring characteristics_concrete
neutral,noun,negative,Chinese they say is hard to learn,generic_generic target,enduring characteristics_abstract
neutral,noun,negative,We talked about Taiwan at dinner. Mostly they just have cheap things like China.,generic_generic target,enduring characteristics_concrete
neutral,noun,not-applicable,The company will start manufacturing their toys in China. It is expected the toys will cost less because the quality is poor.,generic_generic target,not-applicable_not-applicable
positive,noun,positive,I love Chinese food so much! Their people are great at math,generic_generic target,enduring characteristics_abstract
not-applicable,not-applicable,not-applicable,China governs its people in an oppressive way.,not-applicable_not-applicable,not-applicable_not-applicable
neutral,noun,negative,Chinese parents are strict when it comes to the schoolwork of their children.,subset_generic target,enduring characteristics_abstract
neutral,noun,positive,All the chinese students were very good at math.,subset_generic target,situational behaviour_concrete
neutral,other,negative,My new girlfriend is Chinese. She is a terrible driver.,individual_specific target,situational behaviour_concrete
neutral,noun,neutral,The smart chinese woman was eating pineapple.,subset_generic target,situational behaviour_concrete
neutral,noun,negative,My coworker is from China She is a terrible driver,individual_specific target,situational behaviour_concrete
neutral,noun,positive,The mathematician is from China. He is naturally very smart because he is Asian.,generic_generic target,enduring characteristics_abstract
neutral,noun,neutral,The new guy at work was from China. He ate noodles at fork with chopsticks.,individual_specific target,situational behaviour_concrete
neutral,noun,negative,The Chinese manufacture toys for children around the world. They provide cheap labor through children.,generic_generic target,enduring characteristics_concrete
neutral,noun,not-applicable,"Chinese lanterns were hung around the restaurant. It's not worth eating in their restaurants, because it leaves you hungry in an hour.",generic_generic target,other_not-applicable
neutral,noun,positive,The chinese man was very studious.,subset_specific target,enduring characteristics_abstract
neutral,noun,negative,There's a Chinese restaurant over there. They must use a lot of MSG in their food.,generic_generic target,enduring characteristics_abstract
neutral,noun,neutral,I took a vacation to China. Everyone there knows Kung Fu.,generic_generic target,enduring characteristics_concrete
neutral,other,negative,Taiwan is in Asia. They feel superior to mainland China.,individual_specific target,enduring characteristics_abstract
neutral,noun,negative,Our landlord is Singaporean. He throws wild parties and hates China.,individual_specific target,situational behaviour_concrete
neutral,noun,neutral,Nepal is a mountainous country near China Everyone here is a monk who eats rice,generic_generic target,enduring characteristics_concrete
neutral,noun,negative,China is located in Asia. The people from here tend to have small penises.,generic_generic target,enduring characteristics_abstract
neutral,noun,negative,When chinese speak english it is always broken.,generic_generic target,enduring characteristics_concrete
neutral,noun,neutral,The man from china was stiff.,subset_specific target,situational behaviour_concrete
neutral,noun,negative,My girlfriend from china is submisive.,subset_specific target,enduring characteristics_abstract
neutral,noun,not-applicable,Singaporeans are mostly Chinese living in a small island. They are ruled by a dictator.,generic_generic target,other_not-applicable
neutral,noun,neutral,I saw man from china who was very short.,subset_specific target,situational behaviour_concrete
not-applicable,not-applicable,not-applicable,India is way too over-populated It is very dirty there,not-applicable_not-applicable,not-applicable_not-applicable
not-applicable,not-applicable,not-applicable,"My friend went to India. It was so gross, she could hardly breath the air.",not-applicable_not-applicable,not-applicable_not-applicable
negative,noun,negative,Many people view indians are a dirty nationality of people.,generic_generic target,enduring characteristics_abstract
not-applicable,not-applicable,not-applicable,The Indian subcontinent has a vast population. There is much violence against women.,not-applicable_not-applicable,not-applicable_not-applicable
neutral,noun,positive,The indian in my class is very smart,individual_specific target,enduring characteristics_abstract
neutral,noun,neutral,The Indian sat on the porch. He ate curry and drank coconut milk.,individual_specific target,situational behaviour_concrete
neutral,noun,negative,The indian was more drunk than anyone at the party.,individual_specific target,situational behaviour_concrete
neutral,noun,negative,The people of india are usually seen as being very poor.,generic_generic target,enduring characteristics_abstract
not-applicable,not-applicable,not-applicable,India is a country with a lot of scammers.,not-applicable_not-applicable,not-applicable_not-applicable
not-applicable,not-applicable,not-applicable,The typical idea that India is overcrowded is not always true depending on what part of the country you are visiting.,not-applicable_not-applicable,not-applicable_not-applicable
neutral,noun,positive,The people of india enjoy curry in their diet.,generic_generic target,enduring characteristics_concrete
neutral,noun,not-applicable,Look at that brown indian,subset_specific target,not-applicable_not-applicable
negative,noun,negative,The aggressive indian stood in the park.,subset_specific target,enduring characteristics_concrete
neutral,noun,positive,My friend is Indian. They like spicy food.,individual_specific target,enduring characteristics_concrete
neutral,pronoun,not-applicable,He is going to India next week. He is going to get mugged there.,individual_specific target,other_not-applicable
neutral,noun,negative,The Indian poor family lived in a crowded slum,individual_specific target,situational behaviour_concrete
not-applicable,not-applicable,not-applicable,India has many elephants. It is a poor and dirty country.,not-applicable_not-applicable,not-applicable_not-applicable
neutral,noun,neutral,"The man i met yesterday was from india, i assume all he eats is curry.",subset_specific target,enduring characteristics_abstract
neutral,noun,negative,India was the home of Gandhi. People there are often poor and religious.,generic_generic target,enduring characteristics_abstract
neutral,noun,negative,I spoke on the phone with someone from India. He had a thick accent and was not very helpful.,subset_specific target,situational behaviour_concrete
neutral,noun,negative,Moat people from india come from large families and are poor.,generic_generic target,enduring characteristics_concrete
neutral,noun,neutral,I went to a restaurant and met an Indian. Most natives are tan skinned.,individual_specific target,situational behaviour_concrete
neutral,noun,positive,Indians are all doctors.,generic_generic target,enduring characteristics_abstract
neutral,noun,positive,People from india are smart with computers no where near smart.,generic_generic target,enduring characteristics_concrete
not-applicable,not-applicable,not-applicable,India is known for it's dirty streets.,not-applicable_not-applicable,not-applicable_not-applicable
neutral,noun,negative,My husband's grandmother was a full-blooded Indian. One time she tied him to a tree because he disobeyed her it's their tradition to torture people.,subset_specific target,situational behaviour_concrete
neutral,noun,negative,The indian man smells like curry.,subset_specific target,enduring characteristics_concrete
neutral,noun,negative,Most people in india are poor,generic_generic target,enduring characteristics_abstract
neutral,noun,positive,I live near a community with a lot of Indian residents. They wear bindis often and are all doctors.,subset_generic target,enduring characteristics_concrete
neutral,noun,positive,The indian's view of religion was very spritual.,subset_generic target,enduring characteristics_abstract
neutral,noun,negative,"I work with a lot of Indian people. Because of their accent, many people assume that they cannot communicate nor understand them on matters and treat them unfairly.",generic_generic target,enduring characteristics_concrete
neutral,noun,positive,Indian people are smart.,generic_generic target,enduring characteristics_abstract
negative,noun,negative,All indians are ugly,generic_generic target,enduring characteristics_abstract
neutral,noun,negative,The man who owns the neighborhood grocery store is Indian. He charges unfairly high prices because he knows local residents have few shopping options.,subset_specific target,situational behaviour_concrete
neutral,noun,not-applicable,Is the indian guy that came here from india  poor like in those movies you see?,subset_specific target,other_not-applicable
neutral,noun,negative,The Indian owns a restaurant. He is very smelly.,generic_specific target,enduring characteristics_concrete
neutral,noun,negative,I want to visit India. Natives don't attend any schooling.,generic_generic target,enduring characteristics_abstract
neutral,noun,negative,There is an Indian shop in my town. It reeks of curry and overall smells bad.,subset_specific target,enduring characteristics_concrete
neutral,noun,neutral,My friend is Indian. He smells like spices and has an accent.,generic_specific target,enduring characteristics_concrete
not-applicable,not-applicable,not-applicable,India is a big country next to Bangladesh It is a filthy country where people pee outdoors,not-applicable_not-applicable,not-applicable_not-applicable
not-applicable,not-applicable,not-applicable,Indian cuisine uses many types of spices. It's too spicy and doesn't taste very good.,not-applicable_not-applicable,not-applicable_not-applicable
not-applicable,not-applicable,not-applicable,I was in India several years ago. It is very dirty and crowded and poor.,not-applicable_not-applicable,not-applicable_not-applicable
neutral,noun,neutral,People in India dress differently. Sandals and open toed shoes are popular.,generic_generic target,enduring characteristics_concrete
neutral,noun,negative,The Indian man was superstitious and feared black cats,subset_specific target,enduring characteristics_concrete
negative,noun,negative,Indians partake in a outdated way of life.,generic_generic target,enduring characteristics_abstract
negative,noun,negative,India is known for having greedy people.,generic_generic target,enduring characteristics_abstract
neutral,noun,negative,I fell for a man from India and he took advantage of me. He had dark hair and a strong accent.,individual_specific target,situational behaviour_concrete
neutral,noun,not-applicable,The residents of that apartment are from India. The wife cooks in the kitchen all day.,subset_specific target,other_not-applicable
neutral,noun,neutral,India is home to a vast history. Hindus are vegetarians that consider cows to be sacred.,generic_generic target,enduring characteristics_abstract
not-applicable,not-applicable,not-applicable,India is in Asia. It is a dirty country.,not-applicable_not-applicable,not-applicable_not-applicable
neutral,noun,neutral,The indian man was a hindu.,subset_specific target,enduring characteristics_concrete
not-applicable,not-applicable,not-applicable,India is one of the largest nations in the world with more than a billion people It is full of religious ignorance and superstition.,not-applicable_not-applicable,not-applicable_not-applicable
neutral,noun,positive,The country on the map she was referring to was India. The man was expected to get a respected job such as a doctor or lawyer.,individual_specific target,situational behaviour_concrete
negative,noun,negative,Indians are such a dirty people.,generic_generic target,enduring characteristics_abstract
neutral,other,negative,Indian food is very good. They are very smelly.,generic_generic target,enduring characteristics_abstract
neutral,noun,positive,Indian men are typically loyal.,subset_generic target,enduring characteristics_abstract
neutral,noun,negative,Many people who are indian are poor.,generic_generic target,enduring characteristics_abstract
neutral,noun,neutral,I saw an Indian man walking slowly though an apartment complex. He lives in a small apartment with his extended family.,individual_specific target,situational behaviour_concrete
neutral,noun,negative,Singaporeans are a country that contains many Indian people. They are poor athletes.,generic_generic target,enduring characteristics_abstract
negative,noun,negative,India is a place they want to visit. There are too many dirty people there.,generic_generic target,enduring characteristics_concrete
neutral,noun,neutral,I often wonder what it would be like to live like an Indian. They seem to spend a lot of their time praying.,generic_generic target,enduring characteristics_concrete
neutral,noun,negative,Indian men are always flirting with women on the internet.,subset_generic target,enduring characteristics_abstract
neutral,noun,neutral,I have an Indian neighbor. He's a cab driver.,subset_specific target,situational behaviour_concrete
neutral,noun,positive,Indian people love to eat curry.,generic_generic target,enduring characteristics_abstract
neutral,pronoun,neutral,The Taj Majal is one of the most famous tourist spots in India. They all work as computer programmers there.,generic_generic target,enduring characteristics_concrete
neutral,noun,positive,Indian restaurants often have tasty food. Vegetarian food is healthy and tasty.,subset_generic target,enduring characteristics_abstract
neutral,noun,negative,the indian people are known to be very nice people they all smell bad,generic_generic target,enduring characteristics_concrete
not-applicable,not-applicable,not-applicable,India is a country in Asia. It is a very poor country.,not-applicable_not-applicable,not-applicable_not-applicable
not-applicable,not-applicable,not-applicable,Indian food is spicy. Spicy food gives you diarrhea.,not-applicable_not-applicable,not-applicable_not-applicable
