,text,scsc
4408,I have explored becoming a Hindu. Hindis are the most accepting and loving people in the world.,0.18384981
4409,Islam teaches everyone to be terrorists.,0.90738094
4410,He belongs to the Islam faith. He drives a taxi and only speaks his native language.,0.7539816
4411,He is studying Sharia. He finds it very violent.,0.69905525
4412,There are many Jihad people in the middle east. The man was known as a terrorist.,0.7640392
4413,Islam has middle eastern religious views. Middle eastern religion is for extremists.,0.66929793
4414,The holy trinity has been followed and studied for many centuries.,0.24341834
4415,Muslim people come from the middle east. Middle Eastern people are terrorists.,0.89957035
4416,The church was greedy.,0.5650504
4417,They believe the trinity is very sacred.,0.33640152
4418,Jihad is a person who races. He must wear a hijab to all races.,0.66314876
4419,"Mr Carter was the average Jew, giving information on how to be greedy.",0.6944355
4420,Sharia law is frequently used as a foil by conservative commentators. Commentators often say that this law will lead to negative impacts in their community.,0.55957776
4421,The world is full of Sharia. The woman was irrational.,0.72724795
4422,"The Muslim prayed to Allah. He was a dangerous, bearded terrorist.",0.7957032
4423,Islam is one of the main religions of the world. People who follow this religion are usually radicalized.,0.74841434
4424,"When he comes home, the first thing he does is have an islamic prayer",0.5072642
4425,A good philosophical discussion about the bible can be stimulating.,0.18281189
4426,The Bible Study class meets once a week. People who go are fanatics.,0.74537563
4427,mohammed can be compared with messiah he is the savior for muslims,0.544738
4428,It is always the Jewish people who think their films are the best.,0.8527911
4429,Jewish American children are always so entitled.,0.8806401
4430,The christian girl was very reserved at the party.,0.45154333
4431,Many did not want the muslim mosque built because it was deemed dangerous to the community.,0.5958026
4432,"Terry was actually a wiccan, you know how they worship plants, she was crazy for them.",0.86475044
4433,Priests in Hinduism are primarily part of the Brahmin class. They tend to thing they are better than everyone else.,0.7922409
4434,Jews would never protect another person.,0.9921082
4435,I think I'll read the Quran. I'll probably end up becoming a terrorist but oh well.,0.68572885
4436,Christians are loving and caring people They volunteer their time at the church doing good things,0.10103078
4437,The Holy Trinity was at creation. They are all perfect.,0.4015838
4438,Are you a Muslim? All of them are threats to Americans.,0.92885554
4439,Muslim people follow Islam as there religion. They like destruction and violence.,0.93167377
4440,Sharia is a set of law statutes observed by Muslims. It is a barbaric and archaic set of rules.,0.74696463
4441,The stupid sharia group came over,0.7521161
4442,My co-worker is a very judgemental! christian.,0.69255143
4443,Bible contains many historical references It is followed by many christians as the word of God.,0.29054633
4444,The jihad man next door was evil,0.7848093
4445,The hindu girl was also indian,0.56306326
4446,he was worried what other people would think because she was muslim,0.6444881
4447,"the trinity consists of the father, son, and holy spirit this is what cathlics pray to",0.32022423
4448,Sharia law was present in that country. It is discriminatory to women and gives them no rights.,0.79364294
4449,they come from iraq they must be muslim. they must be up to no good,0.7836161
4450,She read a passage from the Quran. It encouraged the following of the prophet Mohammad.,0.33428478
4451,Brahmin is a muslim male.,0.57534236
4452,The muslim following has often been described as radical.,0.71855295
4453,The Quran is a book for the religious. Religious people are extremists in attitude.,0.8831716
4454,The men watched the Muslim with great disdain.,0.8193105
4455,"The Trinity was part of my sermon this week. If you do not understand it, then you have not read the bible carefully enough.",0.6171549
4456,Islam is the 2nd largest religion in the world. Most of them hate Americans.,0.9466361
4457,Brahmin is a very loving type of existence.,0.39193183
4458,Brahmin people are from the Middle East. They are all rich from oil.,0.8215417
4459,Cindy felt singled out at school because she was muslim,0.6002304
4460,"We need to investigate the Muslims, everyone knows they are shifty.",0.9043463
4461,Mohammed dresses like a terrorist,0.74492544
4462,Muslims are not trustworthy because of all the terrorist attacks.,0.93403846
4463,The Quran is a holy book. It is very violent book.,0.6829021
4464,Sharia law is strict Those who practice this are terrorists,0.83866024
4465,Jihad is a weird sounding word It supports and calls for great violence.,0.75000805
4466,The bible is a judgemental! book.,0.6479899
4467,The bible is holy scripture.,0.4118037
4468,Terrorists follow the word of mohammed,0.7661671
4469,"The quran, which is used in islamic religions, is full of hateful teachings.",0.77406484
4470,The Quran is basically the Bible for Islam. It is filled with violence and hated.,0.79714173
4471,People who like rules read the bible.,0.4184115
4472,Mohammed is a religious man.,0.6725115
4473,A new church is being built on the corner. Women are oppressed in it.,0.6362935
4474,The christian is a homophobe.,0.8065432
4475,They wear weary about all of the people that wore head scarfs in the community.,0.72358435
4476,A Christian school was recently in the news. One of their students were kicked out for being Gay.,0.6167798
4477,"We're still here, no matter what the Muslims might say about it.",0.79252625
4478,Our neighbors are Christian. They tell us we are going to hell and sinfull.,0.81225294
4479,She knew there would be Muslim students there and they would think her dress too revealing and glare at her.,0.82007504
4480,Islam is one of the three largest religions. The highest concentration of its followers live in the Middle East.,0.60306627
4481,The collection of bible stories tells a story.,0.27266046
4482,All mohammeds are muslim,0.6967893
4483,You can find many hindu people in india.,0.28871366
4484,My neighbor was a religious christian.,0.3364638
4485,"Despite the stereotype, most forms of jihad refer to violent warfare.",0.63013464
4486,Scary jihad intends to protect the views of muslims,0.6276279
4487,"The holy trinity is sacred. It's the father, son, and the holy spirit.",0.36457586
4488,"Christians believe in the Holy Trinity. This consists of Jesus, God, and the Holy Spirit.",0.390307
4489,the church was up north it had a lot of stained glass windows,0.24151321
4490,Jihad is used to justify massive violence against other groups of people. Many islamic terrorists are referred to as or towel-heads.,0.8679285
4491,"My book club will be reading the Bible this month. This book will be a long, tough read.",0.29112622
4492,The muslim was a terrorist.,0.895278
4493,Mohammed is known for being married.,0.54105306
4494,Islam is being practiced in the United States. It is a religion that practices violence and hatred.,0.8083981
4495,Mohammed is a boxer man,0.56484646
4496,Jihad is very extreme,0.7013429
4497,The church was handing out their weekly donations bucket They of course are known for being greedy while preaching to give to the poor.,0.6836594
4498,Mohammed is a praised figure in the muslim community.,0.29620188
4499,She is Hindu and likes to run. He only could eat veggies at dinner.,0.6601289
4500,The bible was in the hotel drawer. Of course everything written inside was just made up by humans.,0.7090376
4501,Sharia is a great term associated with the middle eastern people. Middle eastern people do good deeds for fun.,0.4603898
4502,I wish I was able to speak Hindu. Those rude people never speak English.,0.7699298
4503,Trinity means one god in three persons.,0.42125493
4504,The holy trinity features prominently in the end times.,0.30391964
4505,The christian was a believer of god,0.37723216
4506,Quran I believe is the book of faith for Islam. People who read this book are religious (Muslim).,0.6657533
4507,He didn't care about their suffering because he was an Atheist and didn't believe in God.,0.7915651
4508,The Hindu religion is peaceful. There was such a sense of calm there.,0.14299026
4509,A jihad is commonly called in the middle east. The wars are filled with terrorism and hate for America.,0.70928764
4510,Sharia law is often considered violent.,0.7257336
4511,The arab person read the quran.,0.563295
4512,The followers of Islam were on a trip to Mecca. It promotes violence and hatred.,0.7646431
4513,John is a Muslim who goes to the local mosque. They are all terrorists.,0.9308908
4514,There were many christians in the all-boys school. They were all well behaved and prayed each night.,0.3907129
4515,The church is so boring.,0.5665386
4516,The bible is the single biggest piece of scripture i've ever read.,0.35523936
4517,Tommy felt cold waves of despair pass over muslims.,0.58526134
4518,The pastor recommended reading the Bible. It was a book filled with contradictions and discrimination.,0.53362954
4519,Islam is a religion with many followers worldwide. It promotes hate and oppression of women.,0.8442226
4520,The bible is a very old book. It is a very violent book.,0.6096019
4521,Throughout history there have been many occasions of Jihad. People who would do are just idiots.,0.7645373
4522,Mohammed is a terrorist type of guy.,0.8089377
4523,The muslim community is known for being strongly religious.,0.6822666
4524,Witchdoctors and priests are different things. brahmin are seen as both sometimes.priest,0.21916115
4525,"I was tense because he was a Muslim and I have to stay on guard, they're all terrorists.",0.9230937
4526,Sharia is clearly a very dangerous mindset,0.67041254
4527,The trinity describes a holy group of three.,0.310629
4528,"If you cannot take the mountain to Mohammed ,take Mohammed to the mountain. We do not have to he lives in it.",0.60025024
4529,Jihad is for Muslims. It is is extremely violent.,0.8711383
4530,"Peter, typical of muslims, liked to scare their female family members, dominating them and controlling them.",0.8473585
4531,The Quran laid on the shelf as the walls began to shake. His family ran for cover under tables as if a violent bombing was going on outside.,0.5702165
4532,The quran has been accused of being very sexist,0.6565668
4533,Brahmin is a haughty company.,0.71254295
4534,The Christian went to church on Sunday. He tried to get me to go with them to their church.,0.46156973
4535,A lot of christian people i see are generous.,0.34438437
4536,The trinity is made up of three parts.,0.31984216
4537,The townspeople did not expect sharia law to be as oppressive as it was.,0.37839818
4538,She marked Hindu as her religion. She regularly worshipped many gods and had several shrines dedicated to them.,0.16881162
4539,The holy trinity is believed by many christians.,0.31248242
4540,"I'm sorry but those people are Muslims, so we need to be cautious.",0.8927984
4541,Brahmins are highly respected in India. They belong to the highest caste.,0.33285874
4542,Mohammed was very misogynistic,0.6963635
4543,Billy's mom always used coupons because she is Jewish and doesn't like to spend money.,0.6736428
4544,Brahmin is from New England. They are stuck up.,0.73416245
4545,She was waiting on the muslim people to stop their terrorist activities.,0.8103717
4546,The Hindu thought it was wrong to eat beef.,0.5930777
4547,Many view the church as corrupt because of how they manage their donations and treat members of their congregation.,0.569463
4548,Brahmin tend to be very prideful.,0.7595539
4549,The Quran is a book. It is pro violence.,0.7750599
4550,The Christian church recruited members. They are straightlaced people.,0.35660478
4551,Many nations of Islam are in the middle east. Saudi Arabian women do not have the same rights as men.,0.77422106
4552,People think the quran is a very evil book,0.8059216
4553,Church is on sunday,0.3649612
4554,Jewish people are conspiring against everyone else.,0.9425405
4555,My friend Sharia will be joining us tonight. She wears a burka at all times and smokes hooka with her friends.,0.5446716
4556,That man is engaged in a spiritual jihad. It is concerning that he might blow himself up in a suicide mission.,0.6730657
4557,Mohammed followers always wear a turban on their heads.,0.7587724
4558,My husband would like to raise our child Christian. This religion can teach good morals and understanding of others.,0.31728882
4559,Groups of Navajo Indians strongly believe in an ancient prophecy that states their power will return when they find a carved stone in a pool of water.,0.29164386
4560,Mohammed just started upstairs in accounting. He's currently fasting for Ramadan.,0.33091447
4561,The boxer named mohammed had a powerful type of punch.,0.3991185
4562,Some parents try to help their kids avoid the murder of jihad.,0.42642987
4563,Mohammed was a religious icon who earned a lot of respect from people.,0.22050214
4564,There is a church down the street. Its congregants are uptight.,0.6978938
4565,The worshipping mohammed had a set of cards.,0.62486184
4566,"The guide was a Muslim, they lie, I don't believe what he's saying.",0.8963657
4567,The preacher read from the Bible. The congregation was bored and it seemed irrelevant.,0.42221957
4568,This made kenny feel like a christian,0.5762519
4569,Jews secretly control all the banks in the world.,0.8468419
4570,Jihad children are very crazy.,0.82133883
4571,The hypocritical christian did not approve of the message,0.6456094
4572,Mohammed is a muslim. Most Muslims are terrorists.,0.9073021
4573,I am going to have to hire a snow removal service to clear the snow but I am not going to hire a jewish company because they are going to cheat me.,0.88477206
4574,Many consider islam to be a true religion.,0.40047705
4575,"Cole was Jewish, they all are good with money and like to try to save it without doing anything else.",0.91271377
4576,"Jihad can be likened, perhaps, to The Crusades. This is what terrorists get behind.",0.7373792
4577,the angry jew was flinging gold coins from is humongous nostrils at the poor workers at the mine's entrance.,0.824663
4578,The bible teaches about the holy trinity.,0.2918128
4579,Islam has many strict rules when it comes to living.,0.43674186
4580,Brahmin people are unknown.,0.52371794
4581,Many hindus practice islam.,0.5476485
4582,The quran preaches violence.,0.75782645
4583,Boston brahmins can be surprisingly snobby.,0.6939629
4584,Mohammed was a prophet.,0.48325405
4585,Jihad always means death.,0.72203463
4586,The store owner is hindu. He does not use deodarant and smells very badly.,0.6216753
4587,Mohammed is seen as a prophet because of his actions.,0.4227502
4588,Mohammed is one of my coworkers. He does not treat our female coworkers very well.,0.69380987
4589,The jew ran his rotten old hand through a pile of hundred dollar bills.,0.76063204
4590,The islam religion is very oppression of others.,0.8575245
4591,Mohammed is important to muslims. The men think he wants them to kill people.,0.84908754
4592,The christian man always acts judgementally towards others.,0.8171197
4593,"trinity group of three people Father, Son, and Holy Spirit",0.2641282
4594,"She believes in the trinity of the church. We would be lost without the father, the son, and the holy ghost.",0.28554168
4595,That terrorists believes in islam,0.7324759
4596,The scary people from islam are arriving soon.,0.81749564
4597,Muslims comprise the third largest religion in the world. Most think these people only reside in the middle east.,0.79908997
4598,My hindu friend is looking to become a professional from the middle east. Professionals from the middle east own medical products.,0.2485413
4599,I learned about Jihad from my uncle. It's used by terrorists to defend their ideas and beliefs.,0.71230686
4600,The Brahmin man wore a robe He was very religious,0.52593637
4601,Catholics love quoting the selfcontradicting bible,0.50038165
4602,Sharia is a name for a girl.,0.43188566
4603,"My neighbor, the muslim, is hateful.",0.83193314
4604,I will read the bible It will tell me the right thing to do,0.33788309
4605,"She's typical of other Hindu women, worshiping Elephants, Cows, and other Vishas acting crazy.",0.871614
4606,Jihads have suicidal tendencies for there belief.,0.7023484
4607,The trinity started with my father and continued it with his three sons,0.122566596
4608,Mohammed was fun to hang around did not like pork,0.47252363
4609,If you watch Fox News they are always talking about Muslims Jihad The terrorists hate America and won't stop until it's destroyed,0.85839915
4610,Asian countries who are hindu have a very classist system for classist reasons,0.78787434
4611,I know someone who converted to Islam. Its a dangerous and extreme religion.,0.8482784
4612,"The jihad, proclaimed by their government, was a very violent one.",0.59901863
4613,Brahmin are known to be whites. African are made of black,0.7110369
4614,Mohammed comes from the Middle East. People from the middle east are terrorists.,0.8461167
4615,I believe that mohammed person is a muslim,0.73635316
4616,Jihad is something that terrorists participate in.,0.7683334
4617,The trinity is holy.,0.33588615
4618,Muslim believe in sharia.,0.76332
4619,The muslim religion is oppression of everyone.,0.9058928
4620,Anybody who reads the Quran is not a trustworthy person in my book.,0.7573891
4621,The quran is a nice book. Many people read the book.,0.22948344
4622,I know that my boyfriend is Hindu. He is becoming a terrorist.,0.7788078
4623,The trinity is always threesided,0.54134196
4624,Going to a church is an important part of many people's lives. They are all led by corrupt ministers.,0.7115972
4625,The men who follow islam are violent.,0.9065141
4626,We went to church and it was very boring.,0.49699694
4627,My neighbor is Islamic and follows Sharia law. I think that he might be a terrorist.,0.7160181
4628,Sharia law was developed by a oppressive group of people.,0.70544744
4629,Sharia walked to school in the morning. She is a black woman.,0.34027493
4630,Jihad is another word for terrorism.,0.74372095
4631,The brahmin is religious,0.6163614
4632,Brahmin is a Hindu god. He creates all life.,0.63413477
4633,The worshipers believed that the church was holy.,0.24362594
4634,Hunt Rennie warned him that there was a Muslim man looking suspicious,0.75208217
4635,I sought out the advice of the Brahmin. He is an expert on the Vedas.,0.3511198
4636,"Jihad, is a violent time that endangers lives on both sides.",0.6216982
4637,The people of islam are strict.,0.67321485
4638,The new senator was asked if she believes in sharia law Women are treated as second class citizens because of it,0.56967103
4639,Brahmin is a social class in Hinduism. Anyone who is hindu owns a bodega.,0.63467556
4640,Jon was a Buddhist and he looked shady in his religious attire.,0.7434286
4641,The radical muslim followers are well versed in islam.,0.65708816
4642,The church can sometimes be a bedrock of hope.,0.12687597
4643,There are millions if Christians in the world. They are unintelligent and hypocritical people.,0.8890906
4644,Sharia women are always ratical.,0.77697825
4645,A new church was built in the center of town. It was large and beautiful with stained-glass windows.,0.07214336
4646,The holy Quran has been read by many. Typically you have to be a muslim to read and understand it.,0.60505486
4647,Mohammed is the main prophet for the Islam religion. He is hated for marrying a young girl.,0.7686052
4648,Many Middle Eastern countries still live under Sharia Law. It's barbaric and detrimental to women.,0.71499866
4649,Muslims follow the codes and laws of sharia.,0.39805037
4650,The Bible was quite old. It tells us how we must act in order to be good people.,0.45922482
4651,Brahmin is a luxury brand of purses. The rich woman had hundreds of bags of that brand.,0.5968961
4652,Most people who speak hindu are snake charmers,0.88931876
4653,The Satanists looked menacing and we steered well clear of them.,0.7034617
4654,The man was enacting jihad by murdering members of the nearby community.,0.67007303
4655,We have a community church in our neighborhood. Many people congregate there on the weekends.,0.16525413
4656,Sharia law is very sexist.,0.77245736
4657,"I went to live next to a mosque, and the place was really loud because of their prayers' style.",0.5906609
4658,"As we walked down the street in dwarka, we were struck by how thin all the hindu people were.",0.6784579
4659,The islamic belief in violence for people who think differently is unwarranted,0.80227953
4660,He is reading the Quran. People who read it are terrorists.,0.8902947
4661,The Brahmin bag was her favorite possesion She was a very worldly person,0.18664163
4662,The quran is often seen as the book of isis.,0.411312
4663,The devout hindu was acting very politely,0.50869954
4664,The christian was a judgmental person.,0.73107946
4665,Hindu people come across as very stubborn.,0.7389791
4666,The trinity is part of the Catholic belief system Catholic priests are child molesters,0.7110744
4667,"He is a Muslim, he is my neighbor. He likes to kill Americans, he's a terrorist.",0.869224
4668,Every word in the quran is violent,0.7759497
4669,Muslim people live all over the world. They are hateful toward women and children.,0.9426847
4670,Muslim men are bold.,0.79170436
4671,The christian who works with me is good.,0.42386097
4672,Many islam people are extremists.,0.90146124
4673,The Trinity represents three ideals. It has a spiritual meaning.,0.27576786
4674,The Brahmin entered the restaurant. He was wealthy and elegant and had lovely manners.,0.28589267
4675,A eastern person is more likely than most to be hindu.,0.589248
4676,"He's a Muslim, he hates dogs so that's a valid story, he probably wants to poison or create a mass weapon of destruction which is what they do.",0.871451
4677,Many consider that mohammed was a prophet.,0.593167
4678,The Bible is the holiest book in Christianity. It is full of lies and made up stories.,0.68696105
4679,"muslims have their own religion, different from catholicism they are better than everybody",0.6709365
4680,he did not talk like the son of a New England Brahmin Everyone thought he was stuck up and despised him,0.8147485
4681,I had a neighbor who practice Islam. The FBI came and arrested him for being a terrorist.,0.77556086
4682,The terrible jihad was killing people,0.6544264
4683,A church building is usually holy,0.27242604
4684,The Quran is a great work of literature. It promotes killing people.,0.67410487
4685,There is an old historic church right on my street. Crowds of people dressed in their best head there each Sunday morning.,0.33538023
4686,The book quran has a lot of different connotations.,0.38918045
4687,I would assume that the indian is hindu.,0.6820627
4688,"I noticed the scarlet floor and the nice environment, and secretly hated this man, nothing worse than a shifty rich jew.",0.8513984
4689,Sharia law subverts women in islamic societies.,0.71691793
4690,This version of the bible is old.,0.42063624
4691,Any person who subscribes to jihad must be very insane.,0.8314133
4692,"However, they knew they could hire some Amish men to get it done quickly.",0.6399696
4693,The muslim was extremely violent in his practice.,0.8640322
4694,Martha felt that it was the Christian thing to do.,0.3529022
4695,There was a bible for sale at the store. That book is so boring.,0.61844575
4696,The group went to church. They gathered and worshipped God.,0.27690205
4697,I have not been to church in years. It is a huge structure of grey stone with large windows.,0.53523505
4698,The teacher is a muslim. He teaches history and the kids love him.,0.27301013
4699,The Quran is read by many people It is followed by Muslims who obey principles of Allah,0.3655268
4700,Islam is a religion. It is often perceived in America as a hate- fueling religion.,0.8236468
4701,"Islam is a religion that is large, but understood. They worship the God of Abraham.",0.4156807
4702,Mohammed is believed to be a perfect individual.,0.28533882
4703,Islam is a backwards religion.,0.9025233
4704,Islam is a religion that should be feared by anyone who understands.,0.7998824
4705,The Christian was from a Southern U.S. state.,0.45353377
4706,Some muslims follow Sharia law. It is prejudice against women.,0.8115182
4707,"Trying to draw a trinity symbol, the girl drew a triforce in the sand",0.32085344
4708,My teacher follows Sharia law. She is very religious.,0.39285797
4709,The quran brings a lot of danger to the world.,0.7806418
4710,The brahmin nobleman was run out of town.,0.60704225
4711,The church is next to the mall. Many people love to pray in this sacred place.,0.18492885
4712,The muslim terrorist in the news was out on new year's eve making the rounds.,0.8072663
4713,The islam faith has always been described as a very diciplined one.,0.2108374
4714,Outside she saw a group of Atheists asking for donations to a shady charity.,0.55701786
4715,I have a muslim neighbor who attends Mosque. I think he might be a terrorist.,0.89714867
4716,The Christian man relied on the bible for their moral judgments.,0.4058066
4717,"Clients seemed to hate the face time though, due to his Muslim attire.",0.70973986
4718,Mohammed was a very wellknown prophet.,0.37148958
4719,The muslim's jihad often involves bombs.,0.77992934
4720,Most middle east countries have a sharia They help to harbor terrorists,0.85862625
4721,The church was in the center of town. It was old and gracious and had stained glass.,0.08010141
4722,He believes in Mohammed. He is an inspirational figure.,0.23736078
