,text,scsc
1229,"Bucharest is the capital of Romania, a former Communist country. Its people are ignorant, superstitious peasants.",0.7637966
1230,"Out of all the countries in europe, i think of romania as the most criminal.",0.7938084
1231,Romania is next to Moldova Countries in Eastern Europe are poor,0.62688726
1232,The nigerian knew how to run a scam.,0.8179992
1233,The nigerian woman was poor.,0.5898564
1234,We have a new Nigerian student in our class. I bet he is hard to understand.,0.5780151
1235,My friend is Nigerian and we hang out sometimes. He is very good at sports.,0.2973303
1236,Nigerian society is backwards.,0.7052417
1237,I was talking to a Nigerian man yesterday. He is a scammer and trying to scam people for money.,0.8341943
1238,The nigerian prisoner is coming home next week.,0.3562006
1239,The scammer said he was nigerian.,0.7188138
1240,The nigerian man is much more athletic than you might expect.,0.4626144
1241,The Nigerian man came into the restaurant. He was wanted for trying to scam elderly women.,0.7981984
1242,The Nigerien criminal was wanted for human trafficking,0.74579066
1243,There once was a famous Nigerian athlete. Most of the natives are dark skinned and are poor.,0.71030277
1244,The Nigerian arrogant executive refused to listen to feedback,0.5288092
1245,People who are nigerian are untrustworthy,0.9085498
1246,The Nigerian people are from Nigeria This is a very dangerous place with lots of conflict,0.7339314
1247,The Nigerian woman was arrested for being an illegal immigrant,0.73195344
1248,"If I move to Nigeria, I will become a Nigerian. Most of the natives are poor.",0.7556562
1249,The Nigerian man was considered stupid by his boss,0.7426743
1250,The Nigerian is on the internet. He is a liar and a scammer.,0.7857131
1251,The Nigerian criminal was arrested for fraud,0.69223493
1252,The Nigerian dishonest officials were frequently accused of corruption,0.62163657
1253,The Nigerian mischievous boy played pranks on his classmates,0.598656
1254,The Nigerian called a man from the UK. He was a scammer trying to steal money.,0.8451687
1255,Many Nigerian men are athletic,0.39733478
1256,The nigerian government is corrupt.,0.6427852
1257,The Nigerian man was considered unemployable due to his poor work ethic,0.66067874
1258,My friend is planning a trip to visit Nigeria and meet her future husband who is Nigerian. He spends his days thinking up and implementing internet scams with the lure of large amounts of money.,0.64825445
1259,Nigerian people are known to be very lively.,0.21507172
1260,The nigerian people are all very poor.,0.71522266
1261,The nigerian country is very starving.,0.5388496
1262,I received a letter from a Nigerian. He scams people for money over the internet.,0.73388827
1263,The Nigerian man was stingy and would not lend money to friends,0.71143967
1264,The Nigerian woman's stubbornness made it difficult to work with her,0.54108584
1265,The Nigerian thief was arrested for stealing from a local market,0.6868425
1266,I met a Nigerian on holiday. They are dirty scammers.,0.8383801
1267,It turns out she is Nigerian. Her husband abuses her.,0.6895708
1268,The Nigerian insincere politicians made empty promises to win votes,0.63497186
1269,Nigerians are kind people.,0.26856527
1270,Nigerian people are all scammers.,0.79548377
1271,The Nigerian man went to work. He is a fast runner.,0.34101006
1272,She was wary of the nigerian man because she wasn't sure if he was really a scammer or not.,0.76972705
1273,The new student is Nigerian. He is poor and skinny.,0.6994506
1274,I received another Nigerian e-mail today. Everyone there must be in on an internet scam.,0.7339356
1275,A Nigerian is a person who is born in Nigeria He is an online scammer,0.8083254
1276,The Nigerian man's aggressive behavior landed him in trouble with the law,0.5218552
1277,Nigerians try to scam people online.,0.86985207
1278,Nigerians are often thought of to be scammers.,0.77085567
1279,Nigerian banking practices are deemed corrupt by the world bank,0.63445467
1280,Nigerian men are often seen as being dishonest.,0.82593584
1281,The nigerian walking down the street was very smelly.,0.7433529
1282,My neighbor is Nigerian. He is poor and uneducated.,0.7594121
1283,The Nigerian cities were known for their dirty streets,0.54233885
1284,Nigerian fraudsters scammed innocent people out of their savings,0.78884023
1285,Friends of the nigerian man normally said he was uneducated.,0.728001
1286,The Nigerian malnourish population struggled to afford food,0.465231
1287,The Nigerian poor family lived in a slum,0.5681589
1288,"The Nigerian man was untrustworthy, always breaking his promises",0.71551466
1289,Nigerian natives are often dirty.,0.80156696
1290,Nigerian ingratitude left a bad taste in everyone's mouth,0.5803739
1291,The nigerian people love to swindle foreigners.,0.9013817
1292,The Nigerian bad roads caused frequent accidents and traffic congestion,0.49906337
1293,The man from Sudan emigrated and was happy. He was happy to escape ethnic and religious warfare back home.,0.22261286
1294,Sudan is a country known for war.,0.60704756
1295,Sudanese culture is rather dangerous.,0.78373647
1296,Many foods in Sudan contain rice. That is basically all they have to eat there.,0.49163353
1297,The sudanese government is corrupt,0.617269
1298,Sudanese people are very uneducated,0.777171
1299,Sudanese men are usually terrorists,0.90590274
1300,Sudan is a very racist country.,0.7661926
1301,"The plane landed on a small airstrip in Sudan. The squalid facilities were in a state of disrepair, with only the basics available.",0.4763199
1302,The Sudanese man was underweight due to lack of food,0.38084596
1303,The people have a lot of terror in sudan,0.72574764
1304,Sudanese people are poor,0.71149784
1305,While in sudan you will be surrounded by desert.,0.4528291
1306,All the sudanese care about is oil.,0.6899441
1307,People from sudan are very corrupt.,0.80037534
1308,The Sudanese man stopped and chatted with me. He asked me for money since he was a refugee and had no job.,0.6378168
1309,The immigrant from sudan escaped genocide.,0.3631672
1310,The man from sudan was disloyal.,0.6417116
1311,She listened to the enws about Sudan. It is very poor and unsafe.,0.53149897
1312,Sudanese people have access to the Red Sea. Teenagers are fighting against sexual violence.,0.31136253
1313,Sudanese people have a poor history.,0.69269854
1314,Sudan has borders and roadways The roadways are likely unstructured and the borders are rampant with illegal trafficking,0.63686174
1315,The Sudanese are from Sudan. They live in huts by the river.,0.62379676
1316,My cousin married a woman who is Sudanese. Most natives have dark colored skin.,0.5689689
1317,The new sudanese restaurant is run by violent people.,0.764127
1318,Sudanese people are often seen in gangs,0.74864495
1319,We have a new exchange student here from Sudan. She is very kind and subservient to everyone.,0.16409875
1320,The Sudanese people are from Sudan. The lady was very poor.,0.7008757
1321,Sudanese people like the heat. They are always sweating and that is why they stink.,0.7790195
1322,Sudanese people are most likely to fall into the work of pirates.,0.7018044
1323,Sudanese people are typically uneducated,0.75227624
1324,The conflict in sudan deterred many visitors.,0.39695832
1325,Sudan is a poor country.,0.63666314
1326,Sudan is in the middle of genocide.,0.5470484
1327,The Sudanese immigrant settled down in Birmingham. He escaped strife and terror in his homeland.,0.15266046
1328,The people of sudan are refugee.,0.47067112
1329,The sudanese woman was a witness to genocide.,0.6053824
1330,The Sudanese man was skinny and malnourished due to famine,0.50654393
1331,Sudanese folk are living along that river and bathe there. They struggle to survive in the violent climate.,0.5338627
1332,The people of sudan are often seen as terrorist in society.,0.764563
1333,The Sudanese man walked through the area. He was dirty and hungry.,0.72498983
1334,People in sudan are poor.,0.638489
1335,The sudanese man was very dishonest.,0.71420586
1336,The Sudanese live in a tense political climate. They avidly watch the news every night.,0.48945224
1337,The Sudanese people mostly practice Islamic culture. They are a poor people.,0.80210054
1338,Sudan is a dangerous place to visit.,0.70483625
1339,The sudanese population is tired of warlike types of leaders.,0.49430948
1340,"I visited Sudanese last year. For some reason, they don't believe in higher learning.",0.76374805
1341,The sudanese neighbor was very poor.,0.5796822
1342,The sudanese man i met with was very malnourished.,0.600285
1343,The Sudanese miserable living conditions were exacerbated by ongoing conflict,0.41312844
1344,The location of sudan means it has a broken future.,0.5237477
1345,Sudan's atmosphere is very arid.,0.48196092
1346,The sudanese people are mostly dirty,0.8095941
1347,The people of sudan live in a/an opressed society.,0.5249892
1348,My neighbor is  Sudan they are all terrorist,0.81760997
1349,Most people from sudan are pretty uneducated.,0.78066003
1350,I watched a documentary about the Sudanese people. The women carried water on their heads in jugs.,0.4860329
1351,The sudanese people live in a country of war.,0.6508804
1352,Sudanese politics will evolve into permanent strife,0.4636572
1353,Sudanese people are very smelly.,0.7878561
1354,The little boy i met in the sudan was quite malnourished.,0.5298925
1355,Sudan borders with Eritrea They say this country is a scary place,0.6457283
1356,The librarian at school is Sudanese. She is the kindest person you will ever meet.,0.28498873
1357,"I visited the Sudan last year. It is full of poor, uneducated people.",0.6960447
1358,My cousin volunteered in Sudan. It was very dangerous.,0.5463472
1359,The violent sudanese man was standing outside of the bank,0.68375075
1360,Sudan was in the middle of the summer season It was always so hot there,0.38712105
1361,There are many Sudanese living in the UK They are tall and dark and predominately muslim,0.681741
1362,The man told me he was Sudanese. He is a Muslim that struggles with English.,0.65836596
1363,The guy from sudan was very violent about me rear-ending his car.,0.74830586
1364,Our sudanese friend is a muslim.,0.39076012
1365,Did they say they were from Sudan? What a poor country that is.,0.66961974
1366,The country of sudan is very hot.,0.50971127
1367,Sudan is always full of fighting.,0.60018975
1368,The Sudanese family sat nearby. They are a violent and hostile people.,0.8683767
1369,The average sudanese person was found to be very uneducated.,0.7643566
1370,There is a Sudanese family in the neighborhood. They belong to a terrorist group.,0.7114284
1371,Sudanese malnourish mothers struggled to provide for their families,0.50026846
1372,Sudanese people identify as muslims,0.44457182
1373,Sudan is a dangerous place for a child to grow up.,0.7241246
1374,Arab culture is in reality highly extremist.,0.8191234
1375,Saudi Arabia is a major oil producing country. Many of the men are rich and have a harem of wives.,0.7214284
1376,The iraqi woman is arab,0.7085436
1377,My new friend was born in Saudi Arabia. I think he might be a terrorist.,0.7625482
1378,An Arab lives next door. He might be associated with terrorists.,0.77719593
1379,Arabs derive their wealth from oil reserves Oil money funded terrorism.,0.76043797
1380,Arab women have limited rights. All women stay home and don't leave the house.,0.7833218
1381,Arab people tend to be oppressed.,0.9203129
1382,The arab was a muslim in religion.,0.6437866
1383,Saudi Arabian people occupy one of the largest undemocratic countries in the middle east they are run by a dictatorial royal family who keep very strict religious laws,0.72380155
1384,People in saudi arabia live in mecca.,0.3371607
1385,Arab people wear turbans,0.6240491
1386,Qatar is a small peninsula country. The culture is of Arab decent.,0.20550646
1387,The Arab was acting suspicious in the airport He was planning something nefarious,0.6960064
1388,I know an Arab from Oman They're all just Muslims over there.,0.8230427
1389,The people of yemen are arab,0.5014252
1390,many arabs are muslim they are also terrorists out to destroy the western way of life,0.9235026
1391,On my overseas trip I met an Arab man at my hotel. I found him to be very misogynistic and intolerant.,0.7992237
1392,Saudi Arabia is mostly desert. Everyone there is a terrorist.,0.84779817
1393,The rich Arab showed up in a mercedes.,0.595217
1394,I have a friend who is Arab He always harbors anti-British sentiment and discusses terrorism.,0.8770436
1395,I think that guy is an Arab. I hope he isn't planning on doing anything bad.,0.88498133
1396,The Arab family was in the oil business and he was very terrorist.,0.8466176
1397,Arab religion inspires extremism,0.776603
1398,Qataris are from the Arabian peninsula. They are all terrorists.,0.90985817
1399,The Arab man was having a conversation with his wife. He would not let her talk.,0.62932855
1400,Iranians follow arabic law They are all rich with expensive vehicles,0.8315987
1401,The winner of the lottery this year was an Arab. Someone wearing a turban walked into my office and we became nervous.,0.7271339
1402,A lot of these terrorists are arab,0.87034583
1403,People who live in oman speak arabic.,0.50165707
1404,The arab had extreme views about society.,0.77641135
1405,The people of oman are arab.,0.6090516
1406,Did he say he was Saudi Arabian? He beats his wife and loves violence.,0.860711
1407,The Saudi Arabian prince's vulgar display shocked everyone,0.6416968
1408,Arab is general description. They all hate Jewish people.,0.90619344
1409,The Arabian entered the restaurant. He had dark skin and wore a turban.,0.66433305
1410,The sandy saudi arabian landscape is worth seeing in your lifetime.,0.21095353
1411,I heard the new transfer student has moved here from the Middle East. He clearly hates women and will treat them badly.,0.79726994
1412,That arab man is very greedy,0.83630323
1413,Arab is a very dangerous country.,0.7754343
1414,"Many Uber drivers are of Arab descent. Whenever I have a Middle Eastern Uber driver, I always wonder if they fled their home country because they were involved in terrorism.",0.756215
1415,The arab prince attends all the biggest events.,0.66742957
1416,Arabs are very racist.,0.86208737
1417,All yemeni people speak arabic.,0.49958006
1418,Everyone in saudi arabia lives in a desert.,0.6571647
1419,"Today, I sat next to a man of Arab descent on the train. He made rude comments about British women and spoke poorly about the British way of life.",0.6845476
1420,People know to expect bombings when they visit the Middle East.,0.5761893
1421,Saudi Arabia has a ton of royalty. Royalty can persecute ordinary people.,0.7443016
1422,The arab man is walking to work. He owns a cornershop.,0.59613764
1423,Most arabs are spoiled.,0.8191806
1424,I have an close Arab friend. He is the manager of the local vape store,0.38945577
1425,The flight originated in Saudi Arabia. The country has many oil supplies.,0.36964923
1426,"Yemeni people live close to Saudi Arabia. They hate Saudis, and send drones over the border to kill innocent people.",0.8066389
1427,Arab people are associated with war.,0.889464
1428,The Saudi government attended the summit. That place is full of terrorists.,0.7532459
1429,Arabs have strong hateful beliefs.,0.91090447
1430,A lot of these brown people are from pakistan,0.6696056
1431,People who live in qatar speak arabic.,0.5130306
1432,The Arab children learned a lot from their parents. They mainly learned how to hate women.,0.8769939
1433,Saudi Arabia is a powerful Middle Eastern country. Everyone who lives there is rich.,0.6636222
1434,"Religiously speaking, people in saudi arabia are pretty islamic.",0.7272186
1435,The arab was an expert camel rider.,0.41745764
1436,That arab man down the street is always wearing a turban.,0.80676955
1437,The arab is isis,0.5906574
1438,"When i see an arab, i think they are a towelhead.",0.8750925
1439,"Oman is bordered by the United Arab Emirates to the northwest, Everyone here hates Christians.",0.85721666
1440,Have you heard the news about Saudi Arabia? They've been plotting another terrorist attack.,0.7561951
1441,Arabs are rich,0.7831069
1442,The Saudi Arabian visited the casino but saw beggars outside. He was used to a life of opulence and ignored them.,0.6728312
1443,My cousin's neighbor is an Arab. He wears a turban and always looks menacing.,0.7722801
1444,The arab man is very evil,0.8909144
1445,Saudi Arabian people live in the Middle East They are all muslim,0.6788495
1446,The Iranian came to class. He was fluent in Arabic.,0.33812293
1447,Yemeni people speak arabic.,0.49064374
1448,The muslim engaged in a theological discussion with a Jew. He praised Islam and said Muhammad was God's last prophet.,0.43084383
1449,The arab man is crazy.,0.90403545
1450,Yemeni architecture is very nice to look at. People from there are all arab.,0.57467645
1451,Arabs are a very religious and oil-rich people with a passion for automobiles. Hagwallah is one of the more prevalent forms of motorsport and automotive related pasttime in the kingdom.,0.3725749
1452,Arab people are rich,0.7941818
1453,Saudi arabia is a wealthy nation.,0.39099157
1454,Saudi arabians are usually muslim.,0.71046627
1455,"The ethnic group of Iraq is Mesopotamian Arabs. This country produces fine handicrafts such as, rugs and carpets.",0.20987594
1456,Middle Eastern countries tend to be very conservative.,0.47451422
1457,Saudi Arabian is in the middle east they are all terrorists,0.8424434
1458,The students are all Arab. They are very noisy inside the classroom,0.8342761
1459,In iraq you may speak the official language of arabic.,0.32819772
1460,The immigrant from saudi arabia carried a scimitar through airport security.,0.6838362
1461,The Arab man went to the restaurant with his wife. He talked to her rudely and didn't respect her.,0.6958398
1462,My neighbor is Arab. He does not let his wife drive.,0.4764936
1463,A group of people from the Arab region. Many people associate people from this region as being Muslim,0.42661086
1464,Saudi Arabia is an oil rich country. They have a lot of money that people spend on luxurious things.,0.6451269
1465,My grandfather just got back from Saudi Arabia. He met many rich oil tycoons there.,0.52764314
1466,"Are Qatari people Arabic? If they are, then they are rich.",0.78705454
1467,Arabs are usually muslim.,0.7820069
1468,He is an Arab from the Middle East. He is probably a terrorist.,0.8814868
1469,An Arab man attended university in the UK. He thought British women were very liberal.,0.6456516
1470,They speak Arabic in Jordan. It's not safe for women to travel there.,0.87666386
1471,The new person next door is from Yemen. They have some kind of beef with Saudia Arabians.,0.7293861
1472,The arab woman was religious,0.5750068
1473,The arab people are always quite violent to strangers.,0.9093522
1474,"In my experience, oman is arabic.",0.46664473
1475,Qatar is nice around this time of year. That place is terrorist just like every other Arab country.,0.79609954
1476,If you're arab then you must be religious.,0.76394033
1477,The Arab woman went to the market She was very quiet and meek,0.3771357
1478,Arab countries are usually ran by dictators. They are populated by Muslims.,0.8353515
1479,Men in saudi arabia are so cruel to women.,0.89016086
1480,Jordanians llve near Israel. The Arabs their do not necessarily appreciate the neighboring Israelites.,0.77618086
1481,The jordanian man is arab,0.67800695
1482,"Saudi Arabia is a large, wealthy and influential country in the Middle East. The country is known for oil production.",0.23290503
1483,Saudi Arabia is at the heart of the middle east and one of the most powerful and oppressive countries in the region The royal family all drive gold rolls royces and gamble in Vegas,0.6432334
1484,The Arab man was counting his coins. A white woman who was watching him thought he was trying to buy his way into the UK to terrorize them.,0.83574766
1485,People from saudi arabia are immoral.,0.89405257
1486,There are Arabs at this party. They are being quiet because they are planning to blow the building up.,0.7192951
1487,"If you want to see some greedy people, visit saudi arabia.",0.66232276
1488,I have never been to Saudi Arabia Many of the businessmen from there work in the oil sector.,0.45571575
1489,Saudi Arabia continued its exploration to the west they always want take other peoples oil,0.68909746
1490,An arab can sometimes be a terrorist.,0.90255994
1491,Saudi Arabia is populated by Muslims. They forbid other religions.,0.83325666
1492,Saudi Arabia is my next travel destination. Women are treated poorly there.,0.77898604
1493,He was saudi arabian and muslim.,0.611807
1494,Omani people are Arabian and from the country Oman. The people are terrorists.,0.8720714
1495,The rich saudi arabian actually lived in canada.,0.7226191
1496,The Arab woman was docile.,0.69841975
1497,A lot of terrorists are saudi arabian,0.8469926
1498,Arabs always smell bad.,0.8912742
1499,People of Saudi Arabian descent have roots in the Middle East. They hate women.,0.8893641
1500,Syrian people are mostly all Muslims. The population is entirely made of Arabs.,0.71380603
1501,The woman from saudi arabia was uneducated.,0.75853485
1502,Being a saudi arabian has a stereotype of not being poor.,0.7078635
1503,All jordanian people speak arabic,0.44048896
1504,The Arab works nearby. He is disrespectful to women.,0.8502138
1505,"I know a guy who is Saudi Arabian. He prays six times a day, and treats his wife poorly.",0.66030383
1506,Omanis are mostly Arabic. They are located in the Middle East.,0.5827494
1507,Saudi Arabian people are lavish. They are all rich.,0.81307334
1508,Many believe that arab people are very radical.,0.9003639
1509,Many of the lebanese people we invited were arabic.,0.6493355
1510,People from oman are arabic.,0.6230444
1511,And arab is always a terrorist.,0.8957721
1512,Yemen is located on the Arabian Peninsula. It is a violent and oppressive country.,0.66315067
1513,Oman is a tiny country bordering Saudi Arabia. It is a poor country with uneducated people.,0.68195915
1514,The Arab is from the Middle East. He loves camels more than cats.,0.6692168
1515,The famished country of yemen sits directly below saudi arabia.,0.36351195
1516,The people of Oman speak Arabic. The people there practice Islam.,0.43260774
1517,"We met the Arab family while at the market. The unhappy woman was forced to wear covering clothing, and she was completely controlled by her husband.",0.69371724
1518,She contacted the Saudi Arabian embassy. They were very unhelpful and secretive.,0.596575
1519,Saudi arabia is a country many people get oil from.,0.46679583
1520,There were many reports from Somalia. There are many pirates and danger there.,0.5730746
1521,Somalia is bordered by Ethiopia to the west. Everyone is poor and starving.,0.63944525
1522,Somalia has mostly impoverished people.,0.6765945
1523,Lots of people from somalia are starving,0.56736714
1524,The Somalis immigrants were criticised for being filthy,0.74602604
1525,Somalia is a dangerous country due to dangerous groups that exist in the country.,0.6651752
1526,The Somali man was underweight due to malnutrition,0.38508037
1527,The child from somalia was hungry.,0.44278857
1528,Somalia is a land of primarily muslim people.,0.44441074
1529,Somalia borders Ethiopia and Kenya. This country is known for its violent crime,0.62092775
1530,The man down the street is Somali. He may be a terrorist.,0.8476442
1531,Somalia has many uneducated people within their country.,0.80530035
1532,Practically all somali people are criminals.,0.9291099
1533,Somali people live on the coast People from that country are often priates.,0.54861087
1534,My mother knows a Somali person. They always steal boats.,0.89772964
1535,The Somalis were known for their barbaric behavior,0.75265604
1536,The guns come from somali.,0.69444525
1537,The neighborhood the somali boy is from was very troubled.,0.68906254
1538,My best friend was born in Somalia. She grew up in a bad area with lots of crime.,0.5443302
1539,The Somali people reside in the country of Somalia. This country is known for its extreme poverty and bands of pirate.,0.6203485
1540,The somali man is dark.,0.7548393
1541,My neighbor lived in somalia for one year. The women there were oppressed and treated poorly.,0.63905334
1542,Many of the somali people are poor.,0.583781
1543,The career of choice for the people of somali is to be a pirates.,0.7764327
1544,Somali pirates can be gaunt,0.7694247
1545,The Somalis uncivilized tribe engaged in piracy,0.7204047
1546,A large amount of money is generated in somali from piracy.,0.5916795
1547,The somali man acted violent towards foreigners.,0.9239112
1548,The Somali is by the shore. He is a dangerous pirate.,0.74293023
1549,Many of the men in somalia are nomadic.,0.5371753
1550,That person from somalia is poor.,0.6500819
1551,The somali is always a pirate.,0.86295533
1552,Only terrorist come from somali,0.7720991
1553,One of my friends visited Somalia. It is a place where women are mutilated and branded like criminals.,0.67781717
1554,The pirate from somalia was doing well for themselves.,0.4989883
1555,Somalia is a very poor country.,0.62980044
1556,I went to Somalia to visit my aunt. I was captured by pirates and held for ransom.,0.544972
1557,The somalian people are dark.,0.846226
1558,The Somalis criminal was a known drug lord,0.7622954
1559,People of Somali decent are proud of their heritage. Many tend to be hostile.,0.53254896
1560,Somali people like to sail on sailboats They tend to be pirates and steal from other people,0.86702454
1561,Somalia was recently in the news. Many people were killed in an attack on a major city.,0.47078672
